A1: WEBER APPLICATION
A3: LEGAL REPLACEMENT
A4: 32/36 | B4: LEGAL | C4: 8R 18R | D4: CEL PU | E4: 75-77 | F4: 310 | I4: 538.83 | J4: 323.3 | K4: =J4*0.95 -> 307.13499999999999 | L4: =M4*1.35 -> 327.34800000000001 | M4: 242.48 | N4: K8746 #2
A5: 32/36 | B5: LEGAL | C5: 20R | D5: CEL PU | E5: 78-80 | F5: 310 | I5: 538.83 | J5: 323.3 | K5: =J5*0.95 -> 307.13499999999999 | L5: =M5*1.35 -> 327.34800000000001 | M5: 242.48 | N5: K8747 #2
A6: 32/36 | B6: LEGAL | C6: 22R | D6: CELICA | E6: 81-83 | F6: 310 | I6: 538.83 | J6: 323.3 | K6: =J6*0.95 -> 307.13499999999999 | L6: =M6*1.35 -> 327.34800000000001 | M6: 242.48 | N6: K8748 #2
A7: 32/36 | B7: LEGAL | C7: 22R | D7: PICKUP | E7: 81-84 | F7: 310 | I7: 538.83 | J7: 323.3 | K7: =J7*0.95 -> 307.13499999999999 | L7: =M7*1.35 -> 327.34800000000001 | M7: 242.48 | N7: K8749 #2
A9: UPGRADE PROGRESSIVE
A10: 32/36 | B10: MAN | C10: 3KC | D10: COROLLA | F10: 270 | I10: 471.25 | J10: 282.75 | K10: =J10*0.95 -> 268.61250000000001 | L10: =M10*1.35 -> 286.28100000000001 | M10: 212.06 | N10: K657
A11: 32/36 | B11: ELEC | C11: 3KC | D11: COROLLA | F11: 285 | I11: 498.08 | J11: 298.85 | K11: =J11*0.95 -> 283.90750000000003 | L11: =M11*1.35 -> 302.589 | M11: 224.14 | N11: K662
A12: 32/36 | B12: ELEC | C12: 3AC | D12: TERCEL | F12: 310 | I12: 537.42 | J12: 322.45 | K12: =J12*0.95 -> 306.32749999999999 | L12: =M12*1.35 -> 326.48400000000004 | M12: 241.84 | N12: K740
A13: 32/36 | B13: MAN | C13: 8R 18R | D13: CEL PU | F13: 280 | I13: 487 | J13: 292.2 | K13: =J13*0.95 -> 277.59 | L13: =M13*1.35 -> 295.85250000000002 | M13: 219.15 | N13: K742
A14: 32/36 | B14: ELEC | C14: 2F CABLE LINK | D14: LC | F14: 310 | I14: 542.17 | J14: 325.3 | K14: =J14*0.95 -> 309.03500000000003 | L14: =M14*1.35 -> 329.37299999999999 | M14: 243.98 | N14: K743
A15: 38 | C15: 2F | D15: LC | K15: =J15*0.95 -> 0 | L15: =M15*1.35 -> 0.00 | N15: K743 38
A16: 32/36 | B16: ELEC | C16: 8R 18R | D16: CEL PU | F16: 310 | I16: 539.08 | J16: 323.45 | K16: =J16*0.95 -> 307.27749999999997 | L16: =M16*1.35 -> 327.49650000000003 | M16: 242.59 | N16: K744
A17: 38 | C17: 2F ROD LINK | D17: LC | K17: =J17*0.95 -> 0 | L17: =M17*1.35 -> 0.00 | N17: K745
A18: 32/36 | B18: ELEC | C18: 20R 22R CARB | D18: CEL PU | F18: 280 | I18: 489.42 | J18: 293.65 | K18: =J18*0.95 -> 278.96749999999997 | L18: =M18*1.35 -> 297.32400000000001 | M18: 220.24 | N18: K746
A19: 38 | C19: 20R 22R CARB | D19: CEL PU | K19: =J19*0.95 -> 0 | L19: =M19*1.35 -> 0.00 | N19: K746 38
A21: TWIN SIDE PERFORMANCE
A22: 40DCOE | B22: SINGLE | C22: 8R 18R | F22: 500 | I22: 879.67 | J22: 527.8 | K22: =J22*0.95 -> 501.41 | L22: =M22*1.35 -> 534.39750000000004 | M22: 395.85 | N22: K765
A23: 40DCOE | B23: TWIN | C23: 8R 18R | F23: 950 | I23: 1664.17 | J23: 998.5 | K23: =J23*0.95 -> 948.57500000000005 | L23: =M23*1.35 -> 1010.9880000000001 | M23: 748.88 | N23: K767
A24: 40DCOE | B24: TWIN | C24: 22R | D24: CEL PU | F24: 1000 | I24: 1754.34 | J24: 1052.6 | K24: =J24*0.95 -> 999.97 | L24: =M24*1.35 -> 1065.7574999999999 | M24: 789.45 | N24: K770
A25: 45DCOE | B25: TWIN | C25: 22R | D25: CEL PU | F25: 950 | I25: 1664.17 | J25: 998.5 | K25: =J25*0.95 -> 948.57500000000005 | L25: =M25*1.35 -> 1010.9880000000001 | M25: 748.88 | N25: K771
A26: 45DCOE | B26: SINGLE | C26: 20R CARB | D26: CELICA | F26: 550 | I26: 963 | J26: 577.8 | K26: =J26*0.95 -> 548.91 | L26: =M26*1.35 -> 585.02250000000004 | M26: 433.35 | N26: K775
A27: 45DCOE | B27: TWIN | C27: 20R CARB | D27: CEL PU | F27: 1050 | I27: 1787.67 | J27: 1072.6 | K27: =J27*0.95 -> 1018.97 | L27: =M27*1.35 -> 1086.0074999999999 | M27: 804.45 | N27: K776
A28: 40DCOE | B28: TWIN | C28: 20R CARB | D28: CEL PU | F28: 1000 | I28: 1754.34 | J28: 1052.6 | K28: =J28*0.95 -> 999.97 | L28: =M28*1.35 -> 1065.7574999999999 | M28: 789.45 | N28: K777
A29: 40DCOE | B29: TWIN | C29: 4AG | D29: COR MR2 | F29: 890 | I29: 1547.5 | J29: 928.5 | K29: =J29*0.95 -> 882.07500000000005 | L29: =M29*1.35 -> 940.11300000000006 | M29: 696.38 | N29: K778
A30: 45DCOE | B30: TWIN | C30: 4AG | D30: COR MR2 | F30: 890 | I30: 1547.5 | J30: 928.5 | K30: =J30*0.95 -> 882.07500000000005 | L30: =M30*1.35 -> 940.11300000000006 | M30: 696.38 | N30: K799