A1: Toyota Applications

A1: TOYOTA APPLICATION | B1: FULL LINE | C1: PRODUCT GALLERY

A1: BOMEX TOYOTA APPLICATIONS

A1: Kit Part # | B1: Application | C1: Pieces | D1: Kit Includes | G1: Year | H1: Year | I1: Retail | J1: Sale | K1: Notes
D2: Front | E2: Side | F2: Rear
A3: TS-1222 | B3: AE92 | D3: AD-307 | E3: AD-297 | F3: AD-298 | G3: 88 | H3: 92 | I3: 437.00 | J3: 393.30 | K3: Special Order Only
A4: TS-1223 | B4: AE92 | D4: AD-183 | E4: AD-297 | F4: AD-298 | G4: 88 | H4: 92 | K4: discontinued
A5: TS-0071 | B5: AE92 | D5: AD-295 | E5: AD-297 | F5: AD-298 | G5: 88 | H5: 92 | I5: 546.25 | J5: 491.63 | K5: Special Order Only
A6: TS-0073 | B6: AE92 | D6: AD-296 | E6: AD-297 | F6: AD-298 | G6: 88 | H6: 92 | I6: 570.00 | J6: 513.00 | K6: Special Order Only
A7: TS-0072 | B7: AE92 | D7: AD-292 | E7: AD-297 | F7: AD-298 | G7: 88 | H7: 92 | K7: discontinued
A8: AD-295 | B8: AE92 | D8: Levin | F8: F/BS BM | G8: 88 | H8: 92 | I8: 225.00 | J8: 202.50 | K8: Special Order Only
A9: AD-296 | B9: AE92 | D9: Trueno | F9: F/BS BM | G9: 88 | H9: 92 | I9: 250.00 | J9: 225.00 | K9: Special Order Only
A10: AD-292 | B10: AE92 | D10: Trueno | F10: F/BS | G10: 88 | H10: 92 | K10: discontinued
A11: AD-183 | B11: AE92 | D11: Levin | F11: F/US T1 | G11: 88 | H11: 92 | I11: 110.00 | J11: 99.00 | K11: discontinued
A12: AD-307 | B12: AE92 | D12: Levin | F12: F/US T1 | G12: 88 | H12: 92 | I12: 110.00 | J12: 99.00 | K12: Special Order Only
A13: AD-297 | B13: AE92 | F13: S/S | G13: 88 | H13: 92 | I13: 200.00 | J13: 180.00 | K13: Special Order Only
A14: AD-298 | B14: AE92 | F14: R/UC | G14: 88 | H14: 92 | I14: 150.00 | J14: 135.00 | K14: Special Order Only
A15: AD-299 | B15: AE92 | D15: Levin | F15: F/Grill T1 | G15: 88 | H15: 92 | I15: 100.00 | J15: 90.00 | K15: Special Order Only
A16: AD-300 | B16: AE92 | D16: Levin | F16: F/Grill T2 | G16: 88 | H16: 92 | I16: 100.00 | J16: 90.00 | K16: Special Order Only
A17: AD-301 | B17: AE92 | F17: R/S T1 | G17: 88 | H17: 92 | I17: 190.00 | J17: 171.00 | K17: discontinued
A18: AD-302 | B18: AE92 | F18: R/S T2 | G18: 88 | H18: 92 | I18: 180.00 | J18: 162.00 | K18: Special Order Only
A19: AD-303 | B19: AE92 | F19: R/S T3 | G19: 88 | H19: 92 | I19: 180.00 | J19: 162.00 | K19: Special Order Only
A20: AD-304 | B20: AE92 | F20: R/S T4 | G20: 88 | H20: 92 | I20: 180.00 | J20: 162.00 | K20: Special Order Only
A21: AD-305 | B21: AE92 | F21: R/S T8 | G21: 88 | H21: 92 | I21: 180.00 | J21: 162.00 | K21: Special Order Only
A22: AD-306 | B22: AE92 | F22: R/S T9 | G22: 88 | H22: 92 | I22: 180.00 | J22: 162.00 | K22: Special Order Only
A23: AD-309 | B23: AE92 | F23: A/M T1 Manual | G23: 88 | H23: 92 | I23: 180.00 | J23: 162.00 | K23: Special Order Only
A24: AD-311 | B24: AE92 | F24: A/M T1 Power | G24: 88 | H24: 92 | I24: 240.00 | J24: 216.00 | K24: discontinued
A25: AD-310 | B25: AE92 | F25: A/M T2 Manual | G25: 88 | H25: 92 | I25: 180.00 | J25: 162.00 | K25: Special Order Only
A26: AD-312 | B26: AE92 | F26: A/M T2 Power | G26: 88 | H26: 92 | I26: 240.00 | J26: 216.00 | K26: discontinued
A27: TS-0061 | B27: AE101 | D27: AD-073 | E27: AD-083 | F27: AD-084 | G27: 93 | H27: 97 | I27: 570.00 | J27: 513.00 | K27: Special Order Only
A28: TS-0057 | B28: AE101 | D28: AD-076 | E28: AD-083 | F28: AD-084 | G28: 93 | H28: 97 | I28: 555.75 | J28: 500.18 | K28: Special Order Only
A29: TS-0059 | B29: AE101 | D29: AD-073 | E29: AD-083 | F29: AD-194 | G29: 93 | H29: 97 | I29: 570.00 | J29: 513.00 | K29: Special Order Only
A30: TS-0055 | B30: AE101 | D30: AD-076 | E30: AD-083 | F30: AD-194 | G30: 93 | H30: 97 | I30: 555.75 | J30: 500.18 | K30: Special Order Only
A31: TS-0069 | B31: AE101 | D31: AD-075 | E31: AD-083 | F31: AD-084 | G31: 93 | H31: 97 | I31: 570.00 | J31: 513.00 | K31: Special Order Only
A32: TS-0065 | B32: AE101 | D32: AD-077 | E32: AD-083 | F32: AD-084 | G32: 93 | H32: 97 | I32: 555.75 | J32: 500.18 | K32: Special Order Only
A33: TS-0067 | B33: AE101 | D33: AD-075 | E33: AD-083 | F33: AD-194 | G33: 93 | H33: 97 | I33: 570.00 | J33: 513.00 | K33: Special Order Only
A34: TS-0063 | B34: AE101 | D34: AD-077 | E34: AD-083 | F34: AD-194 | G34: 93 | H34: 97 | I34: 555.75 | J34: 500.18 | K34: Special Order Only
A35: AD-076 | B35: AE101 | D35: Levin | F35: F/BS BM | G35: 93 | H35: 97 | I35: 225.00 | J35: 202.50 | K35: Special Order Only
A36: AD-073 | B36: AE101 | D36: Levin | F36: F/BS w/o LK | G36: 93 | H36: 97 | I36: 240.00 | J36: 216.00 | K36: Special Order Only
A37: AD-072 | B37: AE101 | D37: Levin | F37: F/BS 2 Lite | G37: 93 | H37: 97 | I37: 490.00 | J37: 441.00 | K37: Special Order Only
A38: AD-077 | B38: AE101 | D38: Trueno | F38: F/BS BM | G38: 93 | H38: 97 | I38: 225.00 | J38: 202.50 | K38: Special Order Only
A39: AD-075 | B39: AE101 | D39: Trueno | F39: F/BS w/o LK | G39: 93 | H39: 97 | I39: 240.00 | J39: 216.00 | K39: Special Order Only
A40: AD-074 | B40: AE101 | D40: Trueno | F40: F/BS 2 Lite | G40: 93 | H40: 97 | I40: 490.00 | J40: 441.00 | K40: Special Order Only
A41: AD-083 | B41: AE101 | F41: S/S | G41: 93 | H41: 97 | I41: 210.00 | J41: =I41*0.9 -> 189.00 | K41: Special Order Only
A42: AD-194 | B42: AE101 | F42: R/UC bfr | G42: 93 | H42: 97 | I42: 150.00 | J42: =I42*0.9 -> 135.00 | K42: Special Order Only
A43: AD-084 | B43: AE101 | F43: R/UC aft | G43: 93 | H43: 97 | I43: 150.00 | J43: =I43*0.9 -> 135.00 | K43: Special Order Only
A44: AD-081 | B44: AE101 | D44: Levin | F44: F/Grill T1 | G44: 93 | H44: 97 | I44: 100.00 | J44: =I44*0.9 -> 90.00 | K44: Special Order Only
A45: AD-082 | B45: AE101 | D45: Levin | F45: F/Grill T2 | G45: 93 | H45: 97 | I45: 100.00 | J45: =I45*0.9 -> 90.00 | K45: Special Order Only
A46: AD-415 | B46: AE101 | D46: Trueno | F46: F/Grill T1 | G46: 93 | H46: 97 | I46: 100.00 | J46: =I46*0.9 -> 90.00 | K46: Special Order Only
A47: AD-416 | B47: AE101 | D47: Trueno | F47: F/Grill T2 | G47: 93 | H47: 97 | I47: 100.00 | J47: =I47*0.9 -> 90.00 | K47: Special Order Only
A48: AD-119 | B48: AE101 | F48: A/M T1 Manual | G48: 93 | H48: 97 | I48: 180.00 | J48: =I48*0.9 -> 162.00 | K48: Special Order Only
A49: AD-142 | B49: AE101 | F49: A/M T1 Power | G49: 93 | H49: 97 | I49: 240.00 | J49: =I49*0.9 -> 216.00 | K49: Special Order Only
A50: AD-120 | B50: AE101 | F50: A/M T2 Manual | G50: 93 | H50: 97 | I50: 180.00 | J50: =I50*0.9 -> 162.00 | K50: Special Order Only
A51: AD-143 | B51: AE101 | F51: A/M T2 Power | G51: 93 | H51: 97 | I51: 240.00 | J51: =I51*0.9 -> 216.00 | K51: discontinued
A52: AD-078 | B52: AE101 | F52: R/S T1 | G52: 93 | H52: 97 | I52: 210.00 | J52: =I52*0.9 -> 189.00 | K52: Special Order Only
A53: AD-079 | B53: AE101 | F53: R/S T2 | G53: 93 | H53: 97 | I53: 210.00 | J53: =I53*0.9 -> 189.00 | K53: Special Order Only
A54: AD-080 | B54: AE101 | F54: R/S T3 | G54: 93 | H54: 97 | I54: 220.00 | J54: =I54*0.9 -> 198.00 | K54: Special Order Only
A55: AD-191 | B55: AE101 | F55: R/S T7 | G55: 93 | H55: 97 | I55: 220.00 | J55: =I55*0.9 -> 198.00 | K55: Special Order Only
A56: TS-0212 | B56: AE111 | C56: 5 | D56: AD-360 | E56: AD-357 | F56: AD-358 | G56: 98 | H56: 2 | I56: 579.50 | J56: =I56*0.9 -> 521.55 | K56: Special Order Only
A57: TS-0053 | B57: AE111 | C57: 5 | D57: AD-355 | E57: AD-357 | F57: AD-358 | G57: 98 | H57: 2 | I57: 579.50 | J57: =I57*0.9 -> 521.55 | K57: Special Order Only
A58: TS-0215 | B58: AE111 | C58: 5 | D58: AD-356 | E58: AD-357 | F58: AD-358 | G58: 98 | H58: 2 | I58: 579.50 | J58: =I58*0.9 -> 521.55 | K58: Special Order Only
A59: TS-0213 | B59: AE111 | C59: 5 | D59: AD-361 | E59: AD-357 | F59: AD-358 | G59: 98 | H59: 2 | I59: 579.50 | J59: =I59*0.9 -> 521.55 | K59: Special Order Only
A60: TS-0214 | B60: AE111 | C60: 5 | D60: AD-364 | E60: AD-357 | F60: AD-358 | G60: 98 | H60: 2 | I60: 465.50 | J60: =I60*0.9 -> 418.95 | K60: Special Order Only
A61: AD-355 | B61: AE111 | D61: levin bfr mc | F61: F/BS BM | G61: 98 | H61: 2 | I61: 250.00 | J61: =I61*0.9 -> 225.00 | K61: Special Order Only
A62: AD-360 | B62: AE111 | D62: Levin aft mc | F62: F/BS BM | G62: 98 | H62: 2 | I62: 250.00 | J62: =I62*0.9 -> 225.00 | K62: Special Order Only
A63: AD-356 | B63: AE111 | D63: Trueno bfr | F63: F/BS BM | G63: 98 | H63: 2 | I63: 250.00 | J63: =I63*0.9 -> 225.00 | K63: Special Order Only
A64: AD-361 | B64: AE111 | D64: Trueno aft | F64: F/BS BM | G64: 98 | H64: 2 | I64: 250.00 | J64: =I64*0.9 -> 225.00 | K64: Special Order Only
A65: AD-364 | B65: AE111 | F65: F/US T2 | G65: 98 | H65: 2 | I65: 130.00 | J65: =I65*0.9 -> 117.00 | K65: Special Order Only
A66: AD-357 | B66: AE111 | F66: S/S | G66: 98 | H66: 2 | I66: 210.00 | J66: =I66*0.9 -> 189.00 | K66: Special Order Only
A67: AD-358 | B67: AE111 | F67: R/UC | G67: 98 | H67: 2 | I67: 150.00 | J67: =I67*0.9 -> 135.00 | K67: Special Order Only
A68: AD-359 | B68: AE111 | F68: R/S T1 | G68: 98 | H68: 2 | I68: 200.00 | J68: =I68*0.9 -> 180.00 | K68: Special Order Only
A69: AD-362 | B69: AE111 | F69: R/S T7 | G69: 98 | H69: 2 | I69: 220.00 | J69: =I69*0.9 -> 198.00 | K69: Special Order Only
A70: AD-367 | B70: AE111 | F70: A/M T1 Manual | G70: 98 | H70: 2 | I70: 180.00 | J70: =I70*0.9 -> 162.00 | K70: Special Order Only
A71: AD-369 | B71: AE111 | F71: A/M T1 Power | G71: 98 | H71: 2 | I71: 240.00 | J71: =I71*0.9 -> 216.00 | K71: Special Order Only
A72: AD-368 | B72: AE111 | F72: A/M T2 Manual | G72: 98 | H72: 2 | I72: 180.00 | J72: =I72*0.9 -> 162.00 | K72: Special Order Only
A73: AD-370 | B73: AE111 | F73: A/M T2 Power | G73: 98 | H73: 2 | I73: 240.00 | J73: =I73*0.9 -> 216.00 | K73: discontinued
A74: TS-0219 | B74: Cavalier TJG00 | C74: 4 | D74: UAD-473 | E74: UAD-474 | F74: UAD-476 | G74: 95 | H74: 99 | I74: 598.50 | J74: =I74*0.9 -> 538.65 | K74: 2 door
A75: TS-0220 | B75: Cavalier TJG00 | C75: 4 | D75: UAD-473 | E75: UAD-475 | F75: UAD-476 | G75: 95 | H75: 99 | I75: 598.50 | J75: =I75*0.9 -> 538.65 | K75: 4 door
A76: TS-0228 | B76: Cavalier TJG00 | C76: 4 | D76: UAD-480 | E76: UAD-474 | F76: UAD-476 | G76: 00 | H76: 01 | I76: 598.50 | J76: =I76*0.9 -> 538.65 | K76: 2 door
A77: TS-0229 | B77: Cavalier TJG00 | C77: 4 | D77: UAD-480 | E77: UAD-475 | F77: UAD-476 | G77: 00 | H77: 01 | I77: 598.50 | J77: =I77*0.9 -> 538.65 | K77: 4 door
A78: UAD-473 | B78: Cavalier TJG00 | F78: F/BS | G78: 95 | H78: 99 | I78: 220.00 | J78: =I78*0.9 -> 198.00
A79: UAD-480 | B79: Cavalier TJG00 | F79: F/BS | G79: 00 | H79: 02 | I79: 220.00 | J79: =I79*0.9 -> 198.00
A80: UAD-474 | B80: Cavalier TJG00 | D80: 2dr | F80: S/S | G80: 95 | H80: 02 | I80: 200.00 | J80: =I80*0.9 -> 180.00
A81: UAD-475 | B81: Cavalier TJG00 | D81: 4dr | F81: S/S | G81: 95 | H81: 02 | I81: 200.00 | J81: =I81*0.9 -> 180.00
A82: UAD-476 | B82: Cavalier TJG00 | F82: R/BS | G82: 95 | H82: 01 | I82: 210.00 | J82: =I82*0.9 -> 189.00
A83: UAD-479 | B83: Cavalier TJG00 | D83: 2 & 4 dr | F83: R/S | G83: 95 | H83: 02 | I83: 215.00 | J83: =I83*0.9 -> 193.50
A84: AD-477 | B84: Cavalier TJG00 | D84: 2dr | F84: A/M T1 Manual | G84: 95 | H84: 02 | I84: 180.00 | J84: =I84*0.9 -> 162.00
A85: AD-478 | B85: Cavalier TJG00 | D85: 2dr | F85: A/M T1 Power | G85: 95 | H85: 02 | I85: 240.00 | J85: =I85*0.9 -> 216.00
A86: AD-507 | B86: Cavalier TJG00 | D86: 4dr | F86: A/M T1 Manual | G86: 95 | H86: 02 | I86: 180.00 | J86: =I86*0.9 -> 162.00
A87: AD-508 | B87: Cavalier TJG00 | D87: 4dr | F87: A/M T1 Power | G87: 95 | H87: 02 | I87: 240.00 | J87: =I87*0.9 -> 216.00
A88: TS-0243 | B88: Cavalier | D88: UAD-563 | E88: UAD-474 | F88: UAD-565 | G88: 03 | I88: 608.00 | J88: =I88*0.9 -> 547.20 | K88: 2 door 03' new
A89: TS-0244 | B89: Cavalier | D89: UAD-563 | E89: UAD-475 | F89: UAD-565 | G89: 03 | I89: 608.00 | J89: =I89*0.9 -> 547.20 | K89: 4 door 03' new
A90: UAD-563 | B90: Cavalier | F90: F/BS | G90: 03 | I90: 220.00 | J90: =I90*0.9 -> 198.00 | K90: 03' new
A91: UAD-565 | B91: Cavalier | F91: R/BS | G91: 03 | I91: 220.00 | J91: =I91*0.9 -> 198.00 | K91: 03' new
A92: TS-0237 | B92: Celica ZZT231 | C92: 4 | D92: UAD-531 | E92: UAD-532 | F92: UAD-533 | G92: 00 | H92: 02 | I92: 627.00 | J92: =I92*0.9 -> 564.30 | K92: 03' new
A93: UAD-531 | B93: Celica ZZT231 | F93: F/BS | G93: 00 | H93: 02 | I93: 240.00 | J93: =I93*0.9 -> 216.00 | K93: 03' new
A94: UAD-532 | B94: Celica ZZT231 | F94: S/S | G94: 00 | H94: 02 | I94: 200.00 | J94: =I94*0.9 -> 180.00 | K94: 03' new
A95: UAD-533 | B95: Celica ZZT231 | F95: R/BS | G95: 00 | H95: 02 | I95: 220.00 | J95: =I95*0.9 -> 198.00 | K95: 03' new
A96: AD-534 | B96: Celica ZZT231 | F96: AM Manual | G96: 00 | H96: 02 | I96: 180.00 | J96: =I96*0.9 -> 162.00 | K96: 03' new
A97: AD-535 | B97: Celica ZZT231 | F97: AM Power | G97: 00 | H97: 02 | I97: 240.00 | J97: =I97*0.9 -> 216.00 | K97: 03' new
A98: AD-536 | B98: Celica ZZT231 | F98: Front /Hood Scoop | G98: 00 | H98: 02 | I98: 160.00 | J98: =I98*0.9 -> 144.00 | K98: 03' new
A99: TS-2081 | B99: Emina mid | D99: S-013 | E99: S-019 | F99: S-020 | I99: 551.00 | J99: =I99*0.9 -> 495.90 | K99: Special Order Only
A100: TS-2082 | B100: Emina mid | D100: S-013 | E100: S-024 | F100: S-020 | I100: 584.25 | J100: =I100*0.9 -> 525.82500000000005 | K100: Special Order Only
A101: TS-2083 | B101: Emina mid | D101: S-013 | E101: S-019 | F101: S-027 | I101: 665.00 | J101: =I101*0.9 -> 598.50 | K101: Special Order Only
A102: TS-2084 | B102: Emina mid | D102: S-013 | E102: S-024 | F102: S-027 | I102: 698.25 | J102: =I102*0.9 -> 628.42499999999995 | K102: Special Order Only
A103: TS-2085 | B103: Emina before | D103: S-011 | E103: S-019 | F103: S-020 | I103: 551.00 | J103: =I103*0.9 -> 495.90 | K103: Special Order Only
A104: TS-2086 | B104: Emina before | D104: S-011 | E104: S-024 | F104: S-020 | I104: 584.25 | J104: =I104*0.9 -> 525.82500000000005 | K104: Special Order Only
A105: TS-2087 | B105: Emina before | D105: S-011 | E105: S-019 | F105: S-027 | I105: 665.00 | J105: =I105*0.9 -> 598.50 | K105: Special Order Only
A106: TS-2088 | B106: Emina before | D106: S-011 | E106: S-024 | F106: S-027 | I106: 698.25 | J106: =I106*0.9 -> 628.42499999999995 | K106: Special Order Only
A107: TS-2089 | B107: Lucida before | D107: S-012 | E107: S-019 | F107: S-020 | I107: 551.00 | J107: =I107*0.9 -> 495.90 | K107: Special Order Only
A108: TS-2090 | B108: Lucida before | D108: S-012 | E108: S-024 | F108: S-020 | I108: 584.25 | J108: =I108*0.9 -> 525.82500000000005 | K108: Special Order Only
A109: TS-2091 | B109: Lucida before | D109: S-012 | E109: S-019 | F109: S-027 | I109: 665.00 | J109: =I109*0.9 -> 598.50 | K109: Special Order Only
A110: TS-2092 | B110: Lucida before | D110: S-012 | E110: S-024 | F110: S-027 | I110: 698.25 | J110: =I110*0.9 -> 628.42499999999995 | K110: Special Order Only
A111: TS-2093 | B111: Lucida mid | D111: S-014 | E111: S-019 | F111: S-020 | I111: 551.00 | J111: =I111*0.9 -> 495.90 | K111: under development
A112: TS-2094 | B112: Lucida mid | D112: S-014 | E112: S-024 | F112: S-020 | I112: 584.25 | J112: =I112*0.9 -> 525.82500000000005 | K112: under development
A113: TS-2095 | B113: Lucida mid | D113: S-014 | E113: S-019 | F113: S-027 | I113: 665.00 | J113: =I113*0.9 -> 598.50 | K113: under development
A114: TS-2096 | B114: Lucida mid | D114: S-014 | E114: S-024 | F114: S-027 | I114: 698.25 | J114: =I114*0.9 -> 628.42499999999995 | K114: under development
A115: S-011 | B115: Emina | D115: before mc | F115: F/BS BM | I115: 260.00 | J115: =I115*0.9 -> 234.00 | K115: Special Order Only
A116: S-012 | B116: Lucida | D116: before mc | F116: F/BS BM | I116: 260.00 | J116: =I116*0.9 -> 234.00 | K116: Special Order Only
A117: S-013 | B117: Emina | D117: middle mc | F117: F/BS BM | I117: 260.00 | J117: =I117*0.9 -> 234.00 | K117: Special Order Only
A118: S-014 | B118: Lucida | D118: middle mc | F118: F/BS | I118: 260.00 | J118: =I118*0.9 -> 234.00 | K118: under development
A119: S-019 | B119: Emina/Lucida | F119: S/S | I119: 200.00 | J119: =I119*0.9 -> 180.00 | K119: Special Order Only
A120: S-024 | B120: Emina/Lucida | F120: S/S T2 | G120: 91 | H120: 97 | I120: 235.00 | J120: =I120*0.9 -> 211.50 | K120: Special Order Only
A121: S-020 | B121: Emina/Lucida | F121: R/US | I121: 120.00 | J121: =I121*0.9 -> 108.00 | K121: Special Order Only
A122: S-027 | B122: Emina/Lucida | F122: R/HS T2 | I122: 240.00 | J122: =I122*0.9 -> 216.00 | K122: Special Order Only
A123: S-015 | B123: Emina | D123: before mc | F123: F/Grill | I123: 100.00 | J123: =I123*0.9 -> 90.00 | K123: Special Order Only
A124: S-016 | B124: Lucida | D124: before mc | F124: F/Grill | I124: 100.00 | J124: =I124*0.9 -> 90.00 | K124: Special Order Only
A125: S-017 | B125: Emina | D125: middle mc | F125: F/Grill | I125: 100.00 | J125: =I125*0.9 -> 90.00 | K125: Special Order Only
A126: S-018 | B126: Lucida | D126: middle mc | F126: F/Grill | I126: 100.00 | J126: =I126*0.9 -> 90.00 | K126: under development
A127: S-021 | B127: Emina/Lucida | F127: R/S | J127: =I127*0.9 -> 0.00 | K127: under development
A128: TS-0043 | B128: Lexus Cp Z30 | C128: 5 | D128: UAD-408 | E128: UAD-409 | F128: UAD-410 | G128: 92 | H128: 96 | I128: 631.75 | J128: =I128*0.9 -> 568.57500000000005
A129: TS-0094 | B129: Lexus Cp Z30 | C129: 7 | D129: UAD-408 | E129: UAD-409 | F129: UAD-458 | G129: 92 | H129: 96 | I129: 698.25 | J129: =I129*0.9 -> 628.42499999999995
A130: TS-0044 | B130: Lexus Cp Z30 | C130: 5 | D130: UAD-453 | E130: UAD-409 | F130: UAD-410 | G130: 92 | H130: 96 | I130: 641.25 | J130: =I130*0.9 -> 577.125
A131: TS-0095 | B131: Lexus Cp Z30 | C131: 7 | D131: UAD-453 | E131: UAD-409 | F131: UAD-458 | G131: 92 | H131: 96 | I131: 707.75 | J131: =I131*0.9 -> 636.97500000000002
A132: TS-0098 | B132: Lexus Cp Z30 | C132: 5 | D132: UAD-408 | E132: UAD-407 | F132: UAD-294 | G132: 97 | H132: 00 | I132: 646.00 | J132: =I132*0.9 -> 581.40
A133: TS-0096 | B133: Lexus Cp Z30 | C133: 7 | D133: UAD-408 | E133: UAD-407 | F133: UAD-459 | G133: 97 | H133: 00 | I133: 731.50 | J133: =I133*0.9 -> 658.35
A134: TS-0099 | B134: Lexus Cp Z30 | C134: 5 | D134: UAD-453 | E134: UAD-407 | F134: UAD-294 | G134: 97 | H134: 00 | I134: 655.50 | J134: =I134*0.9 -> 589.95
A135: TS-0097 | B135: Lexus Cp Z30 | C135: 7 | D135: UAD-453 | E135: UAD-407 | F135: UAD-459 | G135: 97 | H135: 00 | I135: 741.00 | J135: =I135*0.9 -> 666.90
A136: UAD-408 | B136: Lexus Cp Z30 | D136: bfr & aft | F136: F/BS BM | G136: 92 | H136: 96 | I136: 280.00 | J136: =I136*0.9 -> 252.00 | K136: fits 97-00
A137: UAD-409 | B137: Lexus Cp Z30 | D137: bfr | F137: S/S | G137: 92 | H137: 96 | I137: 225.00 | J137: =I137*0.9 -> 202.50
A138: UAD-410 | B138: Lexus Cp Z30 | D138: bfr | F138: R/UC | G138: 92 | H138: 96 | I138: 160.00 | J138: =I138*0.9 -> 144.00
A139: UAD-C410 | B139: Lexus Cp Z30 | D139: bfr | F139: R/UC Center | G139: 92 | H139: 96 | I139: 100.00 | J139: =I139*0.9 -> 90.00
A140: UAD-458 | B140: Lexus Cp Z30 | D140: bfr | F140: R/US | G140: 92 | H140: 96 | I140: 230.00 | J140: =I140*0.9 -> 207.00 | K140: UAD-410+UAD410C
A141: UAD-453 | B141: Lexus Cp Z30 | D141: aft | F141: F/BS 2lite | G141: 97 | H141: 00 | I141: 290.00 | J141: =I141*0.9 -> 261.00 | K141: fits 92-96 for updated look
A142: UAD-407 | B142: Lexus Cp Z30 | D142: aft | F142: S/S | G142: 97 | H142: 00 | I142: 230.00 | J142: =I142*0.9 -> 207.00
A143: UAD-294 | B143: Lexus Cp Z30 | D143: aft | F143: R/UC | G143: 97 | H143: 00 | I143: 170.00 | J143: =I143*0.9 -> 153.00
A144: UAD-C294 | B144: Lexus Cp Z30 | D144: aft | F144: R/UC Center | G144: 97 | H144: 00 | I144: 100.00 | J144: =I144*0.9 -> 90.00
A145: UAD-459 | B145: Lexus Cp Z30 | D145: aft | F145: R/US | G145: 97 | H145: 00 | I145: 260.00 | J145: =I145*0.9 -> 234.00 | K145: UAD-294+UAD294C
A146: UAD-411 | B146: Lexus Cp Z30 | D146: bfr & aft | F146: R/S Type 1 | G146: 92 | H146: 00 | I146: 200.00 | J146: =I146*0.9 -> 180.00
A147: AD-412 | B147: Lexus Cp Z30 | D147: bfr & aft | F147: A/M Manual | G147: 92 | H147: 00 | I147: 180.00 | J147: =I147*0.9 -> 162.00
A148: AD-413 | B148: Lexus Cp Z30 | D148: bfr & aft | F148: A/M Power | G148: 92 | H148: 00 | I148: 240.00 | J148: =I148*0.9 -> 216.00 | K148: discontinued
A149: TS-0510 | B149: MarkII JZX90 | D149: BE-034 | E149: BE-035 | F149: BE-036 | I149: 736.25 | J149: =I149*0.9 -> 662.625 | K149: Special Order Only
A150: BE-034 | B150: MarkII JZX90 | F150: F/BS | I150: 275.00 | J150: =I150*0.9 -> 247.50 | K150: Special Order Only
A151: BE-035 | B151: MarkII JZX90 | F151: S/S | I151: 230.00 | J151: =I151*0.9 -> 207.00 | K151: Special Order Only
A152: BE-036 | B152: MarkII JZX90 | F152: R/BS | I152: 270.00 | J152: =I152*0.9 -> 243.00 | K152: Special Order Only
A153: BE-037 | B153: MarkII JZX90 | F153: R/S | I153: 200.00 | J153: =I153*0.9 -> 180.00 | K153: Special Order Only
A154: BE-040 | B154: MarkII JZX90 | F154: F/Grill | I154: 100.00 | J154: =I154*0.9 -> 90.00 | K154: Special Order Only
A155: TS-0211 | B155: MR2 SW20 | C155: 6 | D155: AD-470 | E155: UAD-185 | F155: UAD-184 | I155: 589.00 | J155: =I155*0.9 -> 530.10 | K155: not available for U.S.
A156: TS-0218 | B156: MR2 SW20 | C156: 6 | D156: AD-472 | E156: UAD-185 | F156: UAD-184 | I156: 589.00 | J156: =I156*0.9 -> 530.10 | K156: not available for U.S.
A157: TS-0048 | B157: MR2 SW20 | C157: 6 | D157: UAD-164 | E157: UAD-185 | F157: UAD-184 | G157: 91 | H157: 95 | I157: 579.50 | J157: =I157*0.9 -> 521.55
A158: TS-0049 | B158: MR2 SW20 | C158: 6 | D158: UAD-166 | E158: UAD-185 | F158: UAD-184 | G158: 91 | H158: 95 | I158: 579.50 | J158: =I158*0.9 -> 521.55
A159: TS-1046 | B159: MR2 SW20 | C159: 6 | D159: UAD-179 | E159: UAD-185 | F159: UAD-184 | G159: 91 | H159: 95 | I159: 456.00 | J159: =I159*0.9 -> 410.40
A160: TS-1047 | B160: MR2 SW20 | C160: 6 | D160: UAD-180 | E160: UAD-185 | F160: UAD-184 | G160: 91 | H160: 95 | I160: 465.50 | J160: =I160*0.9 -> 418.95
A161: AD-470 | B161: MR2 SW20 | D161: T4 & T5 | F161: F/BS BM | G161: J | H161: J | I161: 250.00 | J161: =I161*0.9 -> 225.00 | K161: not available for U.S.
A162: AD-472 | B162: MR2 SW20 | D162: T4 & T5 | F162: F/BS 2 lite | G162: J | H162: J | I162: 250.00 | J162: =I162*0.9 -> 225.00 | K162: not available for U.S.
A163: UAD-164 | B163: MR2 SW20 | D163: T1 to T3 | F163: F/BS BM | G163: 91 | H163: 95 | I163: 240.00 | J163: =I163*0.9 -> 216.00
A164: UAD-166 | B164: MR2 SW20 | D164: T1 to T3 | F164: F/BS 2 lite | G164: 91 | H164: 95 | I164: 240.00 | J164: =I164*0.9 -> 216.00
A165: UAD-179 | B165: MR2 SW20 | F165: F/US Type 1 | G165: 91 | H165: 95 | I165: 110.00 | J165: =I165*0.9 -> 99.00
A166: UAD-180 | B166: MR2 SW20 | F166: F/US Type 2 | G166: 91 | H166: 95 | I166: 120.00 | J166: =I166*0.9 -> 108.00
A167: UAD-185 | B167: MR2 SW20 | F167: S/S Type 2 | G167: 91 | H167: 95 | I167: 210.00 | J167: =I167*0.9 -> 189.00
A168: UAD-184 | B168: MR2 SW20 | F168: R/US Type 1 | G168: 91 | H168: 95 | I168: 160.00 | J168: =I168*0.9 -> 144.00
A169: UAD-181 | B169: MR2 SW20 | F169: A/Scoop T1 lt | G169: 91 | H169: 95 | I169: 150.00 | J169: =I169*0.9 -> 135.00
A170: UAD-182 | B170: MR2 SW20 | F170: A/Scoop T1 rt | G170: 91 | H170: 95 | I170: 150.00 | J170: =I170*0.9 -> 135.00
A171: UAD-481 | B171: MR2 SW20 | F171: Side Marker Cover | G171: 91 | H171: 95 | I171: 130.00 | J171: =I171*0.9 -> 117.00 | K171: converts to T4+ needs fact SM
A172: UAD-187 | B172: MR2 SW20 | F172: Engine Outlet Cover | G172: 91 | H172: 95 | I172: 220.00 | J172: =I172*0.9 -> 198.00
A173: AD-175 | B173: MR2 SW20 | F173: A/M T1 Manual | G173: 91 | H173: 95 | I173: 180.00 | J173: =I173*0.9 -> 162.00
A174: AD-177 | B174: MR2 SW20 | F174: A/M T1 Power | G174: 91 | H174: 95 | I174: 240.00 | J174: =I174*0.9 -> 216.00
A175: AD-176 | B175: MR2 SW20 | F175: A/M T2 Manual | G175: 91 | H175: 95 | I175: 180.00 | J175: =I175*0.9 -> 162.00
A176: AD-178 | B176: MR2 SW20 | F176: A/M T2 Power | G176: 91 | H176: 95 | I176: 240.00 | J176: =I176*0.9 -> 216.00 | K176: discontinued
A177: UAD-167 | B177: MR2 SW20 atr | D177: T3-T5 | F177: R/S Type1-B | G177: 94 | H177: 95 | I177: 200.00 | J177: =I177*0.9 -> 180.00
A178: UAD-168 | B178: MR2 SW20 atr | D178: T3-T5 | F178: R/S Type 2 | G178: 94 | H178: 95 | I178: 200.00 | J178: =I178*0.9 -> 180.00
A179: UAD-169 | B179: MR2 SW20 atr | D179: T3-T5 | F179: R/S Type 3 | G179: 94 | H179: 95 | I179: 200.00 | J179: =I179*0.9 -> 180.00
A180: UAD-162 | B180: MR2 SW20 bfr | D180: T1 toT2 | F180: R/S Type1-A | G180: 91 | H180: 93 | I180: 200.00 | J180: =I180*0.9 -> 180.00
A181: TS-2071 | B181: Previa/Estima | D181: US-022 | E181: US-019 | F181: US-025 | G181: 91 | H181: 97 | I181: 636.50 | J181: =I181*0.9 -> 572.85
A182: TS-2072 | B182: Previa/Estima | D182: US-022 | E182: US-024 | F182: US-025 | G182: 91 | H182: 97 | I182: 669.75 | J182: =I182*0.9 -> 602.77499999999998
A183: US-022 | B183: Previa/Estima | F183: F/HS | G183: 91 | H183: 97 | I183: 235.00 | J183: =I183*0.9 -> 211.50
A184: US-019 | B184: Previa/Estima | F184: S/S T1 | G184: 91 | H184: 97 | I184: 200.00 | J184: =I184*0.9 -> 180.00
A185: US-024 | B185: Previa/Estima | F185: S/S T2 | G185: 91 | H185: 97 | I185: 235.00 | J185: =I185*0.9 -> 211.50
A186: US-LT024 | B186: Previa/Estima | F186: S/S T2 | G186: 91 | H186: 97 | I186: 235.00 | J186: =I186*0.9 -> 211.50
A187: US-025 | B187: Previa/Estima | F187: R/HS | G187: 91 | H187: 97 | I187: 235.00 | J187: =I187*0.9 -> 211.50
A188: US-023 | B188: Previa/Estima | F188: F/Grill | G188: 91 | H188: 97 | J188: =I188*0.9 -> 0.00 | K188: under development
A189: US-026 | B189: Previa/Estima | F189: R/S | G189: 91 | H189: 97 | J189: =I189*0.9 -> 0.00 | K189: under development
A190: TS-2014 | B190: Rav4 3 dr | C190: 5 | D190: US-010 | E190: US-005 | F190: US-007 | G190: 98 | H190: 00 | I190: 608.00 | J190: =I190*0.9 -> 547.20
A191: TS-2012 | B191: Rav4 3 dr | C191: 5 | D191: US-001 | E191: US-005 | F191: US-007 | G191: 96 | H191: 97 | I191: 608.00 | J191: =I191*0.9 -> 547.20 | K191: need to modify on over fender model
A192: TS-2010 | B192: Rav4 3 dr | C192: 6 | D192: US-002 | E192: US-005 | F192: US-007 | G192: 96 | H192: 97 | I192: 541.50 | J192: =I192*0.9 -> 487.35 | K192: need to modify on over fender model
A193: TS-2015 | B193: Rav4 5 dr | C193: 5 | D193: US-010 | E193: US-006 | F193: US-009 | G193: 98 | H193: 00 | I193: 608.00 | J193: =I193*0.9 -> 547.20
A194: TS-2013 | B194: Rav4 5 dr | C194: 5 | D194: US-001 | E194: US-006 | F194: US-009 | G194: 96 | H194: 97 | I194: 608.00 | J194: =I194*0.9 -> 547.20 | K194: need to modify on over fender model
A195: TS-2011 | B195: Rav4 5 dr | C195: 6 | D195: US-002 | E195: US-006 | F195: US-009 | G195: 96 | H195: 97 | I195: 541.50 | J195: =I195*0.9 -> 487.35 | K195: need to modify on over fender model
A196: US-010 | B196: Rav4 3 dr & 5 dr | D196: aft | F196: F/BS BM | G196: 98 | H196: 00 | I196: 260.00 | J196: =I196*0.9 -> 234.00
A197: US-001 | B197: Rav4 3 dr & 5 dr | D197: bfr | F197: F/BS BM | G197: 96 | H197: 97 | I197: 260.00 | J197: =I197*0.9 -> 234.00 | K197: need to modify on over fender model
A198: US-002 | B198: Rav4 3 dr & 5 dr | D198: bfr | F198: F/US | G198: 96 | H198: 97 | I198: 190.00 | J198: =I198*0.9 -> 171.00 | K198: need to modify on over fender model
A199: US-005 | B199: Rav4 3 dr | F199: S/S (R/L) | G199: 96 | H199: 00 | I199: 200.00 | J199: =I199*0.9 -> 180.00 | K199: need to modify on over fender model
A200: US-007 | B200: Rav4 3 dr | F200: R/BS (R/L) | G200: 96 | H200: 00 | I200: 180.00 | J200: =I200*0.9 -> 162.00 | K200: need to modify on over fender model
A201: US-006 | B201: Rav4 5 dr | F201: S/S (R/L) | G201: 96 | H201: 00 | I201: 200.00 | J201: =I201*0.9 -> 180.00 | K201: need to modify on over fender model
A202: US-009 | B202: Rav4 5 dr | F202: R/BS (R/L) | G202: 96 | H202: 00 | I202: 180.00 | J202: =I202*0.9 -> 162.00 | K202: need to modify on over fender model
A203: US-003 | B203: Rav4 3 dr & 5 dr | F203: F/Grill Type 1 | G203: 96 | H203: 00 | I203: 100.00 | J203: =I203*0.9 -> 90.00 | K203: under development
A204: US-004 | B204: Rav4 3 dr & 5 dr | F204: F/Grill Type 2 | G204: 96 | H204: 00 | I204: 100.00 | J204: =I204*0.9 -> 90.00
A205: US-008 | B205: Rav4 3 dr & 5 dr | F205: R/S | G205: 96 | H205: 00 | I205: 165.00 | J205: =I205*0.9 -> 148.50
A206: S-038 | B206: Rav4 3 dr | F206: A/M Manual | G206: 96 | H206: 00 | I206: 180.00 | J206: =I206*0.9 -> 162.00
A207: S-039 | B207: Rav4 3 dr | F207: A/M Power | G207: 96 | H207: 00 | I207: 240.00 | J207: =I207*0.9 -> 216.00 | K207: discontinued
A208: S-040 | B208: Rav4 5 dr | F208: A/M Manual | G208: 96 | H208: 00 | I208: 180.00 | J208: =I208*0.9 -> 162.00 | K208: under development
A209: S-041 | B209: Rav4 5 dr | F209: A/M Power | G209: 96 | H209: 00 | I209: 240.00 | J209: =I209*0.9 -> 216.00 | K209: under development
A210: TS-0045 | B210: Soarer Z20 | C210: 5 | D210: AD-313 | E210: AD-314 | F210: AD-315 | I210: 608.00 | J210: =I210*0.9 -> 547.20 | K210: Special Order Only
A211: AD-313 | B211: Soarer Z20 | F211: F/BS BM | I211: 270.00 | J211: =I211*0.9 -> 243.00 | K211: Special Order Only
A212: AD-314 | B212: Soarer Z20 | F212: S/S | I212: 220.00 | J212: =I212*0.9 -> 198.00 | K212: Special Order Only
A213: AD-315 | B213: Soarer Z20 | F213: R/UC | I213: 150.00 | J213: =I213*0.9 -> 135.00 | K213: Special Order Only
A214: AD-317 | B214: Soarer Z20 | F214: F/Grill | I214: 100.00 | J214: =I214*0.9 -> 90.00 | K214: Special Order Only
A215: AD-323 | B215: Soarer Z20 | F215: A/M T2 Manual | I215: 180.00 | J215: =I215*0.9 -> 162.00 | K215: Special Order Only
A216: AD-325 | B216: Soarer Z20 | F216: A/M T2 Power | I216: 240.00 | J216: =I216*0.9 -> 216.00 | K216: discontinued
A217: AD-318 | B217: Soarer Z20 | F217: R/S T1 | I217: 170.00 | J217: =I217*0.9 -> 153.00 | K217: Special Order Only
A218: AD-319 | B218: Soarer Z20 | F218: R/S T2 | I218: 170.00 | J218: =I218*0.9 -> 153.00 | K218: Special Order Only
A219: AD-320 | B219: Soarer Z20 | F219: R/S T3 | I219: 170.00 | J219: =I219*0.9 -> 153.00 | K219: Special Order Only
A220: TS-0081 | B220: Supra A70 | C220: 5 | D220: UAD-147 | E220: UAD-126 | F220: UAD-127 | G220: 86 | H220: 92 | I220: 546.25 | J220: =I220*0.9 -> 491.625 | K220: 86-88 needs late frt grill & turn signal
A221: TS-1080 | B221: Supra A70 | C221: 5 | D221: UAD-070 | E221: UAD-126 | F221: UAD-127 | G221: 89 | H221: 92 | I221: 451.25 | J221: =I221*0.9 -> 406.125
A222: TS-1081 | B222: Supra A70 | C222: 5 | D222: UAD-071 | E222: UAD-126 | F222: UAD-127 | G222: 89 | H222: 92 | I222: 446.50 | J222: =I222*0.9 -> 401.85
A223: TS-0078 | B223: Supra A70 | D223: AD-196 | E223: AD-203 | F223: AD-204 | I223: 546.25 | J223: =I223*0.9 -> 491.625 | K223: not available for U.S.
A224: UAD-147 | B224: Supra A70 | D224: Wide Body | F224: F/BS BM | G224: 86 | H224: 92 | I224: 225.00 | J224: =I224*0.9 -> 202.50 | K224: 86-88 needs late frt grill & turn signal
A225: UAD-071 | B225: Supra A70 | D225: Wide Body | F225: F/US Type 1 | G225: 89 | H225: 92 | I225: 120.00 | J225: =I225*0.9 -> 108.00
A226: UAD-070 | B226: Supra A70 | D226: Wide Body | F226: F/US Type 3 | G226: 89 | H226: 92 | I226: 125.00 | J226: =I226*0.9 -> 112.50
A227: UAD-126 | B227: Supra A70 | D227: Wide Body | F227: S/S | G227: 86 | H227: 92 | I227: 200.00 | J227: =I227*0.9 -> 180.00
A228: UAD-127 | B228: Supra A70 | D228: Wide Body | F228: R/UC | G228: 86 | H228: 92 | I228: 150.00 | J228: =I228*0.9 -> 135.00
A229: UAD-068 | B229: Supra A70 | D229: Wide Body | F229: R/S T1-B | G229: 86 | H229: 92 | I229: 200.00 | J229: =I229*0.9 -> 180.00
A230: UAD-069 | B230: Supra A70 | D230: Wide Body | F230: R/S Type 2 | G230: 86 | H230: 92 | I230: 210.00 | J230: =I230*0.9 -> 189.00
A231: AD-020 | B231: Supra A70 | F231: A/M T1 Manual | G231: 89 | H231: 92 | I231: 180.00 | J231: =I231*0.9 -> 162.00
A232: AD-055 | B232: Supra A70 | F232: A/M T1 Power | G232: 89 | H232: 92 | I232: 240.00 | J232: =I232*0.9 -> 216.00
A233: AD-021 | B233: Supra A70 | F233: A/M T2 Manual | G233: 89 | H233: 92 | I233: 180.00 | J233: =I233*0.9 -> 162.00
A234: AD-056 | B234: Supra A70 | F234: A/M T2 Power | G234: 89 | H234: 92 | I234: 240.00 | J234: =I234*0.9 -> 216.00 | K234: discontinued
A235: AD-196 | B235: Supra A70 | D235: Normal Body | F235: F/BS BM | I235: 225.00 | J235: =I235*0.9 -> 202.50 | K235: Special Order Only
A236: AD203 | B236: Supra A70 | D236: Normal Body | F236: S/S | I236: 200.00 | J236: =I236*0.9 -> 180.00 | K236: Special Order Only
A237: AD-204 | B237: Supra A70 | D237: Normal Body | F237: R/UC | I237: 150.00 | J237: =I237*0.9 -> 135.00 | K237: Special Order Only
A238: AD-067 | B238: Supra A70 | D238: Normal Body | F238: R/S T1-A | I238: 200.00 | J238: =I238*0.9 -> 180.00 | K238: Special Order Only
A239: TS-0074 | B239: Supra JZA80 bfr | C239: 5 | D239: UAD-148 | E239: UAD-152 | F239: UAD-153 | G239: 93 | H239: 96 | I239: 627.00 | J239: =I239*0.9 -> 564.30 | K239: modify to install side marker
A240: TS-0111 | B240: Supra JZA80 bfr | C240: 5 | D240: UAD-156 | E240: UAD-152 | F240: UAD-153 | G240: 93 | H240: 96 | I240: 627.00 | J240: =I240*0.9 -> 564.30 | K240: modify to install side marker
A241: TS-1074 | B241: Supra JZA80 bfr | C241: 5 | D241: UAD-133 | E241: UAD-152 | F241: UAD-153 | G241: 93 | H241: 96 | I241: 484.50 | J241: =I241*0.9 -> 436.05 | K241: does not fit 97-98
A242: TS-1076 | B242: Supra JZA80 bfr | C242: 5 | D242: UAD-134 | E242: UAD-152 | F242: UAD-153 | G242: 93 | H242: 96 | I242: 489.25 | J242: =I242*0.9 -> 440.32499999999999 | K242: does not fit 97-98
A243: TS-0076 | B243: Supra JZA80 aft | C243: 5 | D243: UAD-151 | E243: UAD-152 | F243: UAD-153 | G243: 97 | H243: 98 | I243: 627.00 | J243: =I243*0.9 -> 564.30
A244: TS-0112 | B244: Supra JZA80 aft | C244: 5 | D244: UAD-157 | E244: UAD-152 | F244: UAD-153 | G244: 97 | H244: 98 | I244: 627.00 | J244: =I244*0.9 -> 564.30
A245: UAD-148 | B245: Supra JZA80 bfr | F245: F/BS BM | G245: 93 | H245: 96 | I245: 270.00 | J245: =I245*0.9 -> 243.00 | K245: modify to install side marker
A246: UAD-156 | B246: Supra JZA80 bfr | F246: F/BS 2lite | G246: 93 | H246: 96 | I246: 270.00 | J246: =I246*0.9 -> 243.00 | K246: modify to install side marker ?
A247: UAD-133 | B247: Supra JAZ80 | F247: F/US Type 1 | G247: 93 | H247: 96 | I247: 120.00 | J247: =I247*0.9 -> 108.00 | K247: does not fit 97-98
A248: UAD-134 | B248: Supra JAZ80 | F248: F/US Type 2 | G248: 93 | H248: 96 | I248: 125.00 | J248: =I248*0.9 -> 112.50 | K248: does not fit 97-98
A249: UAD-152 | B249: Supra JZA80 | F249: S/S | G249: 93 | H249: 98 | I249: 225.00 | J249: =I249*0.9 -> 202.50
A250: UAD-153 | B250: Supra JZA80 | F250: R/UC | G250: 93 | H250: 98 | I250: 165.00 | J250: =I250*0.9 -> 148.50
A251: UAD-151 | B251: Supra JZA80 aft | F251: F/BS BM | G251: 97 | H251: 98 | I251: 270.00 | J251: =I251*0.9 -> 243.00
A252: UAD-157 | B252: Supra JZA80 aft | F252: F/BS 2lite | G252: 97 | H252: 98 | I252: 270.00 | J252: =I252*0.9 -> 243.00
A253: UAD-149 | B253: Supra JZA80 | F253: R/S Type 1 | G253: 93 | H253: 98 | I253: 220.00 | J253: =I253*0.9 -> 198.00
A254: UAD-150 | B254: Supra JZA80 | F254: R/S Type 2 | G254: 93 | H254: 98 | I254: 230.00 | J254: =I254*0.9 -> 207.00
A255: AD-154 | B255: Supra JZA80 | F255: A/M Manual | G255: 93 | H255: 98 | I255: 180.00 | J255: =I255*0.9 -> 162.00
A256: AD-155 | B256: Supra JZA80 | F256: A/M Power | G256: 93 | H256: 98 | I256: 240.00 | J256: =I256*0.9 -> 216.00 | K256: discontinued