A1: Bomex Full Line

A1: TOYOTA APPLICATION | B1: FULL LINE | C1: PRODUCT GALLERY

A1: Kit Part # | B1: Application | C1: Pieces | D1: Kit Includes | G1: Notes | H1: Year | I1: Year | J1: Retail | K1: Sale | L1: Notes
D2: Front | E2: Side | F2: Rear
A3: TS-2510 | B3: BMW 3Series | C3: 4 | D3: AE-011 | E3: AE-012 | F3: AE-013 | H3: 91 | I3: 97 | J3: 674.50 | K3: =J3*0.9 -> 607.05 | L3: 03' new 2dr coupe
A4: TS-2511 | B4: BMW 3Series | C4: 4 | D4: AE-011 | E4: AE-017 | F4: AE-000 | H4: 91 | I4: 97 | J4: 684.00 | K4: =J4*0.9 -> 615.60 | L4: 04' apr. .ｎｅｗ 4dr
A5: UAE-011 | B5: BMW 3Series | F5: F/BS BM | H5: 91 | I5: 97 | J5: 250.00 | K5: =J5*0.9 -> 225.00 | L5: 03' new
A6: UAE-012 | B6: BMW 3Series | D6: Coupe | F6: S/S | H6: 91 | I6: 97 | J6: 220.00 | K6: =J6*0.9 -> 198.00 | L6: 03' new
A7: UAE-017 | B7: BMW 3Series | D7: 4 door | F7: S/S | H7: 91 | I7: 97 | J7: 230.00 | K7: =J7*0.9 -> 207.00 | L7: 04' apr. .ｎｅｗ
A8: UAE-013 | B8: BMW 3Series | D8: Coupe | F8: R/BS | H8: 91 | I8: 97 | J8: 240.00 | K8: =J8*0.9 -> 216.00 | L8: 03' new
A9: UAE-018 | B9: BMW 3Series | D9: 4 door | F9: R/BS | H9: 91 | I9: 97 | K9: =J9*0.9 -> 0.00 | L9: 04' apr. .ｎｅｗ
A10: UAE-014 | B10: BMW 3Series | F10: R/S | H10: 91 | I10: 97 | K10: =J10*0.9 -> 0.00 | L10: under development
A11: AE-015 | B11: BMW 3Series | F11: A/M Manual | H11: 91 | I11: 97 | J11: 180.00 | K11: =J11*0.9 -> 162.00 | L11: 03' new
A12: AE-016 | B12: BMW 3Series | F12: A/M Power | H12: 91 | I12: 97 | J12: 240.00 | K12: =J12*0.9 -> 216.00 | L12: 03' new
A13: TS-2111 | B13: Accord CB | C13: 4 | D13: US-073 | E13: US-046 | F13: US-075 | H13: 91 | I13: 93 | J13: 608.00 | K13: =J13*0.9 -> 547.20 | L13: Sedan,
A14: TS-2112 | B14: Accord CB | C14: 4 | D14: US-073 | E14: US-048 | F14: US-075 | H14: 91 | I14: 93 | J14: 627.00 | K14: =J14*0.9 -> 564.30 | L14: Sedan,
A15: US-073 | B15: Accord CB | D15: Sedan, Coupe | F15: F/BS | H15: 91 | I15: 93 | J15: 220.00 | K15: =J15*0.9 -> 198.00 | L15: does not fit U.S. models
A16: US-046 | B16: Accord CB | D16: Sedan | F16: S/S T1 | H16: 91 | I16: 93 | J16: 200.00 | K16: =J16*0.9 -> 180.00 | L16: need some mod to fit
A17: US-048 | B17: Accord CB | D17: Sedan | F17: S/S T2 | H17: 91 | I17: 93 | J17: 220.00 | K17: =J17*0.9 -> 198.00 | L17: under development
A18: US-075 | B18: Accord CB | D18: Sedan | F18: R/BS | H18: 91 | I18: 93 | J18: 220.00 | K18: =J18*0.9 -> 198.00 | L18: 4dr
A19: TS-2101 | B19: Accord CD | C19: 4 | D19: US-044 | E19: US-046 | F19: US-076 | H19: 94 | I19: 95 | J19: 608.00 | K19: =J19*0.9 -> 547.20 | L19: under development
A20: TS-2102 | B20: Accord CD | C20: 4 | D20: US-044 | E20: US-046 | F20: US-077 | H20: 96 | I20: 97 | J20: 608.00 | K20: =J20*0.9 -> 547.20 | L20: Sedan, Before
A21: TS-2103 | B21: Accord CD | C21: 4 | D21: US-044 | E21: US-048 | F21: US-076 | H21: 94 | I21: 95 | J21: 627.00 | K21: =J21*0.9 -> 564.30 | L21: under development
A22: TS-2104 | B22: Accord CD | C22: 4 | D22: US-044 | E22: US-048 | F22: US-077 | H22: 96 | I22: 97 | J22: 627.00 | K22: =J22*0.9 -> 564.30 | L22: under development
A23: TS-2105 | B23: Accord CD | C23: 4 | D23: US-042 | E23: US-046 | F23: US-076 | H23: 94 | I23: 95 | J23: 503.50 | K23: =J23*0.9 -> 453.15 | L23: under development
A24: TS-2106 | B24: Accord CD | C24: 4 | D24: US-042 | E24: US-048 | F24: US-076 | H24: 94 | I24: 95 | J24: 522.50 | K24: =J24*0.9 -> 470.25 | L24: under development
A25: TS-2121 | B25: Accord CD | C25: 4 | D25: US-042 | E25: US-087 | F25: US-088 | H25: 94 | I25: 95 | J25: 513.00 | K25: =J25*0.9 -> 461.70 | L25: Coupe, Before
A26: TS-2122 | B26: Accord CD | C26: 4 | D26: US-043 | E26: US-087 | F26: US-089 | H26: 96 | I26: 97 | K26: =J26*0.9 -> 0.00 | L26: under development
A27: TS-2123 | B27: Accord CD | C27: 4 | D27: US-044 | E27: US-087 | F27: US-088 | H27: 94 | I27: 95 | J27: 617.50 | K27: =J27*0.9 -> 555.75 | L27: Coupe, Before
A28: TS-2124 | B28: Accord CD | C28: 4 | D28: US-044 | E28: US-087 | F28: US-089 | H28: 96 | I28: 97 | K28: =J28*0.9 -> 0.00 | L28: under development
A29: TS-2125 | B29: Accord CD | C29: 4 | D29: US-086 | E29: US-087 | F29: US-088 | H29: 94 | I29: 95 | J29: 627.00 | K29: =J29*0.9 -> 564.30 | L29: Coupe, Before
A30: TS-2126 | B30: Accord CD | C30: 4 | D30: US-086 | E30: US-087 | F30: US-089 | H30: 96 | I30: 97 | K30: =J30*0.9 -> 0.00 | L30: under development
A31: US-044 | B31: Accord CD | D31: Sedan, Coupe | F31: F/BS | H31: 94 | I31: 97 | J31: 220.00 | K31: =J31*0.9 -> 198.00 | L31: does not fit 96-97 v6
A32: US-086 | B32: Accord CD | D32: Sedan, Coupe | F32: F/BS BM | H32: 94 | I32: 97 | J32: 230.00 | K32: =J32*0.9 -> 207.00 | L32: does not fit 96-97 v6
A33: US-046 | B33: Accord CD | D33: Sedan | F33: S/S | H33: 94 | I33: 97 | J33: 200.00 | K33: =J33*0.9 -> 180.00
A34: US-048 | B34: Accord CD | D34: Sedan | F34: S/S T2 | H34: 94 | I34: 97 | J34: 220.00 | K34: =J34*0.9 -> 198.00 | L34: under development
A35: US-087 | B35: Accord CD | D35: Coupe | F35: S/S T3 | H35: 94 | I35: 97 | J35: 210.00 | K35: =J35*0.9 -> 189.00 | L35: 03'des.new 2door
A36: US-076 | B36: Accord CD | D36: Sedan Bef | F36: R/BS type1 | H36: 94 | I36: 95 | J36: 220.00 | K36: =J36*0.9 -> 198.00 | L36: under development Bfor mc
A37: US-077 | B37: Accord CD | D37: Sedan Aft | F37: R/BS type1 | H37: 96 | I37: 97 | J37: 220.00 | K37: =J37*0.9 -> 198.00 | L37: 4dr After
A38: US-088 | B38: Accord CD | D38: Coupe Bef | F38: R/BS type2 | H38: 94 | I38: 95 | J38: 220.00 | K38: =J38*0.9 -> 198.00 | L38: 03'des.new 2door,Before
A39: US-089 | B39: Accord CD | D39: Coupe Aft | F39: R/BS type2 | H39: 96 | I39: 97 | J39: 220.00 | K39: =J39*0.9 -> 198.00 | L39: under development. After mc
A40: US-090 | B40: Accord CD | D40: Coupe | F40: R/S T5 | H40: 94 | I40: 97 | J40: 200.00 | K40: =J40*0.9 -> 180.00 | L40: under development
A41: US-091 | B41: Accord CD | D41: Coupe | F41: A/M Manual | H41: 94 | I41: 97 | J41: 180.00 | K41: =J41*0.9 -> 162.00 | L41: 04'Mar.new 2door
A42: US-092 | B42: Accord CD | D42: Coupe | F42: A/M Power | H42: 94 | I42: 97 | J42: 240.00 | K42: =J42*0.9 -> 216.00 | L42: 04'Mar.new 2door
A43: TS-2021 | B43: Accord Wgn CE1 | C43: 4 | D43: US-044 | E43: US-046 | F43: US-049 | H43: 94 | I43: 97 | J43: 608.00 | K43: =J43*0.9 -> 547.20 | L43: does not fit 96-97 v6
A44: TS-2022 | B44: Accord Wgn CE1 | C44: 5 | D44: US-044 | E44: US-046 | F44: US-047 | H44: 94 | I44: 95 | J44: 503.50 | K44: =J44*0.9 -> 453.15
A45: TS-2023 | B45: Accord Wgn CE1 | C45: 4 | D45: US-042 | E45: US-046 | F45: US-049 | H45: 94 | I45: 95 | J45: 503.50 | K45: =J45*0.9 -> 453.15
A46: TS-2024 | B46: Accord Wgn CE1 | C46: 5 | D46: US-042 | E46: US-046 | F46: US-047 | H46: 94 | I46: 95 | J46: 399.00 | K46: =J46*0.9 -> 359.10
A47: TS-2025 | B47: Accord Wgn CE1 | C47: 4 | D47: US-044 | E47: US-048 | F47: US-049 | H47: 94 | I47: 97 | J47: 627.00 | K47: =J47*0.9 -> 564.30
A48: TS-2026 | B48: Accord Wgn CE1 | C48: 5 | D48: US-044 | E48: US-048 | F48: US-047 | H48: 94 | I48: 95 | J48: 522.50 | K48: =J48*0.9 -> 470.25
A49: TS-2027 | B49: Accord Wgn CE1 | C49: 4 | D49: US-042 | E49: US-048 | F49: US-049 | H49: 94 | I49: 95 | J49: 522.50 | K49: =J49*0.9 -> 470.25
A50: TS-2028 | B50: Accord Wgn CE1 | C50: 5 | D50: US-042 | E50: US-048 | F50: US-047 | H50: 94 | I50: 95 | J50: 418.00 | K50: =J50*0.9 -> 376.20
A51: US-044 | B51: Accord | F51: F/BS | H51: 94 | I51: 97 | J51: 220.00 | K51: =J51*0.9 -> 198.00 | L51: does not fit 96-97 v6
A52: US-042 | B52: Accord CE bfr | F52: F/US | H52: 94 | I52: 95 | J52: 110.00 | K52: =J52*0.9 -> 99.00
A53: US-043 | B53: Accord CE aft | F53: F/US | H53: 96 | I53: 97 | J53: 100.00 | K53: =J53*0.9 -> 90.00 | L53: under development
A54: US-046 | B54: Accord | D54: Wgn,/Sedan | F54: S/S T1 | H54: 94 | I54: 97 | J54: 200.00 | K54: =J54*0.9 -> 180.00
A55: US-048 | B55: Accord CD | D55: Wgn/Sedan | F55: S/S T2 | H55: 94 | I55: 97 | J55: 220.00 | K55: =J55*0.9 -> 198.00 | L55: under development
A56: US-047 | B56: Accord bfr | F56: R/UC | H56: 94 | I56: 95 | J56: 110.00 | K56: =J56*0.9 -> 99.00
A57: US-049 | B57: Accord Wgn | F57: R/BS | H57: 94 | I57: 97 | J57: 220.00 | K57: =J57*0.9 -> 198.00
A58: US-050 | B58: Accord Wgn | F58: R/S | H58: 94 | I58: 97 | J58: 145.00 | K58: =J58*0.9 -> 130.50
A59: US-045 | B59: Accord | F59: F/Grill | H59: 94 | I59: 97 | J59: 90.00 | K59: =J59*0.9 -> 81.00
B60: Accord | F60: A/M Manual | H60: 94 | I60: 97 | J60: 180.00 | K60: =J60*0.9 -> 162.00 | L60: try MR2 mirrors!
B61: Accord | F61: A/M Power | H61: 94 | I61: 97 | J61: 240.00 | K61: =J61*0.9 -> 216.00 | L61: try MR2 mirrors!
A62: TS-2051 | B62: Capa GA4 | C62: 3 | D62: S-061 | E62: S-063 | F62: S-064 | J62: 646.00 | K62: =J62*0.9 -> 581.40 | L62: Special Order Only
A63: S-061 | B63: Capa GA4 | F63: F/BS | J63: 260.00 | K63: =J63*0.9 -> 234.00 | L63: Special Order Only
A64: S-063 | B64: Capa GA4 | F64: S/S | J64: 210.00 | K64: =J64*0.9 -> 189.00 | L64: Special Order Only
A65: S-064 | B65: Capa GA4 | F65: R/BS | J65: 210.00 | K65: =J65*0.9 -> 189.00 | L65: Special Order Only
A66: S-062 | B66: Capa GA4 | F66: F/Grill | J66: 100.00 | K66: =J66*0.9 -> 90.00 | L66: Special Order Only
A67: S-065 | B67: Capa GA4 | F67: R/S | K67: =J67*0.9 -> 0.00 | L67: under development
A68: TS-0082 | B68: Civic EG 3dr | C68: 4 | D68: UAD-343 | E68: UAD-344 | F68: UAD-345 | H68: 92 | I68: 95 | J68: 598.50 | K68: =J68*0.9 -> 538.65 | L68: HB
A69: TS-1082 | B69: Civic EG 3dr | C69: 4 | D69: UAD-347 | E69: UAD-344 | F69: UAD-345 | H69: 92 | I69: 95 | J69: 494.00 | K69: =J69*0.9 -> 444.60 | L69: HB
A70: TS-0122 | B70: Civic EG 3dr | C70: 4 | D70: UAD-341 | E70: UAD-344 | F70: UAD-345 | H70: 92 | I70: 95 | J70: 598.50 | K70: =J70*0.9 -> 538.65 | L70: HB 04'feb. new
A71: TS-0086 | B71: Civic EJ-1 2dr | C71: 4 | D71: UAD-343 | E71: UAD-207 | F71: UAD-208 | H71: 92 | I71: 95 | J71: 608.00 | K71: =J71*0.9 -> 547.20 | L71: 2 Door
A72: TS-1086 | B72: Civic EJ-1 2dr | C72: 4 | D72: UAD-347 | E72: UAD-207 | F72: UAD-208 | H72: 92 | I72: 95 | J72: 503.50 | K72: =J72*0.9 -> 453.15 | L72: 2 Door
A73: TS-0123 | B73: Civic EJ-1 2dr | C73: 4 | D73: UAD-341 | E73: UAD-207 | F73: UAD-208 | H73: 92 | I73: 95 | J73: 608.00 | K73: =J73*0.9 -> 547.20 | L73: 2 Door 04'feb. new
A74: UAD-343 | B74: Civic EG & EJ-1 | D74: 2 & 3 door | F74: F/BS BM T1 | H74: 92 | I74: 95 | J74: 220.00 | K74: =J74*0.9 -> 198.00
A75: UAD-341 | B75: Civic EG & EJ-1 | D75: 2 & 3 door | F75: F/BS BM T2 | H75: 92 | I75: 95 | J75: 220.00 | K75: =J75*0.9 -> 198.00 | L75: 04'feb. new
A76: UAD-347 | B76: Civic EG & EJ-1 | D76: 2 & 3 door | F76: F/US TYPE 1 | H76: 92 | I76: 95 | J76: 110.00 | K76: =J76*0.9 -> 99.00
A77: UAD-344 | B77: Civic EG 3dr | D77: hatchback | F77: S/S | H77: 92 | I77: 95 | J77: 200.00 | K77: =J77*0.9 -> 180.00
A78: UAD-345 | B78: Civic EG 3dr | D78: hatchback | F78: R/BS | H78: 92 | I78: 95 | J78: 210.00 | K78: =J78*0.9 -> 189.00
A79: UAD-207 | B79: Civic EJ-1 G2dr | D79: coupe | F79: S/S | H79: 92 | I79: 95 | J79: 200.00 | K79: =J79*0.9 -> 180.00 | L79: 03'new
A80: UAD-208 | B80: Civic EG & EJ-1 | D80: coupe/sedan | F80: R/BS | H80: 92 | I80: 95 | J80: 220.00 | K80: =J80*0.9 -> 198.00 | L80: 03'new
A81: UAD-346 | B81: Civic EG 3dr | D81: hatchback | F81: R/S Type 1 | H81: 92 | I81: 95 | J81: 140.00 | K81: =J81*0.9 -> 126.00
A82: UAD-205 | B82: Civic EJ-1 2dr | D82: coupe | F82: R/S T5 | H82: 92 | I82: 95 | J82: 200.00 | K82: =J82*0.9 -> 180.00 | L82: under development
A83: UAD-206 | B83: Civic EJ-1 2dr | D83: coupe | F83: R/S T7 | H83: 92 | I83: 95 | K83: =J83*0.9 -> 0.00 | L83: under development
A84: AD-349 | B84: Civic EG 3dr | D84: HB/ Coupe | F84: A/M Manual | H84: 92 | I84: 95 | J84: 180.00 | K84: =J84*0.9 -> 162.00
A85: AD-350 | B85: Civic EG 3dr | D85: HB/ Coupe | F85: A/M Power | H85: 92 | I85: 95 | J85: 240.00 | K85: =J85*0.9 -> 216.00
A86: TS-0084 | B86: Civic Ferio | C86: 4 | D86: UAD-209 | E86: UAD-210 | F86: UAD-208 | H86: 92 | I86: 95 | J86: 608.00 | K86: =J86*0.9 -> 547.20 | L86: 03'new
A87: TS-0124 | B87: Civic Ferio | D87: UAD-342 | E87: UAD-210 | F87: UAD-208 | H87: 92 | I87: 95 | J87: 608.00 | K87: =J87*0.9 -> 547.20
A88: UAD-209 | B88: Civic Ferio | D88: 4 door | F88: F/BS BM T1 | H88: 92 | I88: 95 | J88: 220.00 | K88: =J88*0.9 -> 198.00 | L88: 03'new
A89: UAD-342 | B89: Civic Ferio | D89: 4 door | F89: F/BS BM T2 | H89: 92 | I89: 95 | J89: 220.00 | K89: =J89*0.9 -> 198.00 | L89: 04' apr. .ｎｅｗ
A90: UAD-210 | B90: Civic Ferio | D90: 4 door | F90: S/S | H90: 92 | I90: 95 | J90: 200.00 | K90: =J90*0.9 -> 180.00 | L90: 03'new
A91: UAD-208 | B91: Civic EG2dr | D91: coupe/sedan | F91: R/BS | H91: 92 | I91: 95 | J91: 220.00 | K91: =J91*0.9 -> 198.00 | L91: 03'new
A92: UAD-212 | B92: Civic Ferio | D92: 4 door | F92: R/S T5 | H92: 92 | I92: 95 | K92: =J92*0.9 -> 0.00 | L92: under development
A93: UAD-213 | B93: Civic Ferio | D93: 4 door | F93: R/S T7 | H93: 92 | I93: 95 | K93: =J93*0.9 -> 0.00 | L93: under development
A94: TS-0103 | B94: Civic EK | C94: 4 | D94: UAD-260 | E94: UAD-262 | F94: UAD-263 | H94: 96 | I94: 98 | J94: 608.00 | K94: =J94*0.9 -> 547.20 | L94: HB
A95: TS-0105 | B95: Civic EK | C95: 4 | D95: UAD-452 | E95: UAD-262 | F95: UAD-263 | H95: 99 | I95: 00 | J95: 608.00 | K95: =J95*0.9 -> 547.20 | L95: HB
A96: TS-0091 | B96: Civic EK | C96: 4 | D96: UAD-260 | E96: UAD-262 | F96: UAD-268 | H96: 96 | I96: 98 | J96: 622.25 | K96: =J96*0.9 -> 560.02499999999998 | L96: 2 Door
A97: TS-0092 | B97: Civic EK | C97: 4 | D97: UAD-452 | E97: UAD-262 | F97: UAD-268 | H97: 99 | I97: 00 | J97: 622.25 | K97: =J97*0.9 -> 560.02499999999998 | L97: 2 Door
A98: TS-0106 | B98: Civic EK | C98: 4 | D98: UAD-260 | E98: UAD-267 | F98: UAD-268 | H98: 96 | I98: 98 | J98: 636.50 | K98: =J98*0.9 -> 572.85 | L98: 4 Door
A99: TS-0107 | B99: Civic EK | C99: 4 | D99: UAD-452 | E99: UAD-267 | F99: UAD-268 | H99: 99 | I99: 00 | J99: 636.50 | K99: =J99*0.9 -> 572.85 | L99: 4 Door
A100: TS-1105 | B100: Civic EK | C100: 4 | D100: UAD-273 | E100: UAD-262 | F100: UAD-263 | H100: 99 | I100: 00 | J100: 498.75 | K100: =J100*0.9 -> 448.875 | L100: 3 Door

A1: TS-1092 | B1: Civic EK | C1: 4 | D1: UAD-273 | E1: UAD-262 | F1: UAD-268 | H1: 99 | I1: 00 | J1: 513.00 | K1: =J1*0.9 -> 461.70 | L1: 2 Door
A2: TS-1107 | B2: Civic EK | C2: 4 | D2: UAD-273 | E2: UAD-267 | F2: UAD-268 | H2: 99 | I2: 00 | J2: 527.25 | K2: =J2*0.9 -> 474.52499999999998 | L2: 4 Door
A3: UAD-260 | B3: Civic EK | D3: all models | F3: F/BS | H3: 96 | I3: 98 | J3: 225.00 | K3: =J3*0.9 -> 202.50 | L3: hatchback/coupe
A4: UAD-452 | B4: Civic EK | D4: all models | F4: F/BS | H4: 99 | I4: 00 | J4: 225.00 | K4: =J4*0.9 -> 202.50 | L4: hatchback/coupe
A5: UAD-273 | B5: Civic EK | D5: all models | F5: F/US | H5: 99 | I5: 00 | J5: 110.00 | K5: =J5*0.9 -> 99.00
A6: UAD-262 | B6: Civic EK | D6: 2 door/3door | F6: S/S | H6: 96 | I6: 00 | J6: 200.00 | K6: =J6*0.9 -> 180.00 | L6: hatchback/coupe
A7: UAD-267 | B7: Civic EK | D7: 4 door | F7: S/S | H7: 96 | I7: 00 | J7: 215.00 | K7: =J7*0.9 -> 193.50 | L7: Sedan
A8: UAD-263 | B8: Civic EK | D8: 3 dr | F8: R/BS | H8: 96 | I8: 00 | J8: 215.00 | K8: =J8*0.9 -> 193.50 | L8: hatchback
A9: UAD-268 | B9: Civic EK | D9: 2dr/4/dr | F9: R/BS | H9: 96 | I9: 00 | J9: 230.00 | K9: =J9*0.9 -> 207.00 | L9: coupe/sedan
A10: UAD-272 | B10: Civic EK | D10: aft | F10: F/Grill | H10: 99 | I10: 00 | J10: 100.00 | K10: =J10*0.9 -> 90.00
A11: UAD-264 | B11: Civic EK | D11: 3 dr | F11: R/S | H11: 96 | I11: 00 | J11: 160.00 | K11: =J11*0.9 -> 144.00 | L11: hatchback
A12: UAD-269 | B12: Civic EK | D12: 4 door | F12: R/S T5 | H12: 96 | I12: 00 | J12: 200.00 | K12: =J12*0.9 -> 180.00 | L12: Sedan
A13: AD-265 | B13: Civic EK | D13: 2 door/3door | F13: A/M Manual | H13: 96 | I13: 00 | J13: 180.00 | K13: =J13*0.9 -> 162.00 | L13: hatchback/coupe
A14: AD-266 | B14: Civic EK | D14: 2 door/3door | F14: A/M Power | H14: 96 | I14: 00 | J14: 240.00 | K14: =J14*0.9 -> 216.00 | L14: hatchback/coupe
A15: AD-270 | B15: Civic EK | D15: 4 door | F15: A/M Manual | H15: 96 | I15: 00 | J15: 180.00 | K15: =J15*0.9 -> 162.00 | L15: 4 door
A16: AD-271 | B16: Civic EK | D16: 4 door | F16: A/M Power | H16: 96 | I16: 00 | J16: 240.00 | K16: =J16*0.9 -> 216.00 | L16: 4 door
A17: TS-0087 | B17: Civic EM | C17: 4 | D17: UAD-540 | E17: UAD-541 | F17: UAD-542 | H17: 01 | I17: 03 | J17: 617.50 | K17: =J17*0.9 -> 555.75
A18: UAD-540 | B18: Civic EM | D18: coupe/sedan | F18: F/BS | H18: 01 | I18: 03 | J18: 230.00 | K18: =J18*0.9 -> 207.00
A19: UAD-541 | B19: Civic EM | D19: 2 door | F19: S/S | H19: 01 | I19: 03 | J19: 200.00 | K19: =J19*0.9 -> 180.00 | L19: Coupe
A20: UAD-542 | B20: Civic EM | D20: 2 door | F20: R/BS | H20: 01 | I20: 03 | J20: 220.00 | K20: =J20*0.9 -> 198.00 | L20: Coupe
A21: UAD-545 | B21: Civic EM | D21: 2 door | F21: R/S | H21: 01 | I21: 03 | K21: =J21*0.9 -> 0.00 | L21: under development
A22: AD-543 | B22: Civic EM | D22: 2 door | F22: A/M Manual | H22: 01 | I22: 03 | J22: 180.00 | K22: =J22*0.9 -> 162.00
A23: AD-544 | B23: Civic EM | D23: 2 door | F23: A/M Power | H23: 01 | I23: 03 | J23: 240.00 | K23: =J23*0.9 -> 216.00
A24: TS-0088 | B24: Civic ES | D24: UAD-540 | E24: UAD-546 | F24: UAD-547 | H24: 01 | I24: 03 | J24: 641.25 | K24: =J24*0.9 -> 577.125 | L24: 4 door
A25: UAD-540 | B25: Civic ES | D25: coupe/sedan | F25: F/BS | H25: 01 | I25: 03 | J25: 230.00 | K25: =J25*0.9 -> 207.00
A26: UAD-546 | B26: Civic ES | D26: 4 door | F26: S/S | H26: 01 | I26: 03 | J26: 215.00 | K26: =J26*0.9 -> 193.50 | L26: Sedan
A27: UAD-547 | B27: Civic ES | D27: 4 door | F27: R/BS | H27: 01 | I27: 03 | J27: 230.00 | K27: =J27*0.9 -> 207.00 | L27: Sedan
A28: UAD-550 | B28: Civic ES | D28: 4 door | F28: R/S | H28: 01 | I28: 03 | J28: 200.00 | K28: =J28*0.9 -> 180.00 | L28: 04'feb. new
A29: AD-548 | B29: Civic ES | D29: 4 door | F29: A/M Manual | H29: 01 | I29: 03 | J29: 180.00 | K29: =J29*0.9 -> 162.00 | L29: 04'feb. new
A30: AD-549 | B30: Civic ES | D30: 4 door | F30: A/M Power | H30: 01 | I30: 03 | J30: 240.00 | K30: =J30*0.9 -> 216.00 | L30: 04'feb. new
A31: TS-0221 | B31: Integra DC | C31: 4 | D31: UAD-432 | E31: UAD-433 | F31: UAD-434 | H31: 94 | I31: 97 | J31: 636.50 | K31: =J31*0.9 -> 572.85 | L31: 2 Door
A32: TS-0222 | B32: Integra DC | C32: 4 | D32: UAD-432 | E32: UAD-437 | F32: UAD-438 | H32: 94 | I32: 97 | J32: 636.50 | K32: =J32*0.9 -> 572.85 | L32: 4 Door
A33: TS-0225 | B33: Integra DC | C33: 4 | D33: UAD-455 | E33: UAD-433 | F33: UAD-434 | H33: 98 | I33: 01 | J33: 636.50 | K33: =J33*0.9 -> 572.85 | L33: 2 Door
A34: TS-0226 | B34: Integra DC | C34: 4 | D34: UAD-455 | E34: UAD-437 | F34: UAD-438 | H34: 98 | I34: 01 | J34: 636.50 | K34: =J34*0.9 -> 572.85 | L34: 4 Door
A35: TS-0223 | B35: Integra DC | C35: 4 | D35: UAD-436 | E35: UAD-433 | F35: UAD-434 | H35: J | I35: J | J35: 636.50 | K35: =J35*0.9 -> 572.85 | L35: 2 Door
A36: TS-0224 | B36: Integra DC | C36: 4 | D36: UAD-436 | E36: UAD-437 | F36: UAD-438 | H36: J | I36: J | J36: 636.50 | K36: =J36*0.9 -> 572.85 | L36: 4 Door
A37: UAD-432 | B37: Integra DC | D37: 2 & 4 door | F37: F/BS | H37: 94 | I37: 97 | J37: 240.00 | K37: =J37*0.9 -> 216.00
A38: UAD-455 | B38: Integra DC | D38: 2 & 4 door | F38: F/BS | H38: 98 | I38: 01 | J38: 240.00 | K38: =J38*0.9 -> 216.00
A39: UAD-436 | B39: Integra DC | D39: 2 & 4 door | F39: F/BS | H39: J | I39: J | J39: 240.00 | K39: =J39*0.9 -> 216.00 | L39: J-Spec Type R
A40: UAD-433 | B40: Integra DC | D40: 2 dr | F40: S/S | H40: 94 | I40: 01 | J40: 200.00 | K40: =J40*0.9 -> 180.00
A41: UAD-437 | B41: Integra DC | D41: 4 dr | F41: S/S | H41: 94 | I41: 01 | J41: 200.00 | K41: =J41*0.9 -> 180.00
A42: UAD-434 | B42: Integra DC | D42: 2 dr | F42: R/BS | H42: 94 | I42: 01 | J42: 230.00 | K42: =J42*0.9 -> 207.00
A43: UAD-438 | B43: Integra DC | D43: 4 dr | F43: R/BS | H43: 94 | I43: 01 | J43: 230.00 | K43: =J43*0.9 -> 207.00
A44: UAD-435 | B44: Integra DC | D44: 2 dr | F44: R/S T7 | H44: 94 | I44: 97 | J44: 220.00 | K44: =J44*0.9 -> 198.00
A45: AD-439 | B45: Integra DC | D45: 2 dr | F45: A/M T1 Manual | H45: 94 | I45: 01 | J45: 180.00 | K45: =J45*0.9 -> 162.00 | L45: do not fit 4 door
A46: AD-440 | B46: Integra DC | D46: 2 dr | F46: A/M T1 Power | H46: 94 | I46: 01 | J46: 240.00 | K46: =J46*0.9 -> 216.00 | L46: do not fit 4 door
A47: TS-0234 | B47: DC5 RSX | C47: 4 | D47: UAD-510 | E47: UAD-515 | F47: UAD-516 | H47: 02 | J47: 655.50 | K47: =J47*0.9 -> 589.95
A48: FIBER | B48: DC5 RSX | C48: 10 | D48: UAD-510 | E48: UAD-515 | F48: UAD-516 | G48: 511, 512, 517 | H48: 02 | J48: 1045 | K48: =J48*0.9 -> 940.50 | L48: all options in regular fiber
A49: CARBON | B49: DC5 RSX | C49: 10 | D49: UAD-510 | E49: UAD-515 | F49: UAD-516 | G49: 511, 512, 517 | H49: 02 | J49: 1358.5 | K49: =J49*0.9 -> 1222.65 | L49: all options in carbon fiber
A50: UAD-510 | B50: DC5 RSX | F50: F/BS | H50: 02 | J50: 240.00 | K50: =J50*0.9 -> 216.00
A51: UAD-511 | B51: DC5 RSX | D51: Fiber | F51: F/BS Side Splitter | H51: 02 | J51: 160.00 | K51: =J51*0.9 -> 144.00
A52: UAD-511-CB | B52: DC5 RSX | D52: Carbon | F52: F/BS Side Splitter | H52: 02 | J52: 280.00 | K52: =J52*0.9 -> 252.00
A53: UAD-512 | B53: DC5 RSX | D53: Fiber | F53: F/BS Bottom Splitter | H53: 02 | J53: 90.00 | K53: =J53*0.9 -> 81.00
A54: UAD-512-CB | B54: DC5 RSX | D54: Carbon | F54: F/BS Bottom Splitter | H54: 02 | J54: 180.00 | K54: =J54*0.9 -> 162.00
A55: UAD-515 | B55: DC5 RSX | F55: S/S | H55: 02 | J55: 220.00 | K55: =J55*0.9 -> 198.00
A56: UAD-516 | B56: DC5 RSX | F56: R/BS | H56: 02 | J56: 230.00 | K56: =J56*0.9 -> 207.00
A57: UAD-517 | B57: DC5 RSX | D57: Fiber | F57: R/BS Horizontal Splitter | H57: 02 | J57: 160.00 | K57: =J57*0.9 -> 144.00
A58: UAD-517-CB | B58: DC5 RSX | D58: Carbon | F58: R/BS Horizontal Splitter | H58: 02 | J58: 280.00 | K58: =J58*0.9 -> 252.00
A59: AD-519 | B59: DC5 RSX | F59: A/M T1 Manual | H59: 02 | J59: 180.00 | K59: =J59*0.9 -> 162.00
A60: AD-520 | B60: DC5 RSX | F60: A/M T1 Power | H60: 02 | J60: 240.00 | K60: =J60*0.9 -> 216.00
A61: TS-2052 | B61: Mobilio | D61: S-078 | E61: S-079 | F61: S-080 | J61: 541.50 | K61: =J61*0.9 -> 487.35 | L61: Special Order Only
A62: S-078 | B62: Mobilio | F62: F/HS | J62: 180.00 | K62: =J62*0.9 -> 162.00 | L62: Special Order Only
A63: S-079 | B63: Mobilio | F63: S/S | J63: 200.00 | K63: =J63*0.9 -> 180.00 | L63: Special Order Only
A64: S-080 | B64: Mobilio | F64: R/HS | J64: 190.00 | K64: =J64*0.9 -> 171.00 | L64: Special Order Only
A65: S-085 | B65: Mobilio | D65: Fiber | F65: Eye Mask | J65: 140.00 | K65: =J65*0.9 -> 126.00 | L65: Special Order Only
A66: S-085-CB | B66: Mobilio | D66: Carbon | F66: Eye Mask | J66: 250.00 | K66: =J66*0.9 -> 225.00 | L66: Special Order Only
A67: TS-2031 | B67: Odyssey RA1, 2 | C67: 4 | D67: US-051 | E67: US-053 | F67: US-054 | H67: 95? | I67: 97? | J67: 646.00 | K67: =J67*0.9 -> 581.40
A68: US-051 | B68: Odyssey RA1, 2 | F68: F/BS | H68: 95? | I68: 97? | J68: 240.00 | K68: =J68*0.9 -> 216.00
A69: US-053 | B69: Odyssey RA1, 2 | F69: S/S | H69: 95? | I69: 97? | J69: 220.00 | K69: =J69*0.9 -> 198.00
A70: US-054 | B70: Odyssey RA1, 2 | F70: R/BS | H70: 95? | I70: 97? | J70: 220.00 | K70: =J70*0.9 -> 198.00
A71: US-055 | B71: Odyssey RA1, 2 | F71: R/S | H71: 95? | I71: 98? | J71: 150.00 | K71: =J71*0.9 -> 135.00
A72: US-052 | B72: Odyssey RA1, 2 | F72: F/Grill | H72: 95? | I72: 97? | J72: 100.00 | K72: =J72*0.9 -> 90.00
A73: TS-2041 | B73: Step Wagon | D73: S-056 | E73: S-058 | F73: S-059 | J73: 636.50 | K73: =J73*0.9 -> 572.85 | L73: Special Order Only
A74: S-056 | B74: Step Wagon | D74: before mc | F74: F/BS | J74: 240.00 | K74: =J74*0.9 -> 216.00 | L74: Special Order Only
A75: S-058 | B75: Step Wagon | D75: before mc | F75: S/S | J75: 200.00 | K75: =J75*0.9 -> 180.00 | L75: Special Order Only
A76: S-059 | B76: Step Wagon | D76: before mc | F76: R/BS | J76: 230.00 | K76: =J76*0.9 -> 207.00 | L76: Special Order Only
A77: S-057 | B77: Step Wagon | D77: before mc | F77: F/Grill | J77: 100.00 | K77: =J77*0.9 -> 90.00 | L77: Special Order Only
A78: S-060 | B78: Step Wagon | F78: R/S | K78: =J78*0.9 -> 0.00 | L78: under development
A79: TS-2042 | B79: Step Wagon RF3 | D79: S-081 | E79: S-083 | F79: S-84 | J79: 560.50 | K79: =J79*0.9 -> 504.45 | L79: Special Order Only
A80: S-081 | B80: Step Wagon RF3 | F80: F/HS | J80: 200.00 | K80: =J80*0.9 -> 180.00 | L80: Special Order Only
A81: S-082 | B81: Step Wagon RF3 | F81: F/Grill | K81: =J81*0.9 -> 0.00 | L81: under development
A82: S-083 | B82: Step Wagon RF3 | F82: S/S | J82: 200.00 | K82: =J82*0.9 -> 180.00 | L82: Special Order Only
A83: S-084 | B83: Step Wagon RF3 | F83: R/HS | J83: 190.00 | K83: =J83*0.9 -> 171.00 | L83: Special Order Only
A84: TS-0227 | B84: RX-7 FC | C84: 4 | D84: UAD-482 | E84: UAD-483 | F84: UAD-484 | H84: 86 | I84: 92 | J84: 627.00 | K84: =J84*0.9 -> 564.30
A85: UAD-482 | B85: RX-7 FC | D85: aft | F85: F/BS | H85: 86 | I85: 92 | J85: 225.00 | K85: =J85*0.9 -> 202.50 | L85: 86-88 needs 89-92 turn signal set
A86: UAD-483 | B86: RX-7 FC | F86: S/S | H86: 86 | I86: 92 | J86: 210.00 | K86: =J86*0.9 -> 189.00
A87: UAD-484 | B87: RX-7 FC | F87: R/BS | H87: 86 | I87: 92 | J87: 225.00 | K87: =J87*0.9 -> 202.50
A88: UAD-485 | B88: RX-7 FC | F88: R/S 7 | H88: 86 | I88: 92 | J88: 220.00 | K88: =J88*0.9 -> 198.00 | L88: under development
A89: AD-486 | B89: RX-7 FC | F89: A/M T1 Manual | H89: 86 | I89: 92 | J89: 180.00 | K89: =J89*0.9 -> 162.00 | L89: under development
A90: AD-487 | B90: RX-7 FC | F90: A/M T1 Power | H90: 86 | I90: 92 | J90: 240.00 | K90: =J90*0.9 -> 216.00 | L90: under development
A91: AD-488 | B91: RX-7 FC | F91: A/M T2 Manual | H91: 86 | I91: 92 | J91: 180.00 | K91: =J91*0.9 -> 162.00 | L91: under development
A92: AD-489 | B92: RX-7 FC | F92: A/M T2 Power | H92: 86 | I92: 92 | J92: 240.00 | K92: =J92*0.9 -> 216.00 | L92: under development
A93: TS-0235 | B93: RX7-FD | C93: 4 | D93: UAD-521 | E93: UAD-523 | F93: UAD-524 | H93: 93 | I93: 95 | J93: 693.50 | K93: =J93*0.9 -> 624.15 | L93: bfr
A94: TS-0236 | B94: RX7-FD | C94: 4 | D94: UAD-522 | E94: UAD-523 | F94: UAD-524 | H94: J | I94: J | J94: 693.50 | K94: =J94*0.9 -> 624.15 | L94: aft
A95: TS-1235 | B95: RX7-FD | C95: 4 | D95: UAD-527 | E95: UAD-523 | F95: UAD-524 | H95: 93 | I95: 95 | J95: 579.50 | K95: =J95*0.9 -> 521.55 | L95: bfr
A96: UAD-521 | B96: RX-7 FD | D96: bfr | F96: F/BS | H96: 93 | I96: 95 | J96: 250.00 | K96: =J96*0.9 -> 225.00
A97: UAD-522 | B97: RX-7 FD | D97: aft | F97: F/BS | H97: J | I97: J | J97: 250.00 | K97: =J97*0.9 -> 225.00
A98: UAD-527 | B98: RX-7 FD | D98: bfr | F98: F/US | H98: 93 | I98: 95 | J98: 130.00 | K98: =J98*0.9 -> 117.00
A99: UAD-523 | B99: RX-7 FD | F99: S/S | H99: 93 | I99: 95 | J99: 230.00 | K99: =J99*0.9 -> 207.00
A100: UAD-524 | B100: RX-7 FD | F100: R/BS | H100: 93 | I100: 95 | J100: 250.00 | K100: =J100*0.9 -> 225.00
A101: UAD-525 | B101: RX-7 FD | F101: A/M T1 Manual | H101: 93 | I101: 95 | J101: 180.00 | K101: =J101*0.9 -> 162.00
A102: UAD-526 | B102: RX-7 FD | F102: A/M T1 Power | H102: 93 | I102: 95 | J102: 240.00 | K102: =J102*0.9 -> 216.00
A103: TS-0083 | B103: Miata NA6, 8 | C103: 4 | D103: UAD-159 | E103: UAD-043 | F103: UAD-044 | H103: 90 | I103: 97 | J103: 589.00 | K103: =J103*0.9 -> 530.10 | L103: modify to install side marker
A104: TS-0085 | B104: Miata NA6, 8 | C104: 4 | D104: UAD-045 | E104: UAD-043 | F104: UAD-044 | H104: 90 | I104: 97 | J104: 598.50 | K104: =J104*0.9 -> 538.65 | L104: modify to install side marker
A105: TS-1085 | B105: Miata NA6, 8 | C105: 4 | D105: UAD-037 | E105: UAD-043 | F105: UAD-044 | H105: 90 | I105: 97 | J105: 541.50 | K105: =J105*0.9 -> 487.35 | L105: fit over side marker frt/rear
A106: UAD-045 | B106: Miata NA6, 8 | F106: F/BS w/o LK | H106: 90 | I106: 97 | J106: 230.00 | K106: =J106*0.9 -> 207.00 | L106: modify to install side marker
A107: AD-038 | B107: Miata NA6, 8 | F107: F/BS w/LK | H107: 90 | I107: 97 | J107: 450.00 | K107: =J107*0.9 -> 405.00 | L107: not available in US
A108: UAD-159 | B108: Miata NA6, 8 | F108: F/BS BM | H108: 90 | I108: 97 | J108: 220.00 | K108: =J108*0.9 -> 198.00 | L108: modify to install side marker
A109: UAD-037 | B109: Miata NA6, 8 | F109: F/HS | H109: 90 | I109: 97 | J109: 170.00 | K109: =J109*0.9 -> 153.00 | L109: fit over side marker
A110: UAD-043 | B110: Miata NA6, 8 | F110: S/S Type 1 | H110: 90 | I110: 97 | J110: 200.00 | K110: =J110*0.9 -> 180.00
A111: UAD-044 | B111: Miata NA6, 8 | F111: R/US Type 1 | H111: 90 | I111: 97 | J111: 200.00 | K111: =J111*0.9 -> 180.00 | L111: fit over side marker
A112: UAD-039 | B112: Miata NA6, 8 | F112: R/S Type 1 | H112: 90 | I112: 97 | J112: 170.00 | K112: =J112*0.9 -> 153.00
A113: UAD-040 | B113: Miata NA6, 8 | F113: R/S Type 2 | H113: 90 | I113: 97 | J113: 180.00 | K113: =J113*0.9 -> 162.00
A114: UAD-160 | B114: Miata NA6, 8 | F114: R/S Type 3 | H114: 90 | I114: 97 | J114: 140.00 | K114: =J114*0.9 -> 126.00
A115: AD-046 | B115: Miata NA6, 8 | F115: A/Panel left side | H115: 90 | I115: 97 | J115: 90.00 | K115: =J115*0.9 -> 81.00 | L115: discontinued
A116: AD-042 | B116: Miata NA6, 8 | F116: A/M Manual | H116: 90 | I116: 97 | J116: 180.00 | K116: =J116*0.9 -> 162.00
A117: AM-001 | B117: Miata NA/NB | D117: Tonnau Cover | H117: 90 | I117: 01 | K117: =J117*0.9 -> #VALUE! | L117: under development
A118: TS-0104 | B118: Miata NB6, 8 | C118: 5 | D118: UAD-417 | E118: UAD-418 | F118: UAD-419 | H118: 98 | I118: 01 | J118: 560.50 | K118: =J118*0.9 -> 504.45 | L118: modify to install side marker
A119: UAD-417 | B119: Miata NB6, 8 | D119: bfr&mid | F119: F/BS | H119: 98 | I119: 00 | J119: 240.00 | K119: =J119*0.9 -> 216.00 | L119: modify to install side marker
A120: UAD-418 | B120: Miata NB6, 8 | F120: S/S | H120: 98 | I120: 01 | J120: 200.00 | K120: =J120*0.9 -> 180.00
A121: UAD-419 | B121: Miata NB6, 8 | F121: R/U | H121: 98 | I121: 01 | J121: 150.00 | K121: =J121*0.9 -> 135.00
A122: UAD-420 | B122: Miata NB6, 8 | F122: R/S | H122: 98 | I122: 01 | J122: 150.00 | K122: =J122*0.9 -> 135.00
A123: AD-421 | B123: Miata NB6, 8 | F123: A/M Manual | H123: 98 | I123: 01 | J123: 180.00 | K123: =J123*0.9 -> 162.00
A124: TS-0102 | B124: 3000GT Z16A | C124: 4 | D124: UAD-170 | E124: UAD-171 | F124: UAD-172 | H124: 94 | I124: 98 | J124: 760.00 | K124: =J124*0.9 -> 684.00
A125: TS-1102 | B125: 3000GT Z16A | C125: 4 | D125: UAD-340 | E125: UAD-171 | F125: UAD-172 | H125: 94 | I125: 96 | J125: 627.00 | K125: =J125*0.9 -> 564.30
A126: TS-0101 | B126: 3000GT Z16A | C126: 4 | D126: UAD-431 | E126: UAD-171 | F126: UAD-172 | H126: 91 | I126: 93 | J126: 760.00 | K126: =J126*0.9 -> 684.00
A127: UAD-170 | B127: 3000GT Z16A | D127: aft | F127: F/BS | H127: 94 | I127: 98 | J127: 270.00 | K127: =J127*0.9 -> 243.00
A128: UAD-431 | B128: 3000GT Z16A | D128: bfr | F128: F/BS | H128: 91 | I128: 93 | J128: 270.00 | K128: =J128*0.9 -> 243.00
A129: UAD-340 | B129: 3000GT Z16A | D129: aft | F129: F/US | H129: 94 | I129: 96 | J129: 130.00 | K129: =J129*0.9 -> 117.00
A130: UAD-171 | B130: 3000GT Z16A | F130: S/S | H130: 91 | I130: 01 | J130: 260.00 | K130: =J130*0.9 -> 234.00
A131: UAD-172 | B131: 3000GT Z16A | F131: R/BS | H131: 91 | I131: 01 | J131: 270.00 | K131: =J131*0.9 -> 243.00
A132: UAD-173 | B132: 3000GT Z16A | F132: R/S Type 1 | H132: 91 | I132: 01 | J132: 220.00 | K132: =J132*0.9 -> 198.00 | L132: Spyder (Convertible)?
A133: AD-115 | B133: 3000GT Z16A | F133: A/M Manual | H133: 91 | I133: 01 | J133: 180.00 | K133: =J133*0.9 -> 162.00
A134: AD-116 | B134: 3000GT Z16A | F134: A/M Power | H134: 91 | I134: 01 | J134: 240.00 | K134: =J134*0.9 -> 216.00 | L134: discontinued
A135: TS-0230 | B135: Eclipse | C135: 4 | D135: UAD-490 | E135: UAD-496 | F135: UAD-497 | H135: 95 | I135: 96 | J135: 684.00 | K135: =J135*0.9 -> 615.60 | L135: bfr
A136: TS-0231 | B136: Eclipse | C136: 4 | D136: UAD-491 | E136: UAD-496 | F136: UAD-497 | H136: 95 | I136: 96 | J136: 693.50 | K136: =J136*0.9 -> 624.15 | L136: bfr
A137: TS-0232 | B137: Eclipse | C137: 4 | D137: UAD-493 | E137: UAD-496 | F137: UAD-497 | H137: 97 | I137: 99 | J137: 684.00 | K137: =J137*0.9 -> 615.60 | L137: aft
A138: TS-0233 | B138: Eclipse | C138: 4 | D138: UAD-494 | E138: UAD-496 | F138: UAD-497 | H138: 97 | I138: 99 | J138: 693.50 | K138: =J138*0.9 -> 624.15 | L138: aft
A139: UAD-490 | B139: Eclipse | D139: bfr | F139: F/BS | H139: 95 | I139: 96 | J139: 240.00 | K139: =J139*0.9 -> 216.00
A140: UAD-491 | B140: Eclipse | D140: bfr | F140: F/BS w/o Lites | H140: 95 | I140: 96 | J140: 250.00 | K140: =J140*0.9 -> 225.00
A141: UAD-492 | B141: Eclipse | D141: bfr | F141: F/BS w/ Lites | H141: 95 | I141: 96 | J141: 470.00 | K141: =J141*0.9 -> 423.00
A142: UAD-493 | B142: Eclipse | D142: aft | F142: F/BS | H142: 97 | I142: 99 | J142: 240.00 | K142: =J142*0.9 -> 216.00
A143: UAD-494 | B143: Eclipse | D143: aft | F143: F/BS w/o Lites | H143: 97 | I143: 99 | J143: 250.00 | K143: =J143*0.9 -> 225.00
A144: UAD-495 | B144: Eclipse | D144: aft | F144: F/BS w/ Lites | H144: 97 | I144: 99 | J144: 470.00 | K144: =J144*0.9 -> 423.00
A145: UAD-496 | B145: Eclipse | F145: S/S | H145: 95 | I145: 99 | J145: 220.00 | K145: =J145*0.9 -> 198.00
A146: UAD-497 | B146: Eclipse | F146: R/BS | H146: 95 | I146: 99 | J146: 260.00 | K146: =J146*0.9 -> 234.00 | L146: 95-96 needs 97-99 backup lights
A147: UAD-498 | B147: Eclipse | F147: R/ST5 | H147: 95 | I147: 99 | K147: =J147*0.9 -> 0.00 | L147: reserved item number only
A148: UAD-499 | B148: Eclipse | F148: R/S | H148: 95 | I148: 99 | K148: =J148*0.9 -> 0.00 | L148: reserved item number only
A149: AD-500 | B149: Eclipse | F149: A/M Manual | H149: 95 | I149: 99 | J149: 180.00 | K149: =J149*0.9 -> 162.00
A150: AD-501 | B150: Eclipse | F150: A/M Power | H150: 95 | I150: 99 | J150: 240.00 | K150: =J150*0.9 -> 216.00

A1: TS-0239 | B1: Eclipse D52 | C1: 4 | D1: UAD-551 | E1: UAD-554 | F1: UAD-555 | H1: 00 | J1: 655.50 | K1: =J1*0.9 -> 589.95 | L1: 04' mar. New
A2: TS-0240 | B2: Eclipse D52 | C2: 4 | D2: UAD-552 | E2: UAD-554 | F2: UAD-555 | H2: 00 | J2: 655.50 | K2: =J2*0.9 -> 589.95
A3: UAD-551 | B3: Eclipse D52 | F3: F/BS BM | H3: 00 | J3: 230.00 | K3: =J3*0.9 -> 207.00 | L3: 04'mar. New
A4: UAD-552 | B4: Eclipse D52 | F4: F/BS w/o Lites | H4: 00 | J4: 230.00 | K4: =J4*0.9 -> 207.00
A5: UAD-554 | B5: Eclipse D52 | F5: S/S | H5: 00 | J5: 210.00 | K5: =J5*0.9 -> 189.00
A6: UAD-555 | B6: Eclipse D52 | F6: R/BS | H6: 00 | J6: 250.00 | K6: =J6*0.9 -> 225.00
A7: UAD-556 | B7: Eclipse D52 | F7: R/S | H7: 00 | J7: 180.00 | K7: =J7*0.9 -> 162.00 | L7: under development
A8: AD-558 | B8: Eclipse D52 | F8: A/M Manual | H8: 00 | J8: 180.00 | K8: =J8*0.9 -> 162.00
A9: AD-559 | B9: Eclipse D52 | F9: A/M Power | H9: 00 | J9: 240.00 | K9: =J9*0.9 -> 216.00
A10: TS-2061 | B10: Elgrand | D10: S-066 | E10: S-067 | F10: S-068 | J10: 617.50 | K10: =J10*0.9 -> 555.75
A11: S-066 | B11: Elgrand | D11: bfr&aft | F11: F/HS | J11: 240.00 | K11: =J11*0.9 -> 216.00 | L11: Special Order Only
A12: S-067 | B12: Elgrand | D12: bfr & aft | F12: S/S | J12: 200.00 | K12: =J12*0.9 -> 180.00 | L12: Special Order Only
A13: S-068 | B13: Elgrand | D13: bfr & aft | F13: R/HS | J13: 210.00 | K13: =J13*0.9 -> 189.00 | L13: Special Order Only
A14: TS-0013 | B14: 180(240)SX | C14: 4 | D14: AD-404 | E14: UAD-005 | F14: UAD-006 | H14: 89 | I14: 94 | J14: 589.00 | K14: =J14*0.9 -> 530.10 | L14: HB needs TS405/BKT405 SO only
A15: TS-0172 | B15: 180(240)SX | C15: 5 | D15: AD-404 | E15: UAD-005 | F15: UAD-193 | H15: 89 | I15: 94 | J15: 636.50 | K15: =J15*0.9 -> 572.85 | L15: HB needs TS405/BKT405 SO only
A16: TS-0173 | B16: 180(240)SX | C16: 4 | D16: AD-404 | E16: UAD-399 | F16: UAD-006 | H16: 89 | I16: 94 | J16: 589.00 | K16: =J16*0.9 -> 530.10 | L16: HB needs TS405/BKT405 SO only
A17: TS-0174 | B17: 180(240)SX | C17: 5 | D17: AD-404 | E17: UAD-399 | F17: UAD-193 | H17: 89 | I17: 94 | J17: 636.50 | K17: =J17*0.9 -> 572.85 | L17: HB needs TS405/BKT405 SO only
A18: TS-0175 | B18: 180(240)SX | C18: 4 | D18: AD-404 | E18: UAD-429 | F18: UAD-006 | H18: 89 | I18: 94 | J18: 608.00 | K18: =J18*0.9 -> 547.20 | L18: HB needs TS405/BKT405 SO only
A19: TS-0176 | B19: 180(240)SX | C19: 5 | D19: AD-404 | E19: UAD-429 | F19: UAD-193 | H19: 89 | I19: 94 | J19: 655.50 | K19: =J19*0.9 -> 589.95 | L19: HB needs TS405/BKT405 SO only
A20: TS-0177 | B20: 180(240)SX | C20: 4 | D20: UAD-405 | E20: UAD-005 | F20: UAD-006 | H20: 89 | I20: 94 | J20: 579.50 | K20: =J20*0.9 -> 521.55 | L20: HB needs TS405/BKT405
A21: TS-0178 | B21: 180(240)SX | C21: 5 | D21: UAD-405 | E21: UAD-005 | F21: UAD-193 | H21: 89 | I21: 94 | J21: 627.00 | K21: =J21*0.9 -> 564.30 | L21: HB needs TS405/BKT405
A22: TS-0179 | B22: 180(240)SX | C22: 4 | D22: UAD-405 | E22: UAD-399 | F22: UAD-006 | H22: 89 | I22: 94 | J22: 579.50 | K22: =J22*0.9 -> 521.55 | L22: HB needs TS405/BKT405
A23: TS-0180 | B23: 180(240)SX | C23: 5 | D23: UAD-405 | E23: UAD-399 | F23: UAD-193 | H23: 89 | I23: 94 | J23: 627.00 | K23: =J23*0.9 -> 564.30 | L23: HB needs TS405/BKT405
A24: TS-0181 | B24: 180(240)SX | C24: 4 | D24: UAD-405 | E24: UAD-429 | F24: UAD-006 | H24: 89 | I24: 94 | J24: 598.50 | K24: =J24*0.9 -> 538.65 | L24: HB needs TS405/BKT405
A25: TS-0118 | B25: 180(240)SX | C25: 5 | D25: UAD-405 | E25: UAD-429 | F25: UAD-193 | H25: 89 | I25: 94 | J25: 646.00 | K25: =J25*0.9 -> 581.40 | L25: HB needs TS405/BKT405
A26: TS-0017 | B26: 180(240)SX | C26: 4 | D26: AD-023 | E26: UAD-005 | F26: UAD-006 | H26: 89 | I26: 94 | J26: 589.00 | K26: =J26*0.9 -> 530.10 | L26: HB need 91-94 TS, SO only
A27: TS-0182 | B27: 180(240)SX | C27: 5 | D27: AD-023 | E27: UAD-005 | F27: UAD-193 | H27: 89 | I27: 94 | J27: 636.50 | K27: =J27*0.9 -> 572.85 | L27: HB need 91-94 TS, SO only
A28: TS-0183 | B28: 180(240)SX | C28: 4 | D28: AD-023 | E28: UAD-399 | F28: UAD-006 | H28: 89 | I28: 94 | J28: 589.00 | K28: =J28*0.9 -> 530.10 | L28: HB need 91-94 TS, SO only
A29: TS-0184 | B29: 180(240)SX | C29: 5 | D29: AD-023 | E29: UAD-399 | F29: UAD-193 | H29: 89 | I29: 94 | J29: 636.50 | K29: =J29*0.9 -> 572.85 | L29: HB need 91-94 TS, SO only
A30: TS-0185 | B30: 180(240)SX | C30: 4 | D30: AD-023 | E30: UAD-429 | F30: UAD-006 | H30: 89 | I30: 94 | J30: 608.00 | K30: =J30*0.9 -> 547.20 | L30: HB need 91-94 TS, SO only
A31: TS-0186 | B31: 180(240)SX | C31: 5 | D31: AD-023 | E31: UAD-429 | F31: UAD-193 | H31: 89 | I31: 94 | J31: 655.50 | K31: =J31*0.9 -> 589.95 | L31: HB need 91-94 TS, SO only
A32: TS-0021 | B32: 180(240)SX | C32: 4 | D32: UAD-030 | E32: UAD-005 | F32: UAD-006 | H32: 89 | I32: 94 | J32: 579.50 | K32: =J32*0.9 -> 521.55 | L32: HB need 91-94 turn signal
A33: TS-0187 | B33: 180(240)SX | C33: 5 | D33: UAD-030 | E33: UAD-005 | F33: UAD-193 | H33: 89 | I33: 94 | J33: 627.00 | K33: =J33*0.9 -> 564.30 | L33: HB need 91-94 turn signal
A34: TS-0188 | B34: 180(240)SX | C34: 4 | D34: UAD-030 | E34: UAD-399 | F34: UAD-006 | H34: 89 | I34: 94 | J34: 579.50 | K34: =J34*0.9 -> 521.55 | L34: HB need 91-94 turn signal
A35: TS-0189 | B35: 180(240)SX | C35: 5 | D35: UAD-030 | E35: UAD-399 | F35: UAD-193 | H35: 89 | I35: 94 | J35: 627.00 | K35: =J35*0.9 -> 564.30 | L35: HB need 91-94 turn signal
A36: TS-0190 | B36: 180(240)SX | C36: 4 | D36: UAD-030 | E36: UAD-429 | F36: UAD-006 | H36: 89 | I36: 94 | J36: 598.50 | K36: =J36*0.9 -> 538.65 | L36: HB need 91-94 turn signal
A37: TS-0191 | B37: 180(240)SX | C37: 5 | D37: UAD-030 | E37: UAD-429 | F37: UAD-193 | H37: 89 | I37: 94 | J37: 646.00 | K37: =J37*0.9 -> 581.40 | L37: HB need 91-94 turn signal
A38: TS-0019 | B38: 180(240)SX | C38: 4 | D38: AD-106 | E38: UAD-005 | F38: UAD-006 | H38: 89 | I38: 94 | J38: 589.00 | K38: =J38*0.9 -> 530.10 | L38: HB need 91-94 TS, SO only
A39: TS-0192 | B39: 180(240)SX | C39: 5 | D39: AD-106 | E39: UAD-005 | F39: UAD-193 | H39: 89 | I39: 94 | J39: 636.50 | K39: =J39*0.9 -> 572.85 | L39: HB need 91-94 TS, SO only
A40: TS-0193 | B40: 180(240)SX | C40: 4 | D40: AD-106 | E40: UAD-399 | F40: UAD-006 | H40: 89 | I40: 94 | J40: 589.00 | K40: =J40*0.9 -> 530.10 | L40: HB need 91-94 TS, SO only
A41: TS-0194 | B41: 180(240)SX | C41: 5 | D41: AD-106 | E41: UAD-399 | F41: UAD-193 | H41: 89 | I41: 94 | J41: 636.50 | K41: =J41*0.9 -> 572.85 | L41: HB need 91-94 TS, SO only
A42: TS-0195 | B42: 180(240)SX | C42: 4 | D42: AD-106 | E42: UAD-429 | F42: UAD-006 | H42: 89 | I42: 94 | J42: 608.00 | K42: =J42*0.9 -> 547.20 | L42: HB need 91-94 TS, SO only
A43: TS-0196 | B43: 180(240)SX | C43: 5 | D43: AD-106 | E43: UAD-429 | F43: UAD-193 | H43: 89 | I43: 94 | J43: 655.50 | K43: =J43*0.9 -> 589.95 | L43: HB need 91-94 TS, SO only
A44: TS-0015 | B44: 180(240)SX | C44: 4 | D44: UAD-027 | E44: UAD-005 | F44: UAD-006 | H44: 89 | I44: 94 | J44: 579.50 | K44: =J44*0.9 -> 521.55 | L44: HB need 91-94 turn signal
A45: TS-0197 | B45: 180(240)SX | C45: 5 | D45: UAD-027 | E45: UAD-005 | F45: UAD-193 | H45: 89 | I45: 94 | J45: 627.00 | K45: =J45*0.9 -> 564.30 | L45: HB need 91-94 turn signal
A46: TS-0016 | B46: 180(240)SX | C46: 4 | D46: UAD-027 | E46: UAD-399 | F46: UAD-006 | H46: 89 | I46: 94 | J46: 579.50 | K46: =J46*0.9 -> 521.55 | L46: HB need 91-94 turn signal
A47: TS-0198 | B47: 180(240)SX | C47: 5 | D47: UAD-027 | E47: UAD-399 | F47: UAD-193 | H47: 89 | I47: 94 | J47: 627.00 | K47: =J47*0.9 -> 564.30 | L47: HB need 91-94 turn signal
A48: TS-0199 | B48: 180(240)SX | C48: 4 | D48: UAD-027 | E48: UAD-429 | F48: UAD-006 | H48: 89 | I48: 94 | J48: 598.50 | K48: =J48*0.9 -> 538.65 | L48: HB need 91-94 turn signal
A49: TS-0200 | B49: 180(240)SX | C49: 5 | D49: UAD-027 | E49: UAD-429 | F49: UAD-193 | H49: 89 | I49: 94 | J49: 646.00 | K49: =J49*0.9 -> 581.40 | L49: HB need 91-94 turn signal
A50: TS-0201 | B50: 180(240)SX | C50: 4 | D50: UAD-406 | E50: UAD-005 | F50: UAD-006 | H50: 89 | I50: 94 | J50: 579.50 | K50: =J50*0.9 -> 521.55 | L50: HB need 91-94 turn signal
A51: TS-0202 | B51: 180(240)SX | C51: 5 | D51: UAD-406 | E51: UAD-005 | F51: UAD-193 | H51: 89 | I51: 94 | J51: 627.00 | K51: =J51*0.9 -> 564.30 | L51: HB need 91-94 turn signal
A52: TS-0203 | B52: 180(240)SX | C52: 4 | D52: UAD-406 | E52: UAD-399 | F52: UAD-006 | H52: 89 | I52: 94 | J52: 579.50 | K52: =J52*0.9 -> 521.55 | L52: HB need 91-94 turn signal
A53: TS-0204 | B53: 180(240)SX | C53: 5 | D53: UAD-406 | E53: UAD-399 | F53: UAD-193 | H53: 89 | I53: 94 | J53: 627.00 | K53: =J53*0.9 -> 564.30 | L53: HB need 91-94 turn signal
A54: TS-0205 | B54: 180(240)SX | C54: 4 | D54: UAD-406 | E54: UAD-429 | F54: UAD-006 | H54: 89 | I54: 94 | J54: 598.50 | K54: =J54*0.9 -> 538.65 | L54: HB need 91-94 turn signal
A55: TS-0120 | B55: 180(240)SX | C55: 5 | D55: UAD-406 | E55: UAD-429 | F55: UAD-193 | H55: 89 | I55: 94 | J55: 646.00 | K55: =J55*0.9 -> 581.40 | L55: HB need 91-94 turn signal
A56: TS-1213 | B56: 180(240)SX | C56: 4 | D56: UAD-241 | E56: UAD-005 | F56: UAD-006 | H56: 91 | I56: 94 | J56: 465.50 | K56: =J56*0.9 -> 418.95 | L56: HB
A57: TS-1214 | B57: 180(240)SX | C57: 5 | D57: UAD-241 | E57: UAD-005 | F57: UAD-193 | H57: 91 | I57: 94 | J57: 513.00 | K57: =J57*0.9 -> 461.70 | L57: HB
A58: TS-1015 | B58: 180(240)SX | C58: 4 | D58: UAD-241 | E58: UAD-399 | F58: UAD-006 | H58: 91 | I58: 94 | J58: 465.50 | K58: =J58*0.9 -> 418.95 | L58: HB
A59: TS-1215 | B59: 180(240)SX | C59: 5 | D59: UAD-241 | E59: UAD-399 | F59: UAD-193 | H59: 91 | I59: 94 | J59: 513.00 | K59: =J59*0.9 -> 461.70 | L59: HB
A60: TS-1216 | B60: 180(240)SX | C60: 4 | D60: UAD-241 | E60: UAD-429 | F60: UAD-006 | G60: 589.00 | H60: 91 | I60: 94 | J60: 484.50 | K60: =J60*0.9 -> 436.05 | L60: HB
A61: TS-1217 | B61: 180(240)SX | C61: 5 | D61: UAD-241 | E61: UAD-429 | F61: UAD-193 | G61: 636.50 | H61: 91 | I61: 94 | J61: 532.00 | K61: =J61*0.9 -> 478.80 | L61: HB
A62: TS-0013CP | B62: 240SX | C62: 4 | D62: AD-404 | E62: UAD-005 | F62: UAD-013 | G62: 589.00 | H62: 89 | I62: 94 | J62: 589.00 | K62: =J62*0.9 -> 530.10 | L62: CP needs TS405/BKT405 SO only
A63: TS-0172CP | B63: 240SX | C63: 5 | D63: AD-404 | E63: UAD-005 | F63: UAD-192 | G63: 636.50 | H63: 89 | I63: 94 | J63: 636.50 | K63: =J63*0.9 -> 572.85 | L63: CP needs TS405/BKT405 SO only
A64: TS-0173CP | B64: 240SX | C64: 4 | D64: AD-404 | E64: UAD-399 | F64: UAD-013 | G64: 608.00 | H64: 89 | I64: 94 | J64: 589.00 | K64: =J64*0.9 -> 530.10 | L64: CP needs TS405/BKT405 SO only
A65: TS-0174CP | B65: 240SX | C65: 5 | D65: AD-404 | E65: UAD-399 | F65: UAD-192 | G65: 655.50 | H65: 89 | I65: 94 | J65: 636.50 | K65: =J65*0.9 -> 572.85 | L65: CP needs TS405/BKT405 SO only
A66: TS-0175CP | B66: 240SX | C66: 4 | D66: AD-404 | E66: UAD-429 | F66: UAD-013 | H66: 89 | I66: 94 | J66: 608.00 | K66: =J66*0.9 -> 547.20 | L66: CP needs TS405/BKT405 SO only
A67: TS-0176CP | B67: 240SX | C67: 5 | D67: AD-404 | E67: UAD-429 | F67: UAD-192 | H67: 89 | I67: 94 | J67: 655.50 | K67: =J67*0.9 -> 589.95 | L67: CP needs TS405/BKT405 SO only
A68: TS-0177CP | B68: 240SX | C68: 4 | D68: UAD-405 | E68: UAD-005 | F68: UAD-013 | H68: 89 | I68: 94 | J68: 579.50 | K68: =J68*0.9 -> 521.55 | L68: CP needs TS405/BKT405
A69: TS-0178CP | B69: 240SX | C69: 5 | D69: UAD-405 | E69: UAD-005 | F69: UAD-192 | H69: 89 | I69: 94 | J69: 627.00 | K69: =J69*0.9 -> 564.30 | L69: CP needs TS405/BKT405
A70: TS-0179CP | B70: 240SX | C70: 4 | D70: UAD-405 | E70: UAD-399 | F70: UAD-013 | H70: 89 | I70: 94 | J70: 579.50 | K70: =J70*0.9 -> 521.55 | L70: CP needs TS405/BKT405
A71: TS-0180CP | B71: 240SX | C71: 5 | D71: UAD-405 | E71: UAD-399 | F71: UAD-192 | H71: 89 | I71: 94 | J71: 627.00 | K71: =J71*0.9 -> 564.30 | L71: CP needs TS405/BKT405
A72: TS-0181CP | B72: 240SX | C72: 4 | D72: UAD-405 | E72: UAD-429 | F72: UAD-013 | H72: 89 | I72: 94 | J72: 598.50 | K72: =J72*0.9 -> 538.65 | L72: CP needs TS405/BKT405
A73: TS-0118CP | B73: 240SX | C73: 5 | D73: UAD-405 | E73: UAD-429 | F73: UAD-192 | H73: 89 | I73: 94 | J73: 646.00 | K73: =J73*0.9 -> 581.40 | L73: CP needs TS405/BKT405
A74: TS-0017CP | B74: 240SX | C74: 4 | D74: AD-023 | E74: UAD-005 | F74: UAD-013 | H74: 89 | I74: 94 | J74: 589.00 | K74: =J74*0.9 -> 530.10 | L74: CP need 91-94 TS, SO only
A75: TS-0182CP | B75: 240SX | C75: 5 | D75: AD-023 | E75: UAD-005 | F75: UAD-192 | H75: 89 | I75: 94 | J75: 636.50 | K75: =J75*0.9 -> 572.85 | L75: CP need 91-94 TS, SO only
A76: TS-0183CP | B76: 240SX | C76: 4 | D76: AD-023 | E76: UAD-399 | F76: UAD-013 | H76: 89 | I76: 94 | J76: 589.00 | K76: =J76*0.9 -> 530.10 | L76: CP need 91-94 TS, SO only
A77: TS-0184CP | B77: 240SX | C77: 5 | D77: AD-023 | E77: UAD-399 | F77: UAD-192 | H77: 89 | I77: 94 | J77: 636.50 | K77: =J77*0.9 -> 572.85 | L77: CP need 91-94 TS, SO only
A78: TS-0185CP | B78: 240SX | C78: 4 | D78: AD-023 | E78: UAD-429 | F78: UAD-013 | H78: 89 | I78: 94 | J78: 608.00 | K78: =J78*0.9 -> 547.20 | L78: CP need 91-94 TS, SO only
A79: TS-0186CP | B79: 240SX | C79: 5 | D79: AD-023 | E79: UAD-429 | F79: UAD-192 | H79: 89 | I79: 94 | J79: 655.50 | K79: =J79*0.9 -> 589.95 | L79: CP need 91-94 TS, SO only
A80: TS-0021CP | B80: 240SX | C80: 4 | D80: UAD-030 | E80: UAD-005 | F80: UAD-013 | H80: 89 | I80: 94 | J80: 579.50 | K80: =J80*0.9 -> 521.55 | L80: CP need 91-94 turn signal
A81: TS-0187CP | B81: 240SX | C81: 5 | D81: UAD-030 | E81: UAD-005 | F81: UAD-192 | H81: 89 | I81: 94 | J81: 627.00 | K81: =J81*0.9 -> 564.30 | L81: CP need 91-94 turn signal
A82: TS-0188CP | B82: 240SX | C82: 4 | D82: UAD-030 | E82: UAD-399 | F82: UAD-013 | H82: 89 | I82: 94 | J82: 579.50 | K82: =J82*0.9 -> 521.55 | L82: CP need 91-94 turn signal
A83: TS-0189CP | B83: 240SX | C83: 5 | D83: UAD-030 | E83: UAD-399 | F83: UAD-192 | H83: 89 | I83: 94 | J83: 627.00 | K83: =J83*0.9 -> 564.30 | L83: CP need 91-94 turn signal
A84: TS-0190CP | B84: 240SX | C84: 4 | D84: UAD-030 | E84: UAD-429 | F84: UAD-013 | H84: 89 | I84: 94 | J84: 598.50 | K84: =J84*0.9 -> 538.65 | L84: CP need 91-94 turn signal
A85: TS-0191CP | B85: 240SX | C85: 5 | D85: UAD-030 | E85: UAD-429 | F85: UAD-192 | H85: 89 | I85: 94 | J85: 646.00 | K85: =J85*0.9 -> 581.40 | L85: CP need 91-94 turn signal
A86: TS-0019CP | B86: 240SX | C86: 4 | D86: AD-106 | E86: UAD-005 | F86: UAD-013 | H86: 89 | I86: 94 | J86: 589.00 | K86: =J86*0.9 -> 530.10 | L86: CP need 91-94 TS, SO only
A87: TS-0192CP | B87: 240SX | C87: 5 | D87: AD-106 | E87: UAD-005 | F87: UAD-192 | H87: 89 | I87: 94 | J87: 636.50 | K87: =J87*0.9 -> 572.85 | L87: CP need 91-94 TS, SO only
A88: TS-0193CP | B88: 240SX | C88: 4 | D88: AD-106 | E88: UAD-399 | F88: UAD-013 | H88: 89 | I88: 94 | J88: 589.00 | K88: =J88*0.9 -> 530.10 | L88: CP need 91-94 TS, SO only
A89: TS-0194CP | B89: 240SX | C89: 5 | D89: AD-106 | E89: UAD-399 | F89: UAD-192 | H89: 89 | I89: 94 | J89: 636.50 | K89: =J89*0.9 -> 572.85 | L89: CP need 91-94 TS, SO only
A90: TS-0195CP | B90: 240SX | C90: 4 | D90: AD-106 | E90: UAD-429 | F90: UAD-013 | H90: 89 | I90: 94 | J90: 608.00 | K90: =J90*0.9 -> 547.20 | L90: CP need 91-94 TS, SO only
A91: TS-0196CP | B91: 240SX | C91: 5 | D91: AD-106 | E91: UAD-429 | F91: UAD-192 | H91: 89 | I91: 94 | J91: 655.50 | K91: =J91*0.9 -> 589.95 | L91: CP need 91-94 TS, SO only
A92: TS-0015CP | B92: 240SX | C92: 4 | D92: UAD-027 | E92: UAD-005 | F92: UAD-013 | H92: 89 | I92: 94 | J92: 579.50 | K92: =J92*0.9 -> 521.55 | L92: CP need 91-94 turn signal
A93: TS-0197CP | B93: 240SX | C93: 5 | D93: UAD-027 | E93: UAD-005 | F93: UAD-192 | H93: 89 | I93: 94 | J93: 627.00 | K93: =J93*0.9 -> 564.30 | L93: CP need 91-94 turn signal
A94: TS-0016CP | B94: 240SX | C94: 4 | D94: UAD-027 | E94: UAD-399 | F94: UAD-013 | H94: 89 | I94: 94 | J94: 579.50 | K94: =J94*0.9 -> 521.55 | L94: CP need 91-94 turn signal
A95: TS-0198CP | B95: 240SX | C95: 5 | D95: UAD-027 | E95: UAD-399 | F95: UAD-192 | H95: 89 | I95: 94 | J95: 627.00 | K95: =J95*0.9 -> 564.30 | L95: CP need 91-94 turn signal
A96: TS-0199CP | B96: 240SX | C96: 4 | D96: UAD-027 | E96: UAD-429 | F96: UAD-013 | H96: 89 | I96: 94 | J96: 598.50 | K96: =J96*0.9 -> 538.65 | L96: CP need 91-94 turn signal
A97: TS-0200CP | B97: 240SX | C97: 5 | D97: UAD-027 | E97: UAD-429 | F97: UAD-192 | H97: 89 | I97: 94 | J97: 646.00 | K97: =J97*0.9 -> 581.40 | L97: CP need 91-94 turn signal
A98: TS-0201CP | B98: 240SX | C98: 4 | D98: UAD-406 | E98: UAD-005 | F98: UAD-013 | H98: 89 | I98: 94 | J98: 579.50 | K98: =J98*0.9 -> 521.55 | L98: CP need 91-94 turn signal
A99: TS-0202CP | B99: 240SX | C99: 5 | D99: UAD-406 | E99: UAD-005 | F99: UAD-192 | H99: 89 | I99: 94 | J99: 627.00 | K99: =J99*0.9 -> 564.30 | L99: CP need 91-94 turn signal
A100: TS-0203CP | B100: 240SX | C100: 4 | D100: UAD-406 | E100: UAD-399 | F100: UAD-013 | H100: 89 | I100: 94 | J100: 579.50 | K100: =J100*0.9 -> 521.55 | L100: CP need 91-94 turn signal
A101: TS-0204CP | B101: 240SX | C101: 5 | D101: UAD-406 | E101: UAD-399 | F101: UAD-192 | H101: 89 | I101: 94 | J101: 627.00 | K101: =J101*0.9 -> 564.30 | L101: CP need 91-94 turn signal
A102: TS-0205CP | B102: 240SX | C102: 4 | D102: UAD-406 | E102: UAD-429 | F102: UAD-013 | H102: 89 | I102: 94 | J102: 598.50 | K102: =J102*0.9 -> 538.65 | L102: CP need 91-94 turn signal
A103: TS-0120CP | B103: 240SX | C103: 5 | D103: UAD-406 | E103: UAD-429 | F103: UAD-192 | H103: 89 | I103: 94 | J103: 646.00 | K103: =J103*0.9 -> 581.40 | L103: CP need 91-94 turn signal
A104: TS-1213CP | B104: 240SX | C104: 4 | D104: UAD-241 | E104: UAD-005 | F104: UAD-013 | H104: 91 | I104: 94 | J104: 465.50 | K104: =J104*0.9 -> 418.95 | L104: CP
A105: TS-1214CP | B105: 240SX | C105: 5 | D105: UAD-241 | E105: UAD-005 | F105: UAD-192 | H105: 91 | I105: 94 | J105: 513.00 | K105: =J105*0.9 -> 461.70 | L105: CP
A106: TS-1015CP | B106: 240SX | C106: 4 | D106: UAD-241 | E106: UAD-399 | F106: UAD-013 | H106: 91 | I106: 94 | J106: 465.50 | K106: =J106*0.9 -> 418.95 | L106: CP
A107: TS-1215CP | B107: 240SX | C107: 5 | D107: UAD-241 | E107: UAD-399 | F107: UAD-192 | H107: 91 | I107: 94 | J107: 513.00 | K107: =J107*0.9 -> 461.70 | L107: CP
A108: TS-1216CP | B108: 240SX | C108: 4 | D108: UAD-241 | E108: UAD-429 | F108: UAD-013 | H108: 91 | I108: 94 | J108: 484.50 | K108: =J108*0.9 -> 436.05 | L108: CP
A109: TS-1217CP | B109: 240SX | C109: 5 | D109: UAD-241 | E109: UAD-429 | F109: UAD-192 | H109: 91 | I109: 94 | J109: 532.00 | K109: =J109*0.9 -> 478.80 | L109: CP
A110: AD-414 | B110: 180(240)SX | F110: F/BS w 2 lite | H110: 89 | I110: 94 | J110: 460.00 | K110: =J110*0.9 -> 414.00 | L110: HB/CP/CV special order only
A111: AD-404 | B111: 180(240)SX | F111: F/BS w/o 2 lite | H111: 89 | I111: 94 | J111: 260.00 | K111: =J111*0.9 -> 234.00 | L111: HB/CP/CV special order only
A112: UAD-405 | B112: 180(240)SX | F112: F/BS BM | H112: 89 | I112: 94 | J112: 250.00 | K112: =J112*0.9 -> 225.00 | L112: HB/CP/CV needs TS405/BKT405
A113: AD-023 | B113: 180(240)SX | D113: 2 lite type | F113: F/BS | H113: 89 | I113: 94 | J113: 260.00 | K113: =J113*0.9 -> 234.00 | L113: HB/CP/CV special order only
A114: AD-001 | B114: 180(240)SX | D114: 2 lite bfr | F114: F/BS | H114: 89 | I114: 94 | J114: 560.00 | K114: =J114*0.9 -> 504.00 | L114: not available in US
A115: AD-002 | B115: 180(240)SX | D115: 2 lite aft | F115: F/BS | H115: 89 | I115: 94 | J115: 550.00 | K115: =J115*0.9 -> 495.00 | L115: not available in US
A116: UAD-030 | B116: 180(240)SX | D116: 4 lite type | F116: F/BS | H116: 89 | I116: 94 | J116: 250.00 | K116: =J116*0.9 -> 225.00 | L116: HB/CP/CV need 91-94 turn signal
A117: AD-024 | B117: 180(240)SX | D117: 4 lite bft | F117: F/BS | H117: 89 | I117: 90 | J117: 780.00 | K117: =J117*0.9 -> 702.00 | L117: not available in US
A118: AD-025 | B118: 180(240)SX | D118: 4 lite aft | F118: F/BS | H118: 91 | I118: 94 | J118: 770.00 | K118: =J118*0.9 -> 693.00 | L118: not available in US
A119: AD-234 | B119: 180(240)SX | D119: 4 lite 2 only out bfr | F119: F/BS | H119: 89 | I119: 94 | J119: 550.00 | K119: =J119*0.9 -> 495.00 | L119: not available in US
A120: AD-235 | B120: 180(240)SX | D120: 4 lite 2 only out aft | F120: F/BS | H120: 89 | I120: 94 | J120: 540.00 | K120: =J120*0.9 -> 486.00 | L120: not available in US
A121: AD-236 | B121: 180(240)SX | D121: 4 lite 2 only in bfr | F121: F/BS | H121: 89 | I121: 94 | J121: 550.00 | K121: =J121*0.9 -> 495.00 | L121: not available in US
A122: AD-237 | B122: 180(240)SX | D122: 4 lite 2 only in aft | F122: F/BS | H122: 89 | I122: 94 | J122: 540.00 | K122: =J122*0.9 -> 486.00 | L122: not available in US
A123: AD-106 | B123: 180(240)SX | D123: raybrig type | F123: F/BS | H123: 89 | I123: 94 | J123: 260.00 | K123: =J123*0.9 -> 234.00 | L123: HB/CP/CV special order only
A124: AD-104 | B124: 180(240)SX | D124: raybrig bfr | F124: F/BS | H124: 89 | I124: 94 | J124: 470.00 | K124: =J124*0.9 -> 423.00 | L124: not available in US
A125: AD-105 | B125: 180(240)SX | D125: raybrig aft | F125: F/BS | H125: 89 | I125: 94 | J125: 460.00 | K125: =J125*0.9 -> 414.00 | L125: not available in US
A126: UAD-027 | B126: 180(240)SX | F126: F/BS BM | H126: 89 | I126: 94 | J126: 250.00 | K126: =J126*0.9 -> 225.00 | L126: HB/CP/CV need 91-94 turn signal
A127: UAD-406 | B127: 180(240)SX | F127: F/BS BM T2 | H127: 89 | I127: 94 | J127: 250.00 | K127: =J127*0.9 -> 225.00 | L127: HB/CP/CV need 91-94 turn signal
A128: UAD-241 | B128: 180(240)SX | F128: F/US Type 1 | H128: 91 | I128: 94 | J128: 130.00 | K128: =J128*0.9 -> 117.00 | L128: HB/CP/CV
A129: UAD-005 | B129: 180(240)SX | F129: S/S Type 1 | H129: 89 | I129: 94 | J129: 190.00 | K129: =J129*0.9 -> 171.00 | L129: HB/CP/CV
A130: UAD-399 | B130: 180(240)SX | F130: S/S Type 3 | H130: 89 | I130: 94 | J130: 190.00 | K130: =J130*0.9 -> 171.00 | L130: HB/CP/CV
A131: UAD-429 | B131: 180(240)SX | F131: S/S Type4 | H131: 89 | I131: 94 | J131: 210.00 | K131: =J131*0.9 -> 189.00 | L131: HB/CP/CV
A132: UAD-006 | B132: 180(240)SX | F132: R/US Type 1 | H132: 89 | I132: 94 | J132: 170.00 | K132: =J132*0.9 -> 153.00 | L132: HB
A133: UAD-193 | B133: 180(240)SX | F133: R/US Type 3 | H133: 89 | I133: 94 | J133: 220.00 | K133: =J133*0.9 -> 198.00 | L133: HB
A134: UAD-003 | B134: 180(240)SX | F134: R/S Type 1 | H134: 89 | I134: 94 | J134: 210.00 | K134: =J134*0.9 -> 189.00 | L134: HB SO only
A135: UAD-004 | B135: 180(240)SX | F135: R/S Type 2 | H135: 89 | I135: 94 | J135: 210.00 | K135: =J135*0.9 -> 189.00 | L135: HB
A136: UAD-022 | B136: 180(240)SX | F136: R/S Type 3 | H136: 89 | I136: 94 | J136: 210.00 | K136: =J136*0.9 -> 189.00 | L136: HB
A137: UAD-036 | B137: 180(240)SX | F137: R/S Type 4 | H137: 89 | I137: 94 | J137: 210.00 | K137: =J137*0.9 -> 189.00 | L137: HB SO only
A138: UAD-246 | B138: 180(240)SX | F138: R/S Type 7 | H138: 89 | I138: 94 | J138: 210.00 | K138: =J138*0.9 -> 189.00 | L138: HB
A139: UAD-248 | B139: 180(240)SX | F139: R/S Type 9 | H139: 89 | I139: 94 | J139: 160.00 | K139: =J139*0.9 -> 144.00 | L139: HB
A140: AD-007 | B140: 180(240)SX | F140: A/M T1 Manual | H140: 89 | I140: 94 | J140: 180.00 | K140: =J140*0.9 -> 162.00
A141: AD-047 | B141: 180(240)SX | F141: A/M T1 Power | H141: 89 | I141: 94 | J141: 240.00 | K141: =J141*0.9 -> 216.00 | L141: discontinued
A142: AD-008 | B142: 180(240)SX | F142: A/M T2 Manual | H142: 89 | I142: 94 | J142: 180.00 | K142: =J142*0.9 -> 162.00
A143: AD-048 | B143: 180(240)SX | F143: A/M T2 Power | H143: 89 | I143: 94 | J143: 240.00 | K143: =J143*0.9 -> 216.00 | L143: discontinued
A144: TS180C | B144: 180SX TSC | F144: Turn Signal | H144: 89 | I144: 94 | J144: 120.00 | K144: =J144*0.9 -> 108.00
A145: SM180C | B145: 180SX SMC | F145: Side Marker | H145: 89 | I145: 94 | J145: 70.00 | K145: =J145*0.9 -> 63.00
A146: UAD-013 | B146: 240SX | F146: R/US Type 1 | H146: 89 | I146: 94 | J146: 170.00 | K146: =J146*0.9 -> 153.00 | L146: CP/CV
A147: UAD-192 | B147: 240SX | F147: R/US Type 3 | H147: 89 | I147: 94 | J147: 220.00 | K147: =J147*0.9 -> 198.00 | L147: CP/CV
A148: UAD-011 | B148: 240SX | F148: R/S Type 1 | H148: 89 | I148: 94 | J148: 210.00 | K148: =J148*0.9 -> 189.00 | L148: CP/CV
A149: UAD-012 | B149: 240SX | F149: R/S Type 2 | H149: 89 | I149: 94 | J149: 200.00 | K149: =J149*0.9 -> 180.00 | L149: CP/CV
A150: UAD-031 | B150: 240SX | F150: R/S Type 3 | H150: 89 | I150: 94 | J150: 220.00 | K150: =J150*0.9 -> 198.00 | L150: CP/CV

A1: UAD-032 | B1: 240SX | F1: R/S Type 4 | H1: 89 | I1: 94 | J1: 220.00 | K1: =J1*0.9 -> 198.00 | L1: CP/CV SO only
A2: UAD-254 | B2: 240SX | F2: R/S Type 7 | H2: 89 | I2: 94 | J2: 220.00 | K2: =J2*0.9 -> 198.00 | L2: CP/CV
A3: UAD-256 | B3: 240SX | F3: R/S Type 9 | H3: 89 | I3: 94 | J3: 240.00 | K3: =J3*0.9 -> 216.00
A4: BKT-405 | B4: 240SX S13 aft | D4: Braket Set | H4: 89 | I4: 94 | J4: 370.00 | K4: =J4*0.9 -> 333.00 | L4: Braket Set for UAD-405 F/BS
A5: TS-405 | B5: 240SX S13 aft | D5: Turn Signal Set | H5: 89 | I5: 94 | J5: 280.00 | K5: =J5*0.9 -> 252.00 | L5: Turn Signal Set for UAD-405 F/BS
A6: TS-1201 | B6: S13 Silvia | C6: 4 | D6: AD-034 | E6: AD-005 | F6: AD-013 | J6: 446.50 | K6: =J6*0.9 -> 401.85 | L6: Special Order Only
A7: TS-1202 | B7: S13 Silvia | C7: 5 | D7: AD-034 | E7: AD-005 | F7: AD-192 | J7: 494.00 | K7: =J7*0.9 -> 444.60 | L7: Special Order Only
A8: TS-1203 | B8: S13 Silvia | C8: 4 | D8: AD-034 | E8: AD-399 | F8: AD-013 | J8: 446.50 | K8: =J8*0.9 -> 401.85 | L8: Special Order Only
A9: TS-1204 | B9: S13 Silvia | C9: 5 | D9: AD-034 | E9: AD-339 | F9: AD-192 | J9: 494.00 | K9: =J9*0.9 -> 444.60 | L9: Special Order Only
A10: TS-1205 | B10: S13 Silvia | C10: 4 | D10: AD-034 | E10: AD-429 | F10: AD-013 | J10: 465.50 | K10: =J10*0.9 -> 418.95 | L10: Special Order Only
A11: TS-1206 | B11: S13 Silvia | C11: 5 | D11: AD-034 | E11: AD-429 | F11: AD-192 | J11: 513.00 | K11: =J11*0.9 -> 461.70 | L11: Special Order Only
A12: TS-1207 | B12: S13 Silvia | C12: 4 | D12: AD-035 | E12: AD-005 | F12: AD-013 | J12: 446.50 | K12: =J12*0.9 -> 401.85 | L12: Special Order Only
A13: TS-1208 | B13: S13 Silvia | C13: 5 | D13: AD-035 | E13: AD-005 | F13: AD-192 | J13: 494.00 | K13: =J13*0.9 -> 444.60 | L13: Special Order Only
A14: TS-1209 | B14: S13 Silvia | C14: 4 | D14: AD-035 | E14: AD-399 | F14: AD-013 | J14: 446.50 | K14: =J14*0.9 -> 401.85 | L14: Special Order Only
A15: TS-1210 | B15: S13 Silvia | C15: 5 | D15: AD-035 | E15: AD-339 | F15: AD-192 | J15: 494.00 | K15: =J15*0.9 -> 444.60 | L15: Special Order Only
A16: TS-1211 | B16: S13 Silvia | C16: 4 | D16: AD-035 | E16: AD-429 | F16: AD-013 | J16: 465.50 | K16: =J16*0.9 -> 418.95 | L16: Special Order Only
A17: TS-1212 | B17: S13 Silvia | C17: 5 | D17: AD-035 | E17: AD-429 | F17: AD-192 | J17: 513.00 | K17: =J17*0.9 -> 461.70 | L17: Special Order Only
A18: TS-0009 | B18: S13 Silvia | C18: 4 | D18: AD-009 | E18: AD-005 | F18: AD-013 | J18: 555.75 | K18: =J18*0.9 -> 500.17500000000001 | L18: Special Order Only
A19: TS-0152 | B19: S13 Silvia | C19: 5 | D19: AD-009 | E19: AD-005 | F19: AD-192 | J19: 603.25 | K19: =J19*0.9 -> 542.92499999999995 | L19: Special Order Only
A20: TS-0010 | B20: S13 Silvia | C20: 4 | D20: AD-009 | E20: AD-399 | F20: AD-013 | J20: 555.75 | K20: =J20*0.9 -> 500.17500000000001 | L20: Special Order Only
A21: TS-0153 | B21: S13 Silvia | C21: 5 | D21: AD-009 | E21: AD-339 | F21: AD-192 | J21: 603.25 | K21: =J21*0.9 -> 542.92499999999995 | L21: Special Order Only
A22: TS-0154 | B22: S13 Silvia | C22: 4 | D22: AD-009 | E22: AD-429 | F22: AD-013 | J22: 574.75 | K22: =J22*0.9 -> 517.27499999999998 | L22: Special Order Only
A23: TS-0155 | B23: S13 Silvia | C23: 5 | D23: AD-009 | E23: AD-429 | F23: AD-192 | J23: 622.25 | K23: =J23*0.9 -> 560.02499999999998 | L23: Special Order Only
A24: TS-0011 | B24: S13 Silvia | C24: 4 | D24: AD-033 | E24: AD-005 | F24: AD-013 | J24: 555.75 | K24: =J24*0.9 -> 500.17500000000001 | L24: Special Order Only
A25: TS-0156 | B25: S13 Silvia | C25: 5 | D25: AD-033 | E25: AD-005 | F25: AD-192 | J25: 603.25 | K25: =J25*0.9 -> 542.92499999999995 | L25: Special Order Only
A26: TS-0157 | B26: S13 Silvia | C26: 4 | D26: AD-033 | E26: AD-399 | F26: AD-013 | J26: 555.75 | K26: =J26*0.9 -> 500.17500000000001 | L26: Special Order Only
A27: TS-0158 | B27: S13 Silvia | C27: 5 | D27: AD-033 | E27: AD-339 | F27: AD-192 | J27: 603.25 | K27: =J27*0.9 -> 542.92499999999995 | L27: Special Order Only
A28: TS-0159 | B28: S13 Silvia | C28: 4 | D28: AD-033 | E28: AD-429 | F28: AD-013 | J28: 574.75 | K28: =J28*0.9 -> 517.27499999999998 | L28: Special Order Only
A29: TS-0160 | B29: S13 Silvia | C29: 5 | D29: AD-033 | E29: AD-429 | F29: AD-192 | J29: 622.25 | K29: =J29*0.9 -> 560.02499999999998 | L29: Special Order Only
A30: TS-0161 | B30: S13 Silvia | C30: 4 | D30: AD-026 | E30: AD-005 | F30: AD-013 | J30: 555.75 | K30: =J30*0.9 -> 500.17500000000001 | L30: Special Order Only
A31: TS-0162 | B31: S13 Silvia | C31: 5 | D31: AD-026 | E31: AD-005 | F31: AD-192 | J31: 603.25 | K31: =J31*0.9 -> 542.92499999999995 | L31: Special Order Only
A32: TS-0007 | B32: S13 Silvia | C32: 4 | D32: AD-026 | E32: AD-399 | F32: AD-013 | J32: 555.75 | K32: =J32*0.9 -> 500.17500000000001 | L32: Special Order Only
A33: TS-0163 | B33: S13 Silvia | C33: 5 | D33: AD-026 | E33: AD-339 | F33: AD-192 | J33: 603.25 | K33: =J33*0.9 -> 542.92499999999995 | L33: Special Order Only
A34: TS-0164 | B34: S13 Silvia | C34: 4 | D34: AD-026 | E34: AD-429 | F34: AD-013 | J34: 574.75 | K34: =J34*0.9 -> 517.27499999999998 | L34: Special Order Only
A35: TS-0165 | B35: S13 Silvia | C35: 5 | D35: AD-026 | E35: AD-429 | F35: AD-192 | J35: 622.25 | K35: =J35*0.9 -> 560.02499999999998 | L35: Special Order Only
A36: TS-0166 | B36: S13 Silvia | C36: 4 | D36: AD-430 | E36: AD-005 | F36: AD-013 | J36: 555.75 | K36: =J36*0.9 -> 500.17500000000001 | L36: Special Order Only
A37: TS-0167 | B37: S13 Silvia | C37: 5 | D37: AD-430 | E37: AD-005 | F37: AD-192 | J37: 603.25 | K37: =J37*0.9 -> 542.92499999999995 | L37: Special Order Only
A38: TS-0168 | B38: S13 Silvia | C38: 4 | D38: AD-430 | E38: AD-399 | F38: AD-013 | J38: 555.75 | K38: =J38*0.9 -> 500.17500000000001 | L38: Special Order Only
A39: TS-0169 | B39: S13 Silvia | C39: 5 | D39: AD-430 | E39: AD-339 | F39: AD-192 | J39: 603.25 | K39: =J39*0.9 -> 542.92499999999995 | L39: Special Order Only
A40: TS-0170 | B40: S13 Silvia | C40: 4 | D40: AD-430 | E40: AD-429 | F40: AD-013 | J40: 574.75 | K40: =J40*0.9 -> 517.27499999999998 | L40: Special Order Only
A41: TS-0171 | B41: S13 Silvia | C41: 5 | D41: AD-430 | E41: AD-429 | F41: AD-192 | J41: 622.25 | K41: =J41*0.9 -> 560.02499999999998 | L41: Special Order Only
A42: AD-009 | B42: S13 Silvia | F42: F/BS | J42: 225.00 | K42: =J42*0.9 -> 202.50 | L42: Special Order Only
A43: AD-430 | B43: S13 Silvia | F43: F/BS | J43: 225.00 | K43: =J43*0.9 -> 202.50 | L43: Special Order Only
A44: AD-026 | B44: S13 Silvia | F44: F/BS BM | J44: 225.00 | K44: =J44*0.9 -> 202.50 | L44: Special Order Only
A45: AD-010 | B45: S13 Silvia | F45: F/BS w/ 2 Lite | J45: 450.00 | K45: =J45*0.9 -> 405.00 | L45: not available in U.S.
A46: AD-033 | B46: S13 Silvia | F46: F/BS w/o LK | J46: 225.00 | K46: =J46*0.9 -> 202.50 | L46: Special Order Only
A47: AD-035 | B47: S13 Silvia | D47: aero bumper | F47: F/US | J47: 110.00 | K47: =J47*0.9 -> 99.00 | L47: Special Order Only
A48: AD-034 | B48: S13 Silvia | D48: normal bumper | F48: F/US | J48: 110.00 | K48: =J48*0.9 -> 99.00 | L48: Special Order Only
A49: UAD-005 | B49: S13 Silvia | F49: S/S Type 1 | H49: 89 | I49: 94 | J49: 190.00 | K49: =J49*0.9 -> 171.00
A50: UAD-399 | B50: S13 Silvia | F50: S/S Type 3 | H50: 89 | I50: 94 | J50: 190.00 | K50: =J50*0.9 -> 171.00
A51: UAD-429 | B51: S13 Silvia | F51: S/S Type4 | H51: 89 | I51: 94 | J51: 210.00 | K51: =J51*0.9 -> 189.00
A52: UAD-013 | B52: S13 Silvia | F52: R/US Type 1 | H52: 89 | I52: 94 | J52: 170.00 | K52: =J52*0.9 -> 153.00
A53: UAD-192 | B53: S13 Silvia | F53: R/US Type 3 | H53: 89 | I53: 94 | J53: 220.00 | K53: =J53*0.9 -> 198.00
A54: AD-065 | B54: S13 Silvia | F54: F/Grill T1 | J54: 100.00 | K54: =J54*0.9 -> 90.00 | L54: Special Order Only
A55: AD-066 | B55: S13 Silvia | F55: F/Grill T2 | J55: 100.00 | K55: =J55*0.9 -> 90.00 | L55: Special Order Only
A56: UAD-011 | B56: S13 Silvia | F56: R/S Type 1 | H56: 89 | I56: 94 | J56: 210.00 | K56: =J56*0.9 -> 189.00
A57: UAD-012 | B57: S13 Silvia | F57: R/S Type 2 | H57: 89 | I57: 94 | J57: 210.00 | K57: =J57*0.9 -> 189.00
A58: UAD-031 | B58: S13 Silvia | F58: R/S Type 3 | H58: 89 | I58: 94 | J58: 220.00 | K58: =J58*0.9 -> 198.00
A59: UAD-032 | B59: S13 Silvia | F59: R/S Type 4 | H59: 89 | I59: 94 | J59: 220.00 | K59: =J59*0.9 -> 198.00 | L59: Special Order Only
A60: UAD-254 | B60: S13 Silvia | F60: R/S Type 7 | H60: 89 | I60: 94 | J60: 220.00 | K60: =J60*0.9 -> 198.00
A61: UAD-256 | B61: S13 Silvia | F61: R/S Type 9 | H61: 89 | I61: 94 | J61: 240.00 | K61: =J61*0.9 -> 216.00
A62: AD-007 | B62: S13 Silvia | F62: A/M T1 Manual | J62: 180.00 | K62: =J62*0.9 -> 162.00
A63: AD-047 | B63: S13 Silvia | F63: A/M T1 Power | J63: 240.00 | K63: =J63*0.9 -> 216.00 | L63: discontinued
A64: AD-008 | B64: S13 Silvia | F64: A/M T2 Manual | J64: 180.00 | K64: =J64*0.9 -> 162.00
A65: AD-048 | B65: S13 Silvia | F65: A/M T2 Power | J65: 240.00 | K65: =J65*0.9 -> 216.00 | L65: discontinued
A66: TS-0004 | B66: 240SX S14 bfr | C66: 5 | D66: UAD-110 | E66: UAD-136 | F66: UAD-137 | H66: 95 | I66: 96 | J66: 560.50 | K66: =J66*0.9 -> 504.45 | L66: needs Jpn T sig TS14/SM14
A67: TS-0148 | B67: 240SX S14 bfr | C67: 4 | D67: UAD-110 | E67: UAD-136 | F67: UAD-290 | H67: 95 | I67: 96 | J67: 617.50 | K67: =J67*0.9 -> 555.75 | L67: needs Jpn T sig TS14/SM14
A68: TS-0006 | B68: 240SX S14 bfr | C68: 5 | D68: UAD-109 | E68: UAD-136 | F68: UAD-137 | H68: 95 | I68: 96 | J68: 560.50 | K68: =J68*0.9 -> 504.45 | L68: needs Jpn T sig TS14/SM14
A69: TS-0147 | B69: 240SX S14 bfr | C69: 4 | D69: UAD-109 | E69: UAD-136 | F69: UAD-290 | H69: 95 | I69: 96 | J69: 617.50 | K69: =J69*0.9 -> 555.75 | L69: needs Jpn T sig TS14/SM14
A70: TS-0151 | B70: 240SX S14 bfr | C70: 5 | D70: UAD-138 | E70: UAD-136 | F70: UAD-137 | H70: 95 | I70: 96 | J70: 560.50 | K70: =J70*0.9 -> 504.45 | L70: needs Jpn T sig TS14/SM14
A71: TS-0149 | B71: 240SX S14 bfr | C71: 4 | D71: UAD-138 | E71: UAD-136 | F71: UAD-290 | H71: 95 | I71: 96 | J71: 617.50 | K71: =J71*0.9 -> 555.75 | L71: needs Jpn T sig TS14/SM14
A72: TS-0100 | B72: 240SX S14 bfr | C72: 6 | D72: UAD-138 | E72: UAD-136 | F72: UAD-137 | G72: UAD-139 | H72: 95 | I72: 96 | J72: 665.00 | K72: =J72*0.9 -> 598.50 | L72: needs Jpn T sig TS14/SM14
A73: TS-0150 | B73: 240SX S14 bfr | C73: 5 | D73: UAD-138 | E73: UAD-136 | F73: UAD-290 | G73: UAD-139 | H73: 95 | I73: 96 | J73: 722.00 | K73: =J73*0.9 -> 649.80 | L73: needs Jpn T sig TS14/SM14
A74: TS-0002 | B74: 240SX S14 atr | C74: 5 | D74: UAD-400 | E74: UAD-136 | F74: UAD-137 | H74: 97 | I74: 98 | J74: 560.50 | K74: =J74*0.9 -> 504.45 | L74: need turn turn signal TS400
A75: TS-0003 | B75: 240SX S14 atr | C75: 4 | D75: UAD-400 | E75: UAD-136 | F75: UAD-290 | H75: 97 | I75: 98 | J75: 617.50 | K75: =J75*0.9 -> 555.75 | L75: need turn turn signal TS400
A76: UAD-108 | B76: 240SX S14 bfr | F76: F/BS w/ 2 Lite | H76: 95 | I76: 96 | J76: 460.00 | K76: =J76*0.9 -> 414.00 | L76: not available in U.S.
A77: UAD-109 | B77: 240SX S14 bfr | F77: F/BS w/o 2 lite | H77: 95 | I77: 96 | J77: 240.00 | K77: =J77*0.9 -> 216.00 | L77: needs Jpn T sig TS14/SM14
A78: UAD-110 | B78: 240SX S14 bfr | F78: F/BS BM | H78: 95 | I78: 96 | J78: 240.00 | K78: =J78*0.9 -> 216.00 | L78: needs Jpn T sig TS14/SM14
A79: UAD-138 | B79: 240SX S14 bfr | F79: F/BS Type 2 | H79: 95 | I79: 96 | J79: 240.00 | K79: =J79*0.9 -> 216.00 | L79: needs Jpn T sig TS14/SM14
A80: UAD-136 | B80: 240SX S14 | F80: S/S | H80: 95 | I80: 98 | J80: 200.00 | K80: =J80*0.9 -> 180.00 | L80: Modify duct after install
A81: UAD-137 | B81: 240SX S14 | F81: R/UC | H81: 95 | I81: 98 | J81: 150.00 | K81: =J81*0.9 -> 135.00
A82: UAD-290 | B82: 240SX S14 | F82: R/BS | H82: 95 | I82: 98 | J82: 210.00 | K82: =J82*0.9 -> 189.00
A83: UAD-111 | B83: 240SX S14 bfr | F83: F/Grill Type 1 | H83: 95 | I83: 96 | J83: 100.00 | K83: =J83*0.9 -> 90.00
A84: UAD-112 | B84: 240SX S14 bfr | F84: F/Grill Type 2 | H84: 95 | I84: 96 | J84: 100.00 | K84: =J84*0.9 -> 90.00
A85: UAD-139 | B85: 240SX S14 bfr | F85: F/EMask | H85: 95 | I85: 96 | J85: 110.00 | K85: =J85*0.9 -> 99.00
A86: UAD-400 | B86: 240SX S14 atr | F86: F/BS BM | H86: 97 | I86: 98 | J86: 240.00 | K86: =J86*0.9 -> 216.00 | L86: need turn signal TS400
A87: UAD-401 | B87: 240SX S14 atr | F87: F/Grill Type 1 | H87: 97 | I87: 98 | J87: 100.00 | K87: =J87*0.9 -> 90.00
A88: UAD-402 | B88: 240SX S14 atr | F88: F/Grill Type 2 | H88: 97 | I88: 98 | J88: 100.00 | K88: =J88*0.9 -> 90.00
A89: UAD-113 | B89: 240SX S14 | F89: R/S Type 1 | H89: 95 | I89: 98 | J89: 210.00 | K89: =J89*0.9 -> 189.00
A90: UAD-114 | B90: 240SX S14 | F90: R/S Type 2 | H90: 95 | I90: 98 | J90: 210.00 | K90: =J90*0.9 -> 189.00
A91: UAD-291 | B91: 240SX S14 | F91: R/S Type 5 | H91: 95 | I91: 98 | J91: 210.00 | K91: =J91*0.9 -> 189.00
A92: UAD-293 | B92: 240SX S14 | F92: R/S Type 7 | H92: 95 | I92: 98 | J92: 220.00 | K92: =J92*0.9 -> 198.00
A93: AD-117 | B93: 240SX S14 | F93: A/M T1 Manual | H93: 95 | I93: 98 | J93: 180.00 | K93: =J93*0.9 -> 162.00
A94: AD-140 | B94: 240SX S14 | F94: A/M T1 Power | H94: 95 | I94: 98 | J94: 240.00 | K94: =J94*0.9 -> 216.00
A95: AD-118 | B95: 240SX S14 | F95: A/M T2 Manual | H95: 95 | I95: 98 | J95: 180.00 | K95: =J95*0.9 -> 162.00
A96: AD-141 | B96: 240SX S14 | F96: A/M T2 Power | H96: 95 | I96: 98 | J96: 240.00 | K96: =J96*0.9 -> 216.00 | L96: discontinued
A97: SM-14BC | B97: 240SX S14 bfr | D97: Side Marker | E97: Clear | H97: 95 | I97: 96 | J97: 85.00 | K97: =J97*0.9 -> 76.50 | L97: Side Marker for S14 before
A98: SMCO-14B | B98: 240SX S14 bfr | D98: Side Marker | E98: Clear/Orange | H98: 95 | I98: 96 | J98: 85.00 | K98: =J98*0.9 -> 76.50 | L98: Side Marker for S14 bfr Clr/Org
A99: TS-14BC | B99: 240SX S14 bfr | D99: Turn Signal Set | E99: Clear | H99: 95 | I99: 96 | J99: 180.00 | K99: =J99*0.9 -> 162.00 | L99: Turn Signal Set for S14 before
A100: TSCO-14B | B100: 240SX S14 bfr | D100: Turn Signal Set | E100: Clear/Orange | H100: 95 | I100: 96 | J100: 180.00 | K100: =J100*0.9 -> 162.00 | L100: Turn Signal Set for S14 bfr Cle/Org
A101: TS-400 | B101: 240SX S14 aft | D101: Turn Signal Set | E101: Factory | H101: 97 | I101: 98 | J101: 200.00 | K101: =J101*0.9 -> 180.00 | L101: Turn signal Set for UAD-400 F/BS
A102: TSC-400 | B102: 240SX S14 aft | D102: Turn Signal Set | E102: Clear | H102: 97 | I102: 98 | J102: 200.00 | K102: =J102*0.9 -> 180.00 | L102: Turn signal Set for UAD-400 F/BS
A103: TS-0217 | B103: S15 Silvia | D103: AD-460 | E103: AD461 | F103: AD462 | J103: 665.00 | K103: =J103*0.9 -> 598.50 | L103: Special Order Only
A104: AD-460 | B104: S15 Silvia | F104: F/BS BM | J104: 250.00 | K104: =J104*0.9 -> 225.00
A105: AD-461 | B105: S15 Silvia | F105: S/S | J105: 225.00 | K105: =J105*0.9 -> 202.50 | L105: Special Order Only
A106: AD-462 | B106: S15 Silvia | F106: R/US | J106: 225.00 | K106: =J106*0.9 -> 202.50 | L106: Special Order Only
A107: AD-463 | B107: S15 Silvia | F107: R/S | J107: 210.00 | K107: =J107*0.9 -> 189.00 | L107: Special Order Only
A108: AD-466 | B108: S15 Silvia | F108: A/M T1 Manual | J108: 180.00 | K108: =J108*0.9 -> 162.00 | L108: Special Order Only
A109: AD-467 | B109: S15 Silvia | F109: A/M T1 Power | J109: 240.00 | K109: =J109*0.9 -> 216.00 | L109: discontinued
A110: TS-0507 | B110: Q45 Y33Cima | C110: 5 | D110: UBE-025 | E110: UBE-029 | F110: UBE-030 | H110: 97 | I110: 99 | J110: 931.00 | K110: =J110*0.9 -> 837.90
A111: TS-0508 | B111: Q45 Y33Cima | C111: 5 | D111: UBE-026 | E111: UBE-029 | F111: UBE-030 | H111: 97 | I111: 99 | J111: 940.50 | K111: =J111*0.9 -> 846.45
A112: TS-0509 | B112: Q45 Y33Cima | C112: 5 | D112: UBE-027 | E112: UBE-029 | F112: UBE-030 | H112: 97 | I112: 99 | J112: 836.00 | K112: =J112*0.9 -> 752.40
B113: Q45 Y33Cima | D113: UBE-032 | E113: UBE-029 | F113: UBE-030 | J113: 669.75 | K113: =J113*0.9 -> 602.77499999999998
B114: Q45 Y33Cima | D114: UBE-033 | E114: UBE-029 | F114: UBE-030 | J114: 679.25 | K114: =J114*0.9 -> 611.32500000000005
A115: UBE-025 | B115: Q45 Y33Cima | C115: 2 | D115: Y33 Cima | F115: F/B+F/U T1 | H115: 97 | I115: 99 | J115: 400.00 | K115: =J115*0.9 -> 360.00
A116: UBE-026 | B116: Q45 Y33Cima | C116: 2 | D116: Y33 Cima | F116: F/B+F/U T2 | H116: 97 | I116: 99 | J116: 410.00 | K116: =J116*0.9 -> 369.00
A117: UBE-027 | B117: Q45 Y33Cima | D117: Y33 Cima | F117: F/B | H117: 97 | I117: 99 | J117: 300.00 | K117: =J117*0.9 -> 270.00
A118: UBE-032 | B118: Q45 Y33Cima | D118: Y33 Cima | F118: F/U T-1 | H118: 97 | I118: 99 | J118: 125.00 | K118: =J118*0.9 -> 112.50 | L118: can combine with UBE-027
A119: UBE-033 | B119: Q45 Y33Cima | D119: Y33 Cima | F119: F/U T-2 | H119: 97 | I119: 99 | J119: 135.00 | K119: =J119*0.9 -> 121.50 | L119: can combine with UBE-027
A120: UBE-028 | B120: Q45 Y33Cima | D120: Y33 Cima | F120: F/Grill | H120: 97 | I120: 99 | J120: 120.00 | K120: =J120*0.9 -> 108.00
A121: UBE-029 | B121: Q45 Y33Cima | D121: Y33 Cima | F121: S/S | H121: 97 | I121: 99 | J121: 290.00 | K121: =J121*0.9 -> 261.00
A122: UBE-030 | B122: Q45 Y33Cima | D122: Y33 Cima | F122: R/B | H122: 97 | I122: 99 | J122: 290.00 | K122: =J122*0.9 -> 261.00
A123: UBE-031 | B123: Q45 Y33Cima | D123: Y33 Cima | F123: R/S | H123: 97 | I123: 99 | J123: 210.00 | K123: =J123*0.9 -> 189.00
A124: TS-1220 | B124: R32 2dr GTS | D124: AD-283 | E124: AD-095 | F124: AD-096 | J124: 437.00 | K124: =J124*0.9 -> 393.30 | L124: Special Order Only
A125: TS-1221 | B125: R32 4dr | D125: AD-283 | E125: AD-281 | F125: AD-282 | J125: 437.00 | K125: =J125*0.9 -> 393.30 | L125: Special Order Only
A126: TS-0042 | B126: R32 2dr GTS | D126: AD-088 | E126: AD-095 | F126: AD-096 | J126: 560.50 | K126: =J126*0.9 -> 504.45 | L126: Special Order Only
A127: TS-0209 | B127: R32 2dr GTS | D127: AD-088 | E127: AD-281 | F127: AD-282 | J127: 560.50 | K127: =J127*0.9 -> 504.45 | L127: Special Order Only
A128: TS-0040 | B128: R32 2dr GTS | D128: AD-029 | E128: AD-095 | F128: AD-096 | J128: 546.25 | K128: =J128*0.9 -> 491.625 | L128: Special Order Only
A129: TS-0210 | B129: R32 2dr GTS | D129: AD-029 | E129: AD-281 | F129: AD-282 | J129: 546.25 | K129: =J129*0.9 -> 491.625 | L129: Special Order Only
A130: AD-085 | B130: R32 | D130: GTR | F130: F/BS w/ 2 Lite | J130: 470.00 | K130: =J130*0.9 -> 423.00 | L130: under development
A131: AD-086 | B131: R32 | D131: GTR | F131: F/BS w/o 2 lite | J131: 260.00 | K131: =J131*0.9 -> 234.00 | L131: under development
A132: AD-029 | B132: R32 | D132: GTS | F132: F/BS BM | J132: 225.00 | K132: =J132*0.9 -> 202.50 | L132: Special Order Only
A133: AD-087 | B133: R32 | D133: GTS | F133: F/BS w/ 2 Lite | J133: 450.00 | K133: =J133*0.9 -> 405.00 | L133: not available in U.S.
A134: AD-088 | B134: R32 | D134: GTS | F134: F/BS w/o 2 lite | J134: 240.00 | K134: =J134*0.9 -> 216.00 | L134: Special Order Only
A135: AD-283 | B135: R32 | D135: Aero Bumper | F135: F/US | J135: 110.00 | K135: =J135*0.9 -> 99.00 | L135: Special Order Only
A136: AD-095 | B136: R32 | D136: 2 Door | F136: S/S | J136: 210.00 | K136: =J136*0.9 -> 189.00 | L136: Special Order Only
A137: AD-096 | B137: R32 | D137: 2 Door | F137: R/UC | J137: 140.00 | K137: =J137*0.9 -> 126.00 | L137: Special Order Only
A138: AD-281 | B138: R32 | D138: 4 Door | F138: S/S | J138: 210.00 | K138: =J138*0.9 -> 189.00 | L138: Special Order Only
A139: AD-282 | B139: R32 | D139: 4 Door | F139: R/UC | J139: 140.00 | K139: =J139*0.9 -> 126.00 | L139: Special Order Only
A140: AD-090 | B140: R32 | D140: 2 Door | F140: R/S T2 | J140: 180.00 | K140: =J140*0.9 -> 162.00 | L140: Special Order Only
A141: AD-091 | B141: R32 | D141: 2 Door | F141: R/S T3 | J141: 170.00 | K141: =J141*0.9 -> 153.00 | L141: Special Order Only
A142: AD-092 | B142: R32 | D142: 2 Door | F142: R/S T4 | J142: 230.00 | K142: =J142*0.9 -> 207.00 | L142: Special Order Only
A143: AD-280 | B143: R32 | D143: 2 Door | F143: R/S T7 | J143: 220.00 | K143: =J143*0.9 -> 198.00 | L143: Special Order Only
A144: AD-284 | B144: R32 | F144: F/B Duct | J144: 80.00 | K144: =J144*0.9 -> 72.00 | L144: Special Order Only
A145: AD-018 | B145: R32 | D145: 2 Door | F145: A/M T1 Manual | J145: 180.00 | K145: =J145*0.9 -> 162.00 | L145: Special Order Only
A146: AD-053 | B146: R32 | D146: 2 Door | F146: A/M T1 Power | J146: 240.00 | K146: =J146*0.9 -> 216.00 | L146: discontinued
A147: AD-019 | B147: R32 | D147: 2 Door | F147: A/M T2 Manual | J147: 180.00 | K147: =J147*0.9 -> 162.00 | L147: Special Order Only
A148: AD-054 | B148: R32 | D148: 2 Door | F148: A/M T2 Power | J148: 240.00 | K148: =J148*0.9 -> 216.00 | L148: discontinued
A149: TS-1224 | B149: R33GTR | D149: AD-390 | E149: AD-377 | F149: AD-378 | J149: 551.00 | K149: =J149*0.9 -> 495.90 | L149: Special Order Only
A150: TS-0038 | B150: R33GTS | D150: AD-376 | E150: AD-379 | F150: AD-380 | J150: 598.50 | K150: =J150*0.9 -> 538.65 | L150: Special Order Only

A1: TS-0206 | B1: R33GTS | D1: AD-376 | E1: AD-286 | F1: AD-287 | J1: 646.00 | K1: =J1*0.9 -> 581.40 | L1: Special Order Only
A2: TS-0207 | B2: R33GTS | D2: AD-403 | E2: AD-379 | F2: AD-380 | J2: 598.50 | K2: =J2*0.9 -> 538.65 | L2: Special Order Only
A3: TS-0208 | B3: R33GTS | D3: AD-403 | E3: AD-286 | F3: AD-287 | J3: 646.00 | K3: =J3*0.9 -> 581.40 | L3: Special Order Only
A4: AD-390 | B4: R33GTR | D4: before | F4: F/US T2 | J4: 140.00 | K4: =J4*0.9 -> 126.00 | L4: Special Order Only
A5: AD-377 | B5: R33GTR | F5: S/S | J5: 220.00 | K5: =J5*0.9 -> 198.00 | L5: Special Order Only
A6: AD-378 | B6: R33GTR | F6: R/US | J6: 220.00 | K6: =J6*0.9 -> 198.00 | L6: Special Order Only
A7: AD-392 | B7: R33GTR | D7: before | F7: F/Grill T2 | J7: 100.00 | K7: =J7*0.9 -> 90.00 | L7: Special Order Only
A8: AD-376 | B8: R33GTS | D8: before | F8: F/BS | J8: 250.00 | K8: =J8*0.9 -> 225.00 | L8: Special Order Only
A9: AD-403 | B9: R33GTS | D9: before | F9: F/BS T2 | J9: 250.00 | K9: =J9*0.9 -> 225.00 | L9: Special Order Only
A10: AD-373 | B10: R33GTS | F10: F/BS w/ 2 lite | K10: =J10*0.9 -> 0.00 | L10: reserved item number only
A11: AD-374 | B11: R33GTS | F11: F/BS w/o 2 lite | K11: =J11*0.9 -> 0.00 | L11: reserved item number only
A12: AD-379 | B12: R33GTS | D12: 2 Door | F12: S/S | J12: 220.00 | K12: =J12*0.9 -> 198.00 | L12: Special Order Only
A13: AD-380 | B13: R33GTS | D13: 2 Door | F13: R/US | J13: 160.00 | K13: =J13*0.9 -> 144.00 | L13: Special Order Only
A14: AD-393 | B14: R33GTS | D14: before | F14: F/Grill T1 | H14: bfr | J14: 100.00 | K14: =J14*0.9 -> 90.00 | L14: Special Order Only
A15: AD-394 | B15: R33GTS | D15: before | F15: F/Grill T2 | H15: bfr | J15: 100.00 | K15: =J15*0.9 -> 90.00 | L15: Special Order Only
A16: AD-286 | B16: R33 4dr | D16: 4 Door | F16: S/S | J16: 220.00 | K16: =J16*0.9 -> 198.00 | L16: Special Order Only
A17: AD-287 | B17: R33 4dr | D17: 4 Door | F17: R/US | J17: 210.00 | K17: =J17*0.9 -> 189.00 | L17: Special Order Only
A18: AD-384 | B18: R33 | D18: 2 Door | F18: R/S T4 | J18: 220.00 | K18: =J18*0.9 -> 198.00 | L18: Special Order Only
A19: AD-386 | B19: R33 | F19: R/S T7 | J19: 230.00 | K19: =J19*0.9 -> 207.00 | L19: reserved item number only
A20: AD-387 | B20: R33 | D20: 2 Door | F20: R/S T9 | J20: 210.00 | K20: =J20*0.9 -> 189.00 | L20: Special Order Only
A21: AD-395 | B21: R33 | D21: 2 Door | F21: A/M T1 Manual | J21: 180.00 | K21: =J21*0.9 -> 162.00 | L21: Special Order Only
A22: AD-397 | B22: R33 | D22: 2 Door | F22: A/M T1 Power | J22: 240.00 | K22: =J22*0.9 -> 216.00 | L22: Special Order Only
A23: AD-396 | B23: R33 | D23: 2 Door | F23: A/M T2 Manual | J23: 180.00 | K23: =J23*0.9 -> 162.00 | L23: Special Order Only
A24: AD-398 | B24: R33 | D24: 2 Door | F24: A/M T2 Power | J24: 240.00 | K24: =J24*0.9 -> 216.00 | L24: discontinued
A25: TS-0216 | B25: R34GT | D25: AD-329 | E25: AD-330 | F25: AD-331 | J25: 741.00 | K25: =J25*0.9 -> 666.90 | L25: Special Order Only
A26: TS-0238 | B26: R34GTR(V) | D26: AD-334 | E26: AD-336 | F26: AD-337 | J26: 798.00 | K26: =J26*0.9 -> 718.20 | L26: Special Order Only
A27: AD-334 | B27: R34GTR(V) | F27: F/BS | J27: 320.00 | K27: =J27*0.9 -> 288.00 | L27: Special Order Only
A28: AD-335-CB | B28: R34GTR(V) | F28: F/BS Splitter | G28: carbon, mid | J28: 180.00 | K28: =J28*0.9 -> 162.00 | L28: Special Order Only
A29: AD-338-CB | B29: R34GTR(V) | F29: F/BS Splitter | G29: carbon, bottom | J29: 270.00 | K29: =J29*0.9 -> 243.00 | L29: Special Order Only
A30: AD-336 | B30: R34GTR(V) | F30: S/S | J30: 260.00 | K30: =J30*0.9 -> 234.00 | L30: Special Order Only
A31: AD-337-CB | B31: R34GTR(V) | F31: R/BS | G31: carbon | J31: 260.00 | K31: =J31*0.9 -> 234.00 | L31: Special Order Only
A32: AD-329 | B32: R34GT | F32: F/BS | J32: 260.00 | K32: =J32*0.9 -> 234.00 | L32: Special Order Only
A33: AD-330 | B33: R34GT | D33: 2 Door | F33: S/S | J33: 260.00 | K33: =J33*0.9 -> 234.00 | L33: Special Order Only
A34: AD-331 | B34: R34GT | D34: 2 Door | F34: R/BS | J34: 260.00 | K34: =J34*0.9 -> 234.00 | L34: Special Order Only
A35: AD-332 | B35: R34GT/GTR | D35: 2 Door | F35: R/S | J35: 210.00 | K35: =J35*0.9 -> 189.00 | L35: Special Order Only
A36: AD-327 | B36: R34GT/GTR | D36: 2 Door | F36: A/M T1 Manual | J36: 180.00 | K36: =J36*0.9 -> 162.00 | L36: Special Order Only
A37: AD-328 | B37: R34GT/GTR | D37: 2 Door | F37: A/M T1 Power | J37: 240.00 | K37: =J37*0.9 -> 216.00 | L37: discontinued
A38: TS-0504 | B38: Y32 | D38: BE-013 | E38: BE-018 | F38: BE-019 | J38: 907.25 | K38: =J38*0.9 -> 816.52499999999998 | L38: SO/do not fit 91.6-93.6 Brougham
A39: TS-0505 | B39: Y32 | D39: BE-014 | E39: BE-018 | F39: BE-019 | J39: 907.25 | K39: =J39*0.9 -> 816.52499999999998 | L39: SO/do not fit 91.6-93.6 Brougham
A40: TS-0506 | B40: Y32 | D40: BE-015 | E40: BE-018 | F40: BE-019 | J40: 807.50 | K40: =J40*0.9 -> 726.75 | L40: SO/do not fit 91.6-93.6 Brougham
A41: BE-013 | B41: Y32 | D41: Cedric/Gloria | F41: F/BS T1 | J41: 395.00 | K41: =J41*0.9 -> 355.50 | L41: SO/do not fit 91.6-93.6 Brougham
A42: BE-014 | B42: Y32 | D42: Cedric/Gloria | F42: F/BS T2 | J42: 395.00 | K42: =J42*0.9 -> 355.50 | L42: SO/do not fit 91.6-93.6 Brougham
A43: BE-015 | B43: Y32 | D43: Cedric/Gloria | F43: F/BS | J43: 280.00 | K43: =J43*0.9 -> 252.00 | L43: SO/do not fit 91.6-93.6 Brougham
A44: BE-023 | B44: Y32 | D44: Cedric/Gloria | F44: F/BS w/o 2 lite | K44: =J44*0.9 -> 0.00 | L44: reserved item number only
A45: BE-024 | B45: Y32 | D45: Cedric/Gloria | F45: F/BS w/ 2 lite | K45: =J45*0.9 -> 0.00 | L45: reserved item number only
A46: BE-021 | B46: Y32 | D46: Cedric/Gloria | F46: F/US T1 | J46: 120.00 | K46: =J46*0.9 -> 108.00 | L46: SO/do not fit 91.6-93.6 Brougham
A47: BE-022 | B47: Y32 | D47: Cedric/Gloria | F47: F/US T2 | J47: 120.00 | K47: =J47*0.9 -> 108.00 | L47: SO/do not fit 91.6-93.6 Brougham
A48: BE-018 | B48: Y32 | D48: Cedric/Gloria | F48: S/S | J48: 280.00 | K48: =J48*0.9 -> 252.00 | L48: SO/do not fit 91.6-93.6 Brougham
A49: BE-019 | B49: Y32 | D49: Cedric/Gloria | F49: R/BS | J49: 280.00 | K49: =J49*0.9 -> 252.00 | L49: SO/do not fit 91.6-93.6 Brougham
A50: BE-017 | B50: Y32 | D50: Cedric/Gloria | F50: F/Grill | J50: 120.00 | K50: =J50*0.9 -> 108.00 | L50: SO/do not fit 91.6-93.6 Brougham
A51: BE-016 | B51: Y32 | D51: Cedric/Gloria | F51: R/S T1 | J51: 260.00 | K51: =J51*0.9 -> 234.00 | L51: SO/do not fit 91.6-93.6 Brougham
A52: BE-020 | B52: Y32 | D52: Cedric/Gloria | F52: R/S T2 | J52: 200.00 | K52: =J52*0.9 -> 180.00 | L52: reserved item number only
A53: TS-0501 | B53: Y33 | D53: BE-001 | E53: BE-006 | F53: BE-007 | J53: 807.50 | K53: =J53*0.9 -> 726.75 | L53: Discuntinued
A54: TS-0502 | B54: Y33 | D54: BE-002 | E54: BE-006 | F54: BE-007 | J54: 897.50 | K54: =J54*0.9 -> 807.75 | L54: Discuntinued
A55: TS-0503 | B55: Y33 | D55: BE-003 | E55: BE-006 | F55: BE-007 | J55: 807.25 | K55: =J55*0.9 -> 726.52499999999998 | L55: Discuntinued
A56: BE-001 | B56: Y33 | D56: Cedric/Gloria | F56: F/BS T1 | J56: 395.00 | K56: =J56*0.9 -> 355.50 | L56: Special Order Only
A57: BE-002 | B57: Y33 | D57: Cedric/Gloria | F57: F/BS T2 | J57: 395.00 | K57: =J57*0.9 -> 355.50 | L57: Special Order Only
A58: BE-003 | B58: Y33 | D58: Cedric/Gloria | F58: F/BS | J58: 290.00 | K58: =J58*0.9 -> 261.00 | L58: Special Order Only
A59: BE-011 | B59: Y33 | D59: Cedric/Gloria | F59: F/BS w/o 2 lite | K59: =J59*0.9 -> 0.00 | L59: reserved item number only
A60: BE-012 | B60: Y33 | D60: Cedric/Gloria | F60: F/BS w/ 2 lite | K60: =J60*0.9 -> 0.00 | L60: reserved item number only
A61: BE-009 | B61: Y33 | D61: Cedric/Gloria | F61: F/US T1 | J61: 130.00 | K61: =J61*0.9 -> 117.00 | L61: Special Order Only
A62: BE-010 | B62: Y33 | D62: Cedric/Gloria | F62: F/US T2 | J62: 130.00 | K62: =J62*0.9 -> 117.00 | L62: Special Order Only
A63: BE-006 | B63: Y33 | D63: Cedric/Gloria | F63: S/S | J63: 280.00 | K63: =J63*0.9 -> 252.00 | L63: Special Order Only
A64: BE-007 | B64: Y33 | D64: Cedric/Gloria | F64: R/BS | J64: 280.00 | K64: =J64*0.9 -> 252.00 | L64: Special Order Only
A65: BE-005 | B65: Y33 | D65: Cedric/Gloria | F65: F/Grill | J65: 130.00 | K65: =J65*0.9 -> 117.00 | L65: Special Order Only
A66: BE-004 | B66: Y33 | D66: Cedric/Gloria | F66: R/S T1 | J66: 260.00 | K66: =J66*0.9 -> 234.00 | L66: Special Order Only
A67: BE-008 | B67: Y33 | D67: Cedric/Gloria | F67: R/S T2 | K67: =J67*0.9 -> 0.00 | L67: reserved item number only
A68: AD-128 | B68: Z31 | F68: F/BS before | J68: 250.00 | K68: =J68*0.9 -> 225.00 | L68: not available in U.S.
A69: AD-014 | B69: Z31 | F69: A/M T1 Manual | J69: 180.00 | K69: =J69*0.9 -> 162.00 | L69: not available in U.S.
A70: AD-049 | B70: Z31 | F70: A/M T1 Power | J70: 240.00 | K70: =J70*0.9 -> 216.00 | L70: not available in U.S.
A71: AD-015 | B71: Z31 | F71: A/M T2 Manual | J71: 180.00 | K71: =J71*0.9 -> 162.00 | L71: not available in U.S.
A72: AD-050 | B72: Z31 | F72: A/M T2 Power | J72: 240.00 | K72: =J72*0.9 -> 216.00 | L72: discontinued
A73: TS-0024 | B73: Z32 2str | C73: 4 | D73: UAD-099 | E73: UAD-100 | F73: UAD-101 | H73: 90 | I73: 96 | J73: 622.25 | K73: =J73*0.9 -> 560.02499999999998
A74: TS-0032 | B74: Z32 2str | C74: 4 | D74: AD-098 | E74: UAD-100 | F74: UAD-101 | H74: 90 | I74: 96 | J74: 622.25 | K74: =J74*0.9 -> 560.02499999999998
A75: TS-0027 | B75: Z32 2str | C75: 4 | D75: UAD-058 | E75: UAD-100 | F75: UAD-101 | H75: 90 | I75: 96 | J75: 636.50 | K75: =J75*0.9 -> 572.85
A76: TS-0113 | B76: Z32 2str | C76: 4 | D76: UAD-188 | E76: UAD-100 | F76: UAD-101 | H76: 90 | I76: 96 | J76: 636.50 | K76: =J76*0.9 -> 572.85
A77: TS-1024 | B77: Z32 2str | C77: 4 | D77: UAD-129 | E77: UAD-100 | F77: UAD-101 | H77: 90 | I77: 96 | J77: 513.00 | K77: =J77*0.9 -> 461.70
A78: TS-1027 | B78: Z32 2str | C78: 4 | D78: UAD-130 | E78: UAD-100 | F78: UAD-101 | H78: 90 | I78: 96 | J78: 513.00 | K78: =J78*0.9 -> 461.70
A79: TS-1218 | B79: Z32 2str | C79: 4 | D79: AD-131 | E79: UAD-100 | F79: UAD-101 | H79: 90 | I79: 96 | J79: 513.00 | K79: =J79*0.9 -> 461.70
A80: TS-1031 | B80: Z32 2str | C80: 4 | D80: UAD-132 | E80: UAD-100 | F80: UAD-101 | H80: 90 | I80: 96 | J80: 513.00 | K80: =J80*0.9 -> 461.70
A81: TS-0026 | B81: Z32 2X2 | C81: 4 | D81: UAD-099 | E81: UAD-102 | F81: UAD-103 | H81: 90 | I81: 96 | J81: 622.25 | K81: =J81*0.9 -> 560.02499999999998
A82: TS-0034 | B82: Z32 2X2 | C82: 4 | D82: AD-098 | E82: UAD-102 | F82: UAD-103 | H82: 90 | I82: 96 | J82: 622.25 | K82: =J82*0.9 -> 560.02499999999998
A83: TS-0029 | B83: Z32 2X2 | C83: 4 | D83: UAD-058 | E83: UAD-102 | F83: UAD-103 | H83: 90 | I83: 96 | J83: 636.50 | K83: =J83*0.9 -> 572.85
A84: TS-0114 | B84: Z32 2X2 | C84: 4 | D84: UAD-188 | E84: UAD-102 | F84: UAD-103 | H84: 90 | I84: 96 | J84: 636.50 | K84: =J84*0.9 -> 572.85
A85: TS-1026 | B85: Z32 2X2 | C85: 4 | D85: UAD-129 | E85: UAD-102 | F85: UAD-103 | H85: 90 | I85: 96 | J85: 513.00 | K85: =J85*0.9 -> 461.70
A86: TS-1029 | B86: Z32 2X2 | C86: 4 | D86: UAD-130 | E86: UAD-102 | F86: UAD-103 | H86: 90 | I86: 96 | J86: 513.00 | K86: =J86*0.9 -> 461.70
A87: TS-1219 | B87: Z32 2X2 | C87: 4 | D87: AD-131 | E87: UAD-102 | F87: UAD-103 | H87: 90 | I87: 96 | J87: 513.00 | K87: =J87*0.9 -> 461.70
A88: TS-1033 | B88: Z32 2X2 | C88: 4 | D88: UAD-132 | E88: UAD-102 | F88: UAD-103 | H88: 90 | I88: 96 | J88: 513.00 | K88: =J88*0.9 -> 461.70
A89: UAD-058 | B89: Z32 | F89: F/BS w/o LK | H89: 90 | I89: 96 | J89: 260.00 | K89: =J89*0.9 -> 234.00
A90: UAD-099 | B90: Z32 | F90: F/BS BM | H90: 90 | I90: 96 | J90: 245.00 | K90: =J90*0.9 -> 220.50
A91: AD-098 | B91: Z32 | F91: F/BS w/o LK | H91: 90 | I91: 96 | J91: 245.00 | K91: =J91*0.9 -> 220.50 | L91: SO only
A92: UAD-188 | B92: Z32 | F92: F/BS BM T2 | H92: 90 | I92: 96 | J92: 260.00 | K92: =J92*0.9 -> 234.00
A93: UAD-129 | B93: Z32 TB | F93: F/US | H93: 90 | I93: 96 | J93: 130.00 | K93: =J93*0.9 -> 117.00
A94: UAD-130 | B94: Z32 NA | F94: F/US | H94: 90 | I94: 96 | J94: 130.00 | K94: =J94*0.9 -> 117.00
A95: AD-131 | B95: Z32 T2NA | F95: F/US | H95: 90 | I95: 96 | J95: 130.00 | K95: =J95*0.9 -> 117.00 | L95: SO only
A96: UAD-132 | B96: Z32 NA2T | F96: F/US | H96: 90 | I96: 96 | J96: 130.00 | K96: =J96*0.9 -> 117.00
A97: UAD-100 | B97: Z32 2st | F97: S/S | H97: 90 | I97: 96 | J97: 210.00 | K97: =J97*0.9 -> 189.00
A98: UAD-101 | B98: Z32 2st | F98: R/US | H98: 90 | I98: 96 | J98: 200.00 | K98: =J98*0.9 -> 180.00
A99: UAD-102 | B99: Z32 2X2 | F99: S/S | H99: 90 | I99: 96 | J99: 210.00 | K99: =J99*0.9 -> 189.00
A100: UAD-103 | B100: Z32 2X2 | F100: R/US | H100: 90 | I100: 96 | J100: 200.00 | K100: =J100*0.9 -> 180.00
A101: UAD-059 | B101: Z32 | F101: R/S Type 1 | H101: 90 | I101: 96 | J101: 180.00 | K101: =J101*0.9 -> 162.00
A102: UAD-060 | B102: Z32 | F102: R/S Type 2 | H102: 90 | I102: 96 | J102: 220.00 | K102: =J102*0.9 -> 198.00 | L102: Convertible?
A103: UAD-061 | B103: Z32 | F103: R/S Type 3 | H103: 90 | I103: 96 | J103: 180.00 | K103: =J103*0.9 -> 162.00
A104: UAD-135 | B104: Z32 2st | F104: R/S Type 4 | H104: 90 | I104: 96 | J104: 180.00 | K104: =J104*0.9 -> 162.00
A105: UAD-189 | B105: Z32 2X2 | F105: R/S Type 5 | H105: 90 | I105: 96 | J105: 180.00 | K105: =J105*0.9 -> 162.00
A106: AD-107 | B106: Z32 2st | F106: R/S T3+T4 | H106: 90 | I106: 96 | J106: 340.00 | K106: =J106*0.9 -> 306.00
A107: AD-190 | B107: Z32 2X2 | F107: R/S T3+T5 | H107: 90 | I107: 96 | J107: 340.00 | K107: =J107*0.9 -> 306.00
A108: UAD-145 | B108: Z32 | F108: F/Garnish T1 | H108: 90 | I108: 96 | J108: 125.00 | K108: =J108*0.9 -> 112.50
A109: UAD-146 | B109: Z32 | F109: F/Garnish T2 | H109: 90 | I109: 96 | J109: 125.00 | K109: =J109*0.9 -> 112.50
A110: UAD-258 | B110: Z32 | F110: F/Garnish T3 | H110: 90 | I110: 96 | J110: 125.00 | K110: =J110*0.9 -> 112.50
A111: UAD-259 | B111: Z32 | F111: F/Garnish T4 | H111: 90 | I111: 96 | J111: 125.00 | K111: =J111*0.9 -> 112.50
A112: AD-016 | B112: Z32 | F112: A/M T1 Manual | H112: 90 | I112: 96 | J112: 180.00 | K112: =J112*0.9 -> 162.00
A113: AD-051 | B113: Z32 | F113: A/M T1 Power | H113: 90 | I113: 96 | J113: 240.00 | K113: =J113*0.9 -> 216.00
A114: AD-017 | B114: Z32 | F114: A/M T2 Manual | H114: 90 | I114: 96 | J114: 180.00 | K114: =J114*0.9 -> 162.00
A115: AD-052 | B115: Z32 | D115: not available | F115: A/M T2 Power | H115: 90 | I115: 96 | J115: 240.00 | K115: =J115*0.9 -> 216.00 | L115: discontinued
A116: TS-3001 | B116: Sunfire | D116: UAU-101 | E116: UAU-103 | F116: UAU-105 | H116: 03 | J116: 627.00 | K116: =J116*0.9 -> 564.30 | L116: 2door
A117: TS-3002 | B117: Sunfire | D117: UAU-101 | E117: UAU-104 | F117: UAU-106 | H117: 03 | J117: 627.00 | K117: =J117*0.9 -> 564.30 | L117: 4door Available in 2004
A118: UAU-101 | B118: Sunfire | F118: F/BS | H118: 03 | J118: 230.00 | K118: =J118*0.9 -> 207.00
A119: UAU-103 | B119: Sunfire | D119: Coupe | F119: S/S | H119: 03 | J119: 200.00 | K119: =J119*0.9 -> 180.00 | L119: 2door
A120: UAU-104 | B120: Sunfire | D120: Sedan | F120: S/S | H120: 03 | J120: 200.00 | K120: =J120*0.9 -> 180.00 | L120: 4door Available in 2004
A121: UAU-105 | B121: Sunfire | D121: Coupe | F121: R/BS | H121: 03 | J121: 230.00 | K121: =J121*0.9 -> 207.00 | L121: 2door
A122: UAU-106 | B122: Sunfire | D122: Sedan | F122: R/BS | H122: 03 | J122: 230.00 | K122: =J122*0.9 -> 207.00 | L122: 4door Available in 2004
A123: UAU-107 | B123: Sunfire | D123: Coupe | F123: R/S | H123: 03 | J123: 240.00 | K123: =J123*0.9 -> 216.00 | L123: Fiber side wing
A124: UAU-107CB | B124: Sunfire | D124: Coupe | F124: R/S | H124: 03 | J124: 360.00 | K124: =J124*0.9 -> 324.00 | L124: Cabon side wing
A125: AU-108 | B125: Sunfire | D125: Sedan | F125: R/S | H125: 03 | K125: =J125*0.9 -> 0.00 | L125: reserved item number only
A126: AU-109 | B126: Sunfire | D126: Coupe | F126: A/M Manual | H126: 03 | J126: 180.00 | K126: =J126*0.9 -> 162.00 | L126: 2door
A127: AU-110 | B127: Sunfire | D127: Coupe | F127: A/M Power | H127: 03 | J127: 240.00 | K127: =J127*0.9 -> 216.00 | L127: 2door
A128: AU-111 | B128: Sunfire | D128: Sedan | F128: A/M Manual | H128: 03 | J128: 180.00 | K128: =J128*0.9 -> 162.00 | L128: 4door Available in 2004
A129: AU-112 | B129: Sunfire | D129: Sedan | F129: A/M Power | H129: 03 | J129: 240.00 | K129: =J129*0.9 -> 216.00 | L129: 4door Available in 2004
A130: TS-0109 | B130: Impreza GC8 | C130: 4 | D130: UAD-229 | E130: UAD-231 | F130: UAD-232 | H130: 93 | I130: 99 | J130: 655.50 | K130: =J130*0.9 -> 589.95 | L130: Sedan/Wagon
A131: TS-1109 | B131: Impreza GC8 | C131: 4 | D131: UAD-228 | E131: UAD-231 | F131: UAD-232 | H131: 93 | I131: 99 | J131: 532.00 | K131: =J131*0.9 -> 478.80 | L131: Sedan/Wagon
A132: TS-0110 | B132: Impreza GC8 | C132: 4 | D132: UAD-566 | E132: UAD-231 | F132: UAD-232 | H132: 93 | I132: 99 | J132: 655.50 | K132: =J132*0.9 -> 589.95 | L132: Sedan/Wagon 04'new
A133: UAD-229 | B133: Impreza GC8 | D133: Sedan/Wagon | F133: F/BS BM | H133: J | I133: J | J133: 260.00 | K133: =J133*0.9 -> 234.00 | L133: Sedan/Wagon
A134: UAD-566 | B134: Impreza GC8 | D134: Sedan/Wagon | F134: F/BS 2ite | H134: 93 | I134: 99 | J134: 260.00 | K134: =J134*0.9 -> 234.00 | L134: 04'new
A135: UAD-228 | B135: Impreza GC8 | D135: Sedan/Wagon | F135: F/US | H135: 93 | I135: 99 | J135: 130.00 | K135: =J135*0.9 -> 117.00 | L135: Turbo Sedan/Wagon
A136: UAD-231 | B136: Impreza GC8 | D136: Sedan/Wagon | F136: S/S | H136: 93 | I136: 99 | J136: 200.00 | K136: =J136*0.9 -> 180.00 | L136: Sedan/Wagon
A137: UAD-232 | B137: Impreza GC8 | D137: Sedan/Wagon | F137: R/BS | H137: 93 | I137: 99 | J137: 230.00 | K137: =J137*0.9 -> 207.00 | L137: Sedan/Wagon
A138: UAD-230 | B138: Impreza GC8 | D138: Sedan/Wagon | E138: before m/c | F138: F/Grill | H138: 93 | I138: 96 | J138: 100.00 | K138: =J138*0.9 -> 90.00 | L138: Sedan/Wagon
A139: UAD-227 | B139: Impreza GC8 | D139: Sedan/Wagon | E139: after m/c | F139: F/Grill | H139: 97 | I139: 99 | J139: 100.00 | K139: =J139*0.9 -> 90.00 | L139: Sedan/Wagon
A140: UAD-233 | B140: Impreza GC8 | D140: Sedan | F140: R/S | H140: 93 | I140: 99 | J140: 180.00 | K140: =J140*0.9 -> 162.00 | L140: Sedan
A141: AD-423 | B141: Impreza GC8 | D141: Sedan/Wagon | F141: A/M T1 Manual | H141: 93 | I141: 99 | J141: 180.00 | K141: =J141*0.9 -> 162.00 | L141: Sedan/Wagon
A142: AD-424 | B142: Impreza GC8 | D142: Sedan/Wagon | F142: A/M T1 Power | H142: 93 | I142: 99 | J142: 240.00 | K142: =J142*0.9 -> 216.00 | L142: discontinued
A143: AD-425 | B143: Impreza GC8 | D143: Sedan/Wagon | F143: A/M T2 Manual | H143: 93 | I143: 99 | J143: 180.00 | K143: =J143*0.9 -> 162.00 | L143: Sedan/Wagon
A144: AD-426 | B144: Impreza GC8 | D144: Sedan/Wagon | F144: A/M T2 Power | H144: 93 | I144: 99 | J144: 240.00 | K144: =J144*0.9 -> 216.00 | L144: discontinued
A145: TS-2001 | B145: WagonR CT, CV | D145: S-031 | E145: S-035 | F145: S-036 | J145: 456.00 | K145: =J145*0.9 -> 410.40 | L145: Special Order Only
A146: TS-2002 | B146: WagonR MC | D146: S-070 | E146: S-071 | F146: S-072 | J146: 498.75 | K146: =J146*0.9 -> 448.875 | L146: Special Order Only
A147: S-031 | B147: WagonR CT, CV | D147: before | F147: F/BS | J147: 160.00 | K147: =J147*0.9 -> 144.00 | L147: Special Order Only
A148: S-032 | B148: WagonR CT, CV | D148: before | F148: F/US | K148: =J148*0.9 -> 0.00 | L148: discontinued
A149: S-035 | B149: WagonR CT, CV | D149: before | F149: S/S | J149: 160.00 | K149: =J149*0.9 -> 144.00 | L149: Special Order Only
A150: S-036 | B150: WagonR CT, CV | D150: before | F150: R/BS | J150: 160.00 | K150: =J150*0.9 -> 144.00 | L150: Special Order Only

A1: S-033 | B1: WagonR CT, CV | D1: before | F1: F/Grill T1 | K1: =J1*0.9 -> 0.00 | L1: discontinued
A2: S-034 | B2: WagonR CT, CV | D2: before | F2: F/Grill T2 | J2: 100.00 | K2: =J2*0.9 -> 90.00 | L2: Special Order Only
A3: S-037 | B3: WagonR CT, CV | D3: before | F3: R/S | K3: =J3*0.9 -> 0.00 | L3: discontinued
A4: S-070 | B4: WagonR MC | D4: after | F4: F/BS | J4: 180.00 | K4: =J4*0.9 -> 162.00 | L4: Special Order Only
A5: S-071 | B5: WagonR MC | D5: after | F5: S/S | J5: 165.00 | K5: =J5*0.9 -> 148.50 | L5: Special Order Only
A6: S-072 | B6: WagonR MC | D6: after | F6: R/BS | J6: 180.00 | K6: =J6*0.9 -> 162.00 | L6: Special Order Only